url,text
https://www.peters.senate.gov/newsroom/press-releases/peters-led-provisions-in-national-defense-bill-signed-into-law,"President Biden Signs Peters-Backed Bill to Raise Pay for Servicemembers, Bolster U.S. Global Competitiveness, Strengthen National Security and Expand Michigan’s Military FootprintDETROIT, MI – President Biden today signed into law the annual national defense bill that includes numerous provisions from U.S. Senator Gary Peters (MI) to strengthen our national security, vitalize Michigan’s growing defense sector and support our nation’s veterans and servicemembers. The bill also includes nearly $144 million in investments that Peters – who serves on the Senate Armed Services Committee – secured for military facilities across Michigan. Passage of the legislation also comes after Peters hosted Deputy Defense Secretary Kathleen Hicks at Selfridge Air National Guard Base earlier this month to highlight defense innovation and Michigan’s contributions to our national defense. “The national defense bill is critical to maintaining our competitiveness on the global stage – particularly as other nations, like the Chinese government, look to expand their influence,” said Senator Peters, a former Lieutenant Commander in the U.S. Navy Reserve and member of the Senate Armed Services Committee. “I’m pleased this bipartisan bill was signed into law – which not only helps solidify the Department of Defense’s commitment to Michigan – but provides a pay raise for servicemembers, helps address PFAS contamination and supports innovative military research and development that’s happening in Michigan.”“Michigan is fortunate to have Senator Peters as an advocate who works to advance our priorities and ensures the Michigan National Guard receives the federal investments necessary to support all of our missions,” said U.S. Army Major General Paul D. Rogers, Adjutant General and Director of the Michigan Department of Military and Veterans Affairs. “His work on the NDAA will ensure Michigan is well positioned to continue to grow as a premier destination for military training and next generation mission sets.”The National Defense Authorization Act, which sets annual policy for the Department of Defense (DOD), has been enacted into law for 60 consecutive years. The following provisions Peters led or supported were included in the final bill sent to the President:Investing in Michigan Military Facilities:Supporting Michigan’s Defense Sector and Advanced Technology: Supporting Our Troops and Their Families:Strengthening Our National Security:Addressing PFAS Contamination:###"
https://www.peters.senate.gov/newsroom/press-releases/video-peters-continues-to-deliver-results-for-michigan-in-2021-after-being-rated-1-most-effective-senator-in-us-senate-and-being-named-chair-of-the-homeland-security-and-governmental-affairs-committee,"Peters Releases Series of Videos Highlighting Some of the Many 2021 Accomplishments for MichiganDETROIT, MI – Throughout 2021, U.S. Senator Gary Peters (MI) continued to deliver results for Michigan. In March, Peters was recognized as the #1 most effective Senator in the 116th Congress by the non-partisan Center for Effective lawmaking. Peters earned this recognition based on his ability to enact and advance bipartisan legislation – despite the fact that he was serving in only his first term and was in the minority party at the time. Peters built off this distinction and continued delivering results for Michigan this year, including as Chairman of the Homeland Security and Governmental Affairs Committee.Today, Peters released a series of videos highlighting some of the many accomplishments this year. Whether it was:See below on how Senator Peters has achieved results for Michigan this year:Peters helped pass the American Rescue Plan into law to deliver COVID-19 relief to Michiganders. The package included funding to distribute direct stimulus checks, accelerate vaccine distribution, help schools reopen safely, extend unemployment benefits, and support small businesses. As Chairman of the Homeland Security and Governmental Affairs Committee, Peters authored provisions in the bill that dramatically ramped up mass vaccine distribution – like we saw at Ford Field. Also included was the expanded Child Tax Credit – a tax cut that has helped support the immediate needs of Michigan families such as food, clothes and child care. The bill also reauthorized and provided $10 billion in federal funding to the State Small Business Credit Initiative, including $1.5 billion set-aside for minority-owned businesses, which helps small businesses grow and create jobs. Peters previously led the effort to reauthorize the program in the Senate and championed the original language creating the program in the Small Business Jobs Act of 2010 as a member of the House of Representatives. To further his work to keep the Great Lakes clean, Peters authored and passed legislation into law to create the U.S. Coast Guard Great Lakes Center of Expertise for Oil Spill Preparedness and Response to study the impacts of oil spills in freshwater environments. The inspiration for this bill came in 2017 when the then-Commandant of the U.S. Coast Guard told Peters at a hearing that the agency was not prepared for an oil spill in the Great Lakes, saying that more science and research was needed. In October, Peters announced that the Center of Expertise will be headquartered in Michigan with locations in Sault Ste. Marie and Ann Arbor. Peters helped pass the bipartisan Infrastructure Investment and Jobs Act into law, which invests in Michigan infrastructure, including roads, bridges, high-speed internet, electric vehicles and the Great Lakes. The legislation provides $1 billion for the Great Lakes Restoration Initiative (GLRI), which is the largest investment in the program in history. In 2019, Peters secured the first increase in GLRI funding since the program was established a decade ago.As Chairman of the Homeland Security and Governmental Affairs Committee, Peters secured a historic $500 million provision to help Michigan communities address the impacts of natural disasters as a part of the new law. The Senator secured the first funding for a loan program he created to help states establish revolving loan funds for local governments to carry out mitigation projects that reduce natural disaster risk. These projects could include upgrades to address extreme flooding, shoreline erosion and rising water levels that have put homes, small businesses, property, and communities at risk, and caused millions of dollars in damages – especially in Michigan. Peters authored the bipartisan Safeguarding Tomorrow through Ongoing Risk Mitigation (STORM) Act, which was signed into law earlier this year, to create this new loan program. Peters highlighted how the program could help communities across Michigan like Oak Park and Grand Rapids.  As Chairman of the Homeland Security and Governmental Affairs Committee, Peters held a hearing about how communities in Michigan and across the country have been harmed by exposure to toxic Perfluoroalkyl and Polyfluoroalkyl Substances (PFAS) connected to military sites. Peters convened the hearing after a Department of Defense (DoD) Inspector General report found that DoD failed to adequately control PFAS contamination at military sites across the nation – resulting in preventable harm to servicemembers, their families, and the surrounding communities. At the hearing, Peters raised the need to hold DoD accountable for their failure to act – and that they must do more to help clean up contaminated sites. ###"
https://www.peters.senate.gov/newsroom/press-releases/peters-introduces-bipartisan-bill-to-streamline-federal-manufacturing-support-programs,"DETROIT, MI – U.S. Senator Gary Peters (MI) announced he introduced bipartisan legislation to streamline federal efforts to boost domestic manufacturers and support workers. The Strengthening Support for American Manufacturing Act, which Peters introduced with U.S. Senator Marsha Blackburn (R-TN), would assess the U.S. Department of Commerce’s efforts to support manufacturers and suggest solutions to improve the Department’s manufacturing programs to better serve manufacturers – many of which are small businesses. This bill builds on Peters’ efforts to coalesce U.S. manufacturing policy by establishing a National Institute of Manufacturing that would serve as a hub for federal manufacturing programs – and comes as the U.S. works to mitigate global supply chain issues caused by the pandemic that have hurt workers and disrupted industries nationwide.“You can’t be a great country if you don’t make things – and in Michigan, manufacturing has been a core part of our state’s economy. It is essential we have a streamlined federal manufacturing strategy that can support businesses, create good-paying jobs, and secure our economic competitiveness on the world stage,” said Senator Peters, a member of the Senate Commerce, Science, and Transportation Committee. “However, for too long our country has lacked a coherent, national manufacturing strategy like our foreign competitors – particularly the Chinese government. Additionally, federal support for manufacturers is often fractured, uncoordinated and difficult to navigate. That’s why I was proud to introduce this bipartisan bill to generate a more efficient, unified approach to federal manufacturing policy, and ensure we remain a global manufacturing leader for generations.”“The global supply chain crisis resulting from our dependence on Communist China underscored the importance of strengthening American manufacturing,” said Senator Blackburn. “The Strengthening Support for American Manufacturing Act will streamline programs run by the Department of Commerce to eliminate government waste and improve efficiency. This legislation will benefit the manufacturing community based in Tennessee and across the U.S.”The Government Accountability Office (GAO) released a report in 2017 identifying 58 programs across 11 different federal agencies that serve U.S. manufacturing, several of which are housed within the U.S. Department of Commerce. The vast number of programs may complicate their administration and presents a barrier to manufacturers knowing about and accessing valuable resources. The Strengthening Support for American Manufacturing Act would address these issues by identifying ways to improve the Commerce Department’s management of these programs, and putting forth legislative recommendations to create a single agency responsible for administering them.Peters has made strengthening domestic manufacturing and supply chains a top priority. He introduced legislation in 2019 to establish the National Institute of Manufacturing to connect manufacturers to critical resources and function as the focal point for developing a national strategy, ensuring American manufacturing policy can rapidly respond to changes in the global marketplace. Peters, who serves as Chairman of the Subcommittee on Surface Transportation, Maritime, Freights, and Ports, recently led a hearing that examined ocean shipping supply chain challenges caused by the COVID-19 pandemic and how these supply chain disruptions have caused businesses and consumers to experience major delays and price increases. Peters also championed a provision included in the bipartisan infrastructure law to strengthen Buy American requirements and close loopholes to ensure that the federal government is spending taxpayer dollars on American-made products that support American companies and workers, and create American jobs. In September, Peters’ bipartisan legislation to revamp the Manufacturing.gov website to serve as a one-stop hub to connect manufacturers with federal manufacturing programs and resources passed the U.S. Senate.As part of the U.S. Innovation and Competition Act, Peters helped secure provisions to promote domestic production of personal protective equipment and strengthen the Manufacturing Extension Partnership to boost small- and medium-sized manufacturers. The competitiveness bill additionally included Peters’ bipartisan legislation to revive and elevate the National Manufacturing Advisory Council. The Council advises the federal government on manufacturing programs and provides private sector guidance and insight to the federal government, but it has only met intermittently in recent years. Peters’ legislation would revive and elevate the Council, establishing it as a critical component in federal manufacturing policy and strategy.Peters also secured multiple provisions in the competitiveness package to address the ongoing semiconductor shortage, including to create a $2 billion supplemental incentive fund to support the domestic production of mature semiconductor technologies in the coming years and ensure that semiconductor projects that support critical manufacturing industries are given priority status, which would include the automotive sector. This is in addition to $50 billion already in the bill to incentivize the production of semiconductors of all kinds in the U.S.—for a total of $52 billion. In November, Peters hosted a roundtable in Taylor, Michigan with Secretary of Commerce Gina Raimondo to discuss ways to improve domestic manufacturing and strengthen U.S. supply chain resilience.###"
https://www.peters.senate.gov/newsroom/press-releases/peters-statement-on-biden-administrations-vehicle-emissions-standards-announcement,"DETROIT, MI – U.S. Senator Gary Peters (MI), a member of the Senate Commerce, Science and Transportation Committee, released the following statement today on the U.S. Environmental Protection Agency (EPA)’s vehicle emissions standards announcement:“Climate change is a threat to Michigan’s Great Lakes and our economy – and it’s critical we address it in a way that not only protects our state for future generations, but creates jobs and strengthens our economy. Today’s announcement is an important step towards improving our economic competitiveness on the global stage while positioning Michigan and our state’s autoworkers to continue driving innovation forward.“The future of mobility is electric – and I applaud the incredible innovation that’s happening in Michigan with electric vehicle manufacturing. I will continue working with the Biden Administration and American auto leaders to not only boost electric vehicle manufacturing and adoption, but ensure we have a robust national emission framework in place that can combat climate change while supporting American auto manufacturers, suppliers and workers.”###"
https://www.peters.senate.gov/newsroom/press-releases/peters-bipartisan-legislation-to-help-improve-federal-workforces-understanding-of-artificial-intelligence-passes-senate,"Legislation Would Require Training for Federal Employees Who Procure and Manage Artificial Intelligence Technology to Ensure It Is Used Safely and EthicallyWASHINGTON, D.C. – Legislation authored by U.S. Senator Gary Peters (MI), Chairman of the Homeland Security and Governmental Affairs Committee, that would help bolster the federal workforce’s understanding of artificial intelligence (AI) has passed the Senate. The bill would create a training program to help federal employees responsible for purchasing and managing AI technologies better understand the capabilities and risks they pose to the American people. It would also help ensure the United States maintains a global leadership role in rapidly developing technologies as foreign competitors like the Chinese government continue to prioritize investments in AI technologies. The bill now moves to the U.S. House of Representatives for consideration.“In order to use artificial intelligence properly and in a way that ensures our nation can compete with our foreign adversaries – federal workers need to understand the technical and ethical implications of these technologies for the safety, security, and freedoms of Americans,” said Senator Peters. “This important bill will help our government better understand artificial intelligence and ensure we are using it in a manner that is consistent with American values and our democracy.”The National Security Commission on Artificial Intelligence has raised the need to train the federal workforce on AI, especially those who procure and manage these technologies. While there are clear benefits to using AI, experts remain concerned that if used improperly, this technology could harm U.S. citizens and compromise national security. The Artificial Intelligence Training for the Acquisition Workforce Act would help train federal employees who purchase and manage AI technology for government agencies to ensure it is being used for the betterment of all communities.The bipartisan bill would require the Director of the Office of Management and Budget (OMB) to provide and regularly update an AI training program for federal employees who manage and purchase this technology for the federal government. The training aims to help federal employees better understand the benefits of AI, as well as the ethical and national security risks posed by these technologies. The legislation also encourages the OMB director to work with scholars and experts from the public and private sectors to create the training. It would also ensure that OMB is tracking the participation and feedback of participants to identify possible ways to improve the training.The legislation builds on Peters’ efforts to ensure AI is used safely and ethically. His bipartisan legislation to secure and protect information handled by federal contractors using artificial intelligence (AI) technology, such as biometric data from facial recognition scans, has advanced in the Senate. A provision Peters helped author to ensure that the use of AI across the federal government is effective, ethical, and accountable by providing resources and guidance to federal agencies was signed into law as a part of last year’s government funding bill.###"
https://www.peters.senate.gov/newsroom/press-releases/peters-stabenow-announce-confirmation-of-two-michigan-us-district-court-judges,"U.S. Senate Votes to Confirm Judge Shalina Kumar as U.S. District Court Judge for the Eastern District of Michigan and Judge Jane Beckering as U.S. District Court Judge for the Western District of MichiganWASHINGTON, DC - U.S. Senators Gary Peters and Debbie Stabenow announced the U.S. Senate has confirmed the nominations of Judge Shalina Kumar and Judge Jane Beckering. Judge Shalina Kumar was confirmed to be the U.S. District Court Judge for the Eastern District of Michigan, and Judge Jane Beckering was confirmed to be the U.S. District Court Judge for the Western District of Michigan. Judge Kumar will be the first federal judge of South Asian descent in Michigan.On October 6, the U.S. Senate Judiciary Committee held a hearing considering their nominations. At these links you can find videos of the entire hearing, Senator Peters' remarks and Senator Stabenow's remarks.“I’m pleased the Senate voted to confirm the nominations of Judge Shalina Kumar and Judge Jane Beckering,” said Senator Peters. “Judge Kumar is an accomplished jurist whose appointment breaks barriers as the first Michigander of South Asian descent to serve on the federal bench in our state. Judge Beckering is highly qualified and has extensive experience serving on the Michigan Court of Appeals and in private practice. I know both women will serve the people of Michigan and our nation well.”“Judge Kumar and Judge Beckering are two outstanding and highly qualified women. Judge Kumar is a respected Chief Judge of the Oakland County Sixth Circuit Court, and I know she will continue her excellent work as a federal judge. Judge Beckering is a highly qualified judge on the Michigan Court of Appeals and has extensive experience serving in Michigan. Their confirmation is great news for Michigan,” said Senator Stabenow.On June 30, President Biden nominated Judge Kumar and Judge Beckering to serve as U.S. District Court judges for the Eastern District and Western District of Michigan, respectively.Chief Judge Shalina D. Kumar has served on the Oakland County Sixth Circuit Court since 2007. She was appointed Chief Judge of the Circuit Court by the Michigan Supreme Court in January of 2018. In addition to her chief judge duties, Judge Kumar retains a full caseload covering both civil and criminal matters. Throughout her years on the bench, Judge Kumar has served as a presiding judge of the Adult Treatment Court, the Chairperson of the Oakland County Criminal Assignment Committee, the bench liaison to the Oakland County Bar Association Circuit Court Committee, a member of the Michigan State Bar Professionalism Committee, and a member of the Executive Committee of the Michigan Judges’ Association. Prior to taking the bench, Judge Kumar was a civil litigator in private practice from 1997 to 2007, including as an associate with Weiner & Cox P.L.C. from 2004 to 2007 and Sommers, Schwartz, Silver & Schwartz P.C. from 2000 to 2004. Judge Kumar graduated from the University of Michigan in 1993 and the University of Detroit-Mercy School of Law in 1996.Judge Jane M. Beckering has served on the Michigan Court of Appeals since 2007, where she oversees both civil and criminal proceedings. Judge Beckering is the Chief Judge Pro Tempore of the Court. She is also President-Elect of the Grand Rapids Bar Association and previously served on the Michigan Supreme Court Committee on Model Civil Jury Instructions. Prior to becoming a judge, Judge Beckering was a trial lawyer in private practice for 17 years. She founded the law firm of Buchanan & Beckering, PLC in Grand Rapids, Michigan, primarily focused on representing plaintiffs in civil litigation. She began her law career as an associate with McDermott, Will & Emery, P.C. in Chicago. Judge Beckering received her J.D. from the University of Wisconsin in 1990 and her B.A. from the University of Michigan in 1987.###"
https://www.peters.senate.gov/newsroom/press-releases/video-peters-delivers-commencement-address-at-michigan-state-university,"EAST LANSING, MI – U.S. Senator Gary Peters (MI) delivered the Master’s and Educational Specialist degree commencement address at Michigan State University today. Peters – who earned a M.A. in Philosophy with a specialization in ethics and development from MSU – highlighted the resilience demonstrated by the graduating class throughout the pandemic and spoke to the promise each graduate’s future holds entering a new frontier of discovery and innovation with a world class education in hand.“It took a special kind of spirit to navigate the turbulence of the past few years. But through your hard work, your tenacity, and your courage you triumphed,” said Senator Peters in his address. “As Michigan State advanced degree graduates, you are among the world's best and the brightest. And I can’t help thinking about what an exciting time this is to be graduating. In fact, I believe we are living during the most exciting period of human history. Although, without question, we will face significant challenges, we will also have unbridled opportunity to change our world in powerful ways and you will be the ones who lead us through it.”“As members of the Class of 2021, you will be the ones who build a better future for our state, our nation, and for the entire world. I can’t imagine a group of future leaders who are better prepared,” Senator Peters continued. “I hope that you will use your knowledge, and your experience, to anticipate what the future might bring. To identify the challenges that we will need to address, and to find compassionate answers that go beyond improving efficiencies or making a profit. I hope that you will look back on all the difficulties we have all faced over the past two years and remember that the things that make us human, and the connections that bring us together are worth fighting for, and worth placing at the heart of whatever you choose to pursue in the years ahead.”To watch video of Senator Peters’ commencement address, click here or on the image above.Peters has been honored to represent the State of Michigan in the U.S. Senate since 2015. In the 117th Congress, he is the Chairman of the Senate Homeland Security and Governmental Affairs Committee, which oversees the Department of Homeland Security and is the Senate’s top oversight committee. He also serves on the Senate Armed Services Committee and the Senate Commerce, Science, and Transportation Committee.Most recently, Peters was rated by the Center for Effective Lawmaking as the most effective Senator in the 116th Congress. That’s despite serving in the minority during that time – and he was the first Senator in the minority to be rated the most effective since the Center started tracking that data over 50 years ago. In that time, he authored legislation into law ranging from increasing protections for the Great Lakes to strengthening our nation’s security at our borders and expanding apprenticeships for veterans.Peters was born in Pontiac, Michigan and has lived his entire life in the state. He’s also a proud product of Michigan schools.###"
