url,text
https://www.burr.senate.gov/2021/4/sens-burr-tillis-reintroduce-lumbee-federal-recognition-bill-,"Today, Senators Richard Burr (R-NC) and Thom Tillis (R-NC) reintroduced the Lumbee Recognition Act, legislation to grant long-overdue federal recognition to the Lumbee Tribe of North Carolina.“For more than 130 years, the Lumbees have sought the same federal recognition that other tribes across the nation enjoy,” said Senator Burr. “This federal recognition will help the Lumbee people not only improve their economy, but enhance their health care systems and schools.“Despite broad bipartisan support of this legislation over the last three decades, Congress has yet to act on this important bill. This has been a grave disservice to the Lumbee people and the rich culture the tribe contributes to North Carolina. It’s time to get this done. I urge the Senate to swiftly pass this bill.”“The Lumbee Tribe has been fighting for more than a century to gain federal recognition and, as long as I’m in the U.S. Senate, I’m going to continue my work to make sure this happens,” said Senator Tillis. “I am proud to co-introduce this legislation again and continue my work with Senator Burr to get this legislation across the finish line.”Background: The Lumbee Tribe is the largest American-Indian tribe in the Eastern United States. In 1885, North Carolina formally recognized the Lumbee Tribe. Three years later, the Tribe began to seek federal recognition. In 1956, Congress finally passed legislation recognizing the tribe, but the bill included an unfair caveat that denied the Lumbee benefits that every other federally-recognized tribe receives.Senator Burr has been an unwavering advocate of the Lumbee Tribe. In 2007, Senator Burr first introduced the Lumbee Recognition Act and has since testified multiple times before the Senate Committee on Indian Affairs on the tribe’s qualifications and unjust treatment.The Lumbee Recognition Act has broad bipartisan support. In October 2020, then-presidential candidate Joe Biden and President Donald Trump announced their support of federal recognition for the Lumbee Tribe. Since 1988, legislation to federally recognize the Lumbee Tribe has been introduced in Congress 29 separate times – 15 times by a Democrat and 14 times by a Republican.Representatives G.K. Butterfield (D-NC), Dan Bishop (R-NC), David Price (D-NC), and Richard Hudson (R-NC) introduced companion legislation in the House of Representatives on April 22, 2021."
https://www.burr.senate.gov/2021/4/burr-us-must-foster-greater-innovation-at-home-mitigate-potential-foreign-influence-risks-to-maintain-edge,"Today, the Senate Health, Education, Labor and Pensions (HELP) Committee held a hearing entitled, “Protecting U.S. Biomedical Research: Efforts to Prevent Undue Foreign Influence.” This is the first hearing the Committee has held with Administration officials to examine foreign threats to American biomedical research in the 117thCongress.In his prepared opening statement, Senate HELP Committee Ranking Member Richard Burr (R-NC) detailed the credible, ongoing threats to America’s biomedical research enterprise by foreign adversaries, most notably the People’s Republic of China. Ranking Member Burr also highlighted the valuable role of the private sector, academia, and global collaboration in maintaining America’s leadership in biomedical innovation.WATCH: Ranking Member Burr delivers opening statement before Committee hearing on protecting American investment in biomedical researchExcerpts:“From where I sit now, and how I spend my time, I want to impress upon my colleagues here today – this threat is real, it is credible, and it is dangerous to our way of life in America.“We cannot be complacent.“This hearing is about the efforts of foreign actors to influence the biomedical research enterprise.“The Government of the People’s Republic of China and the Chinese Communist Party are the most sophisticated perpetrators, but other foreign actors are also engaged in efforts to subvert our biomedical research. “Our adversaries are engaging in a systematic effort to infiltrate the academic research community and siphon away the results of United States spending on biomedical research...“Our enemies are targeting vulnerabilities in our biomedical research enterprise because it is an easy target...This means that our advancements in biomedical research are at grave risk. It means that the billions of taxpayer dollars that are invested each year toward discoveries are leveraged or outright stolen by our adversaries. And, it means that our enemies can capitalize on the billions of dollars that American taxpayers invest every year to beat us to the punch on the next game-changing technology to save lives or to cause unimaginable harm.…“This year, Congress appropriated 43 billion dollars to the NIH for biomedical research.  And we know that over time, for every one dollar spent on basic research at the NIH, the private sector spends about eight dollars. “That’s a lot of money, and the United States has historically been the undisputed leader in biomedical innovation, so it’s easy to see why the government of China is trying to steal our secrets and eliminate our competitive advantage. “Global collaboration has been, and will always be, the key to our success in maintaining global leadership in our advancements... “So, we must think about how to foster greater innovation at home, mitigate potential risks associated with foreign influence, and maintain our edge.“Because deception and theft are not a valid competitive tool, and we need to be aware that this is happening more than we’d like to admit.“I made this case for Five Eyes partners, the intelligence alliance comprising Australia, Canada, New Zealand, the United Kingdom, and the United States, to tackle the issue of 5G for our cellular technology, and I think it also makes sense when we discuss our funding and advancements in biomedical research.…“North Carolina benefits each year from over $1 billion in NIH-funded research. “Along with their accomplishments and discoveries, our research institutions have seen firsthand what our enemies will do to steal our most valuable secrets and assets in research. “There is a concerted effort by individuals from China, backed by their government, to be educated in America and to work for 10 years here, with the full intent to bring back to China’s government everything they can learn, store, or steal.“I have cautioned the research institutions in my state to prepare for a reality with different revenue streams, and encouraged them to rely less on researchers from the countries whose governments seek to do us harm. “We must balance the rewards of this research with the risks to our country. …“This threat reaches into many facets of our country.“The private sector is also experiencing this threat, and our solutions to these issues will require their input, participation, and partnership.“There is no easy path, but if we concede the innovation race, our global competitiveness and our national security will be at risk.”To read Ranking Member Burr’s full opening statement, click here. "
https://www.burr.senate.gov/2021/4/burr-workforce-development-should-continue-to-be-space-for-bipartisan-solutions,"Today, the Senate Health, Education, Labor and Pensions (HELP) Committee held a hearing entitled, “COVID-19 Recovery: Supporting Workers and Modernizing the Workforce Through Quality Education, Training, and Employment Opportunities.” This is the first hearing the Committee has held on workforce development amid the coronavirus pandemic in the 117th Congress. In his prepared opening remarks, Senate HELP Committee Ranking Member Richard Burr (R-NC) highlighted the opportunity for bipartisanship by enhancing specialized job training programs and harnessing innovation to build a strong American workforce that keeps pace with the demands of the 21st century global economy.WATCH: Ranking Member Burr delivers opening remarks before the Committee’s hearing on American workforce developmentExcerpts: “I’m glad that we are working together in a bipartisan effort to modernize our workforce programs and I hope that Democrat leadership will stop their threats to use a partisan reconciliation bill and commit to listening to Republican ideas and working together, as we are doing in this Committee. “If we want to return to a booming economy, we need a plan to get there. As part of that plan, we need to make sure we have better systems in place that are equipped to connect job-seekers, employers, and education opportunities... “As we begin these discussions on how best to help American workers get the skills they need, we have to look at what we have already done and what new ideas we need to include. “We can start with the Workforce Innovation and Opportunity Act. This is our country’s primary law focused on workforce development, and it’s due to be reauthorized. We need to take this opportunity to see how this important law can be updated to meet the needs of workers and employers…“We need to be innovative. More bureaucracy and paperwork is not the answer. We have to look at the system as a whole and make sure it is equipped to meet the demands of 2021 and beyond…“If we want these programs to prepare people for good jobs, employers need to have a seat at the table. If training programs do not teach anyone the skills employers are actually looking for then we haven’t really helped anyone.“We need to make sure that this law fosters strong collaboration between the public and private sector... “Last year, state and local workforce boards had to respond to the pandemic and quickly adapt to a world where virtual services are the norm. These systems should be able to rapidly respond to meet the needs of their community, and we need to make sure that the law supports this responsiveness.... “The apprenticeship model is a great way for individuals to earn a wage while learning an in-demand skill. Unfortunately many employers are unable to access the federal system because of red tape and rules that favor labor unions.“We saw a glimpse of the type of innovation we need through the Department of Labor’s rule on Industry Recognized Apprenticeship Programs that was issued by the previous Administration. This policy can expand the apprenticeship model to include more industries and provide new opportunities for training.“To build on this idea, a bipartisan apprenticeship bill will need to find a way to support both traditional registered apprenticeship programs and programs that are developed and recognized by industry.“I understand that there are important conversations to be had about accountability and quality for industry recognized apprenticeship programs, and we welcome that.“We need all the tools in our toolbox to get people back to work – an ‘all of the above’ approach. But that does not mean we need to create a variety of new programs. “The federal government already funds dozens of training programs across multiple federal agencies. We need to take a look at how we can improve and better align these programs, not just add a new layer of programs and mandates, so that state and local leaders, employers, and job seekers can reap the maximum benefits.“Workforce development has been and should continue to be a space for bipartisan solutions.…“This is just the beginning of the conversation. We all have a big task ahead of us.“I look forward to working with our witnesses, Chair Murray, and our colleagues to get our workforce programs up to speed and our country back to work.”To read Ranking Member Burr’s full prepared opening statement, click here."
https://www.burr.senate.gov/2021/4/senators-burr-klobuchar-reintroduce-9-1-1-saves-act-highlight-dispatchers-life-saving-work-,"In recognition of National Public Safety Telecommunicators Week, Senators Richard Burr (R-NC) and Amy Klobuchar (D-MN) this week reintroduced the 9-1-1 SAVES Act, which would update the Standard Occupational Classification (SOC) to better reflect the life-saving work 9-1-1 telecommunicators and dispatchers perform each day.“This week, we recognize the life-saving work of 9-1-1 dispatchers across North Carolina and the country,” said Senator Burr. “As the co-chair of the Congressional Next Generation 9-1-1 Caucus, I’m proud to work with Senator Klobuchar on this bipartisan initiative to reclassify the role of emergency dispatchers to better reflect their important responsibilities and the difference they make daily.”“No matter where you are, if you dial 9-1-1, dispatchers are there to connect you to first responders,” said Senator Klobuchar. “This legislation makes important updates to the classification of 9-1-1 dispatchers to better capture the complex and technical nature of their occupations while also providing valuable statistical tools for federal agencies. I’m proud to work with Senator Burr to properly highlight dispatchers’ roles as safety leaders during times of crisis and the work they do to keep our communities safe.”Background:The Standard Occupational Classification (SOC) is a tool used by federal agencies to classify the workforce into useful, occupational categories. Currently, the SOC system categorizes 9-1-1 call takers and dispatchers as “Office and Administrative Support Occupations,” which also includes secretaries, office clerks, and taxi cab dispatchers.The 9-1-1 SAVES Act would instead recognize these dispatchers as “Protective Service Occupations,” which includes lifeguards, firefighters, TSA baggage screeners, among others.As co-chairs of the Congressional Next Generation 9-1-1 Caucus, Senators Burr and Klobuchar earlier this year reintroduced the Emergency Reporting Act, legislation to improve the resiliency of communication networks during emergencies, including hurricanes. Specifically, this legislation directs the FCC to work with state and local governments to improve the standards of mobile carriers in reporting network outages to 9-1-1 centers."
https://www.burr.senate.gov/2021/4/burr-cancelling-extraordinary-amounts-of-student-loan-debt-wrong-solution-for-borrowers-taxpayers,"Today, the Senate Health, Education, Labor and Pensions (HELP) Committee held its nomination hearing for James Kvaal to serve as the Under Secretary of the U.S. Department of Education.In his prepared opening remarks, Senate HELP Committee Ranking Member Richard Burr (R-NC) underscored his disapproval of massive student loan debt forgiveness and offered his legislation, the Repay Act, as an alternative and sustainable bipartisan policy solution that simplifies repayment options for borrowers by establishing one easy-to-navigate income-based repayment plan.WATCH: Ranking Member Burr delivers opening remarks before the nomination hearing for James Kvaal to serve as Under Secretary of Education.Excerpts:“I want to be clear about some worries I have about proposals by some of my colleagues on the other side of the aisle, as well as suggestions within the Biden Administration, to cancel extraordinary amounts of outstanding federal student loan debt.“I firmly believe this is the wrong solution to what I think most of us agree are challenges faced by many current and future student loan borrowers.“The Higher Education Act – or HEA – was enacted in 1965. Are we supposed to believe that for the last 56 years that the HEA has been in place, the Secretary has been able to cancel vast amounts of debt for every single borrower in the United States this whole time and we just didn’t know about it until now?“Mr. Kvaal, I must be honest with you and with everyone else on this Committee: this does not pass the laugh test.“Importantly, I believe the negative implications of unilaterally cancelling outstanding federal student loan debt would be more than enough to deem this bad policy.“For starters, this has a one-time cost of as much as one trillion dollars shifting that burden onto unsuspecting taxpayers. It’s also a regressive policy, meaning it will benefit the rich, mostly people who will already earn more because of their college education. It would be a huge gift particularly for Americans with student loan debt from graduate school who disproportionately earn higher incomes. It is also a very poorly targeted use of federal resources that does nothing to benefit the more than 200 million Americans that do not have federal student debt and never attended college. Finally, the promise of cancelling mass amounts of student loan debt creates a significant moral hazard.“So, we know what will happen if we cancel tens of thousands of dollars of student loan debt for individual borrowers. What will stop schools from raising tuition higher and higher and digging an even deeper debt hole? Without institutional accountability, will you be asking the American taxpayer to foot another loan forgiveness scheme every 5, 10, 15, 20 years? Where does it end?“In addition to asking colleges and universities to play their part to stem this debt spiral, I have a better idea for loan repayment. A few weeks ago, my colleague Angus King and I reintroduced the Repay Act.“Instead of making students choose between nine unique loan repayment plans, our plan would allow borrowers to choose between two simple plans.“The first is what most borrowers already pay now: a fixed, 10-year repayment option. The second is a Simplified Income-Driven Repayment Plan. It simultaneously accounts for how much a student borrowed, and how much they currently earn.“I believe the Repay Act is a commonsense solution to our over-complicated student loan repayment system. It’s fair to students and fair to taxpayers.“Mr. Kvaal, if confirmed, I would look forward to working with you on this pragmatic bipartisan solution and others, and I hope you would do the same.”To read Ranking Member Burr’s full prepared opening remarks, click here."
https://www.burr.senate.gov/2021/4/senator-burr-statement-on-announced-withdrawal-of-us-forces-from-afghanistan,"Today, Senator Richard Burr (R-NC) released the following statement in response to the announcement that President Biden intends to withdraw all U.S. forces from Afghanistan by September 11, 2021:“The Biden Administration is within its rights to withdraw U.S. troops from Afghanistan, but I’m concerned this Administration, like the last, has made this decision without fully considering the consequences. A complete withdrawal of U.S. troops will have long-term security ramifications, regionally and globally, for which the U.S. must be adequately prepared. Instead, we appear to be doubling down on ill-considered timelines without any of our conditions having been met. It’s incumbent on this Administration to tell Congress and the American people how it intends to withdraw U.S. forces, the timeline and reasoning behind it, and whether and how it intends to maintain a U.S. diplomatic presence in Kabul moving forward.”"
https://www.burr.senate.gov/2021/4/burr-and-manchin-lead-senate-resolution-to-designate-april-5th-gold-star-wives-day,"Today, Senators Richard Burr (R- NC) and Joe Manchin (D-WV), honored members of the Gold Star Wives of America, after the U.S. Senate passed a resolution led by the Senators to designate April 5, 2021, as “Gold Star Wives Day.”Since 1945, the Gold Star Wives of America has provided support and services to thousands of widows and survivors of fallen military members.The bipartisan resolution was passed on March 15 by unanimous consent.“For more than 75 years, the Gold Star Wives of America have tirelessly served the spouses and families of America’s fallen heroes,” said Senator Burr. “We owe a huge debt of gratitude to Gold Star families, who have given as much for our country as those in uniform. Marking today in their honor allows us to say ‘thank you’ for the sacrifices they have made on our behalf.”“America will never be able to repay our brave patriots and their families who have paid the ultimate price to protect their fellow Americans. Gold Star families and spouses have sacrificed so much for their country, and I can only imagine the pain that comes from losing your partner in the line of duty. I am proud to lead this resolution recognizing April 5, 2021 as Gold Star Wives Day to honor their dedication and sacrifice to our country. I extend my deepest condolences and sincere thanks to every Gold Star family and spouse,” said Senator Manchin.On April 5, 1945, First Lady Eleanor Roosevelt helped convene the first meeting of the Gold Star Wives of America, a Congressionally-chartered non-profit to acknowledge the incredible sacrifices of the families of those who died in service during World War II. To learn more about their organization, please visit their website here.This resolution recognizes the contributions of Gold Star Wives and encourages the recognition of their dedicated services to families across the nation. The full text of the Senate resolution is available here."
https://www.burr.senate.gov/2021/4/senator-burr-statement-on-the-retirement-of-coach-roy-williams,"Today, Senator Richard Burr (R-NC) released the following statement regarding UNC Men’s Basketball Coach Roy Williams’ announced retirement:“When Roy Williams first stepped onto the court in Chapel Hill as a college freshman, I doubt anyone, even the great Dean Smith, could predict the Hall of Fame career he was about to start,” said Senator Burr. “After 48 seasons as a basketball coach - that included leading the Tar Heels to three national championships - Coach Williams can look back on his career knowing he leaves an enduring impact on UNC-Chapel Hill, the state of North Carolina, and the hundreds of young people he mentored over the years.”"
https://www.burr.senate.gov/2021/5/burr-bennet-renew-effort-to-provide-financial-stability-to-americans-battling-terminal-diseases,"Today, in recognition of ALS Awareness Month, Senators Richard Burr (R-NC) and Michael Bennet (D-CO) introduced the Kathryn Manginelli Act, or the Compassionate Retirement Act, which will provide more financial stability to families battling devastating diseases, such as amyotrophic lateral sclerosis (ALS). This bipartisan legislation will allow individuals, who are diagnosed with a terminal illness, to use retirement savings without incurring an additional 10 percent penalty if withdrawing before the age of 59 ½.“Americans who have been diagnosed with ALS and other terminal illnesses share unexpected emotional and financial hardships,” said Senator Burr. “Many North Carolina families I’ve met with over the years have similar stories of the difficulties they face, including Kathryn and Joe Manginelli. The Manginellis brought to my attention the fact that those with terminal illnesses still face penalties for early retirement withdrawals. If Americans with terminal illnesses need to access their retirement funds to help cover unplanned health care costs, they shouldn’t be penalized for it. This is a commonsense fix. That’s why I’m honored to reintroduce this legislation in memory of Kathryn to provide more financial flexibility to Americans suffering from these terminal diseases and their families.”“Individuals diagnosed with a terminal illness face immense physical and emotional hardship,” said Senator Bennet. “On top of that, the financial challenges of battling a terminal illness can be overwhelming. Patients are often left to shoulder the burden not only of the cost of their care, but also their family’s financial future. We can do more to ease some of that financial hardship for families by allowing individuals diagnosed with a terminal illness to access their retirement savings immediately and without penalty.”Background:Under current law, the disability exception requires the individual to be unable to carry out Substantial Gainful Activity. However, Americans diagnosed with degenerative, terminal illnesses, such as ALS, are still subject to the 10 percent penalty if they continue working in the months prior to becoming disabled to help cover their medical or disability-related expenses.Named in honor of Kathryn Manginelli of Durham, North Carolina, who passed away from ALS on November 11, 2018, this legislation will provide families battling terminal illnesses with the ability to use their retirement savings without incurring this additional 10 percent penalty.Senators Burr and Bennet first introduced this legislation on September 18, 2019.To read a section-by-section of this legislation, also referred to as the Compassionate Retirement Act, click here. "
