url,text
https://www.durbin.senate.gov/newsroom/press-releases/durbin-expresses-support-for-bidens-student-loan-forgiveness-plan-in-speech-on-senate-floor,"WASHINGTON – U.S. Senate Majority Whip Dick Durbin (D-IL) delivered a speech on the Senate floor addressing the burdensome cost of higher education, which has quickly become one of the biggest worries facing middle- and low-income families in America. Durbin began his speech by recalling the inception of the National Defense Education Act, which was enacted to counter the Soviet Union’s exploration of space and their growing technology industry. As a result of the legislation, students were offered loans to attend college.“The National Defense Education Act said that those who applied for federal college loans could borrow money and pay it back at three percent interest but not have to repay until one year out of college and then they had ten years to pay it off. I didn’t know at the time but that turned out to be my ticket to college…I ended up borrowing enough to get through college and law school. The amount of debt if I said it would draw a laugh from everyone else because it was so small,” Durbin began.Durbin continued by citing additional restrictions that saddle students with a lifetime of debt. In his remarks, Durbin explained that federal legislation bars student borrowers from discharging their debt in bankruptcy because of an antiquated legality. Under current law, most types of debt – mortgages, credit card debt, boat loans – can be discharged in bankruptcy court except for student loans, which continues to prevent middle- and low-income Americans from living in financial security.“When it came to student loans [in bankruptcy court], we said… we’re not going to allow [students] to discharge it in bankruptcy. It ultimately meant that for those who borrowed money to go to school and college when they were 19 or 20 years old, they would have a debt that they had to pay back or carry to the grave,” Durbin explained.“Should [student loans] be dischargeable in bankruptcy? I think under some circumstances they should be. If ten years have passed and you still had a balance on your student loans and you were literally head over heels in debt, you ought to be able to discharge that in bankruptcy,” Durbin said.To address this oversight in student loan forgiveness, Durbin introduced the bipartisan FRESH START Through Bankruptcy Act to restore the ability for struggling borrowers to seek a bankruptcy discharge for federal student loans after waiting a period of ten years.Durbin went on to praise President Biden’s move to offer up to $10,000 in student loan forgiveness to Americans earning less than $125,000 annually and married couples earning less than $250,000. President Biden’s plan also offers up to an additional $10,000 to Pell Grant recipients.“Under the plan, 43 million Americans will receive some amount of debt cancellation. A majority of them, about 27 million borrowers, will see up to $20,000 knocked off their student loan balance. For 20 million borrowers, that’s enough to totally wipe out their entire student loan balance. They can start again. They can consider going back to school, maybe even a good school that gives them the kind of training, education, and degree that really can lead to a better life,” Durbin said.Today, two-thirds of college graduates have student loans. On average, a student graduates with nearly $25,000 in student loan debt. For students that attend predatory for-profit colleges, the burden of student debt can be far worse. Lured in by the false promises of for-profit college advertisements and recruiters, students often do not graduate from these programs but are left on the hook to pay thousands of dollars in student loans.Durbin shared the story of Vickie Vences, one of the thousands of Illinoisans who was scammed by Westwood College, a for-profit institution. A first-generation college student, Vickie enrolled in Westwood’s criminal justice program in Chicago in 2004, believing recruiters’ promises that a Westwood degree would help her secure a well-paying job in law enforcement. Vickie, however, was unable to secure employment in law enforcement because of Westwood’s lack of accreditation.“Because Westwood College hid the truth about the fact they were not accredited in Illinois, a lot of young people were duped into believing it was a ticket to a good law enforcement job. By the time Vickie figured out how badly she was into it, she had $50,000 in student loan debt and she didn’t even have a Westwood degree to point to,” Durbin shared.Vickie now works at non-profit organizations that assist victims of domestic violence. However, she rarely makes enough to pay down her student loans, forcing her to live in fear of wage garnishment. The Department of Education (Department) recently announced that students who attended Westwood qualify for borrower defense group discharge due to pervasive misrepresentations and misconduct at Westwood. Vickie’s entire loan balance has been cancelled. Without this burden, Vickie can consider going back to college to help her secure a job in law enforcement.The Biden Administration’s one-time student loan debt relief plan and the Department’s recent decision to provide borrower defense discharges for students who were scammed by for-profit schools will allow millions of borrowers to see relief. As Durbin goes on to point out, however, Republicans are quick to decry President Biden’s student loan forgiveness plan under the faulty argument that this debt forgiveness is a handout to graduates of elite schools.“President Biden’s student loan forgiveness plan is not a giveaway to rich doctors and lawyers who racked up big debt at Ivy League schools. Ninety-eight percent of the student loan borrowers did not attend those schools. The majority of these debts are held by families who have zero net worth. What will their life be like without help? Nearly ninety percent of the relief dollars in the President’s plan go to borrowers earning less than $75,000 a year,” Durbin asserted.Durbin reminded his Republican colleagues that several of them accepted loan payments from the government through the Paycheck Protection Program (PPP). When the federal government was offering this relief, Republicans remained quiet about the federal assistance.Durbin concluded, “We started talking about trillion-dollar relief packages in the pandemic. We said to people that we’re going to have loans through the Small Business Administration for people who have a job or a business and need a helping hand in terms of borrowing money to get by. If you can prove that you spent the money on payroll and utilities and rent, it’s forgiven…We had a number of Members of Congress who applied for PPP loans, the same people criticizing forgiving student loan debts literally, personally borrowed money they didn’t pay back to the federal government. They didn’t think there’s anything wrong with that,” Durbin pointed out.“The bottom line is this. If we can help these young student borrowers get an opportunity to reduce the debt that they owe and get their lives back online, that is a great outcome for them and a great one for this nation….Joe Biden’s step is a reasonable, humane step in the right direction. It should have bipartisan support,” Durbin concluded.Video of Durbin’s floor speech is available here.                                                                          Audio of Durbin’s floor speech is available here.Footage of Durbin’s floor speech is available here for TV Stations.-30-"
https://www.durbin.senate.gov/newsroom/press-releases/senate-confirms-judge-john-lee-to-seventh-circuit,"WASHINGTON – Today, the U.S. Senate confirmed Judge John Lee to the United States Court of Appeals for the Seventh Circuit. U.S. Senate Majority Whip Dick Durbin (D-IL), Chair of the Senate Judiciary Committee, released the following statement regarding Judge Lee’s confirmation:“Judge Lee is an embodiment of the American dream. Born to Korean parents and immigrating to Chicago at the age of four, he has dedicated his career to public service and the evenhanded administration of justice. When he was confirmed by voice vote to the Northern District of Illinois, Judge Lee became the first Korean American to serve as an Article III judge in Illinois. Today, he makes history again as the first Asian American judge to serve on the Seventh Circuit.”Judge John Z. Lee has served as a U.S. District Court Judge for the Northern District of Illinois since 2012. From 1999 to 2012, Judge Lee was an associate and then partner at Freeborn & Peters LLP in Chicago. From 1996 to 1999, Judge Lee was an associate at Grippo & Elden LLC, and from 1994 to 1996, he was an associate at Mayer Brown LLP. He also served as a trial attorney in the Environmental and Natural Resources Division of the U.S. Department of Justice from 1992 to 1994. Judge Lee received his A.B., magna cum laude, from Harvard College in 1989, and his J.D. from Harvard Law School, cum laude, in 1992.In June, Judge Lee advanced out of the Judiciary Committee with a bipartisan vote of 12-8-2.-30-"
https://www.durbin.senate.gov/newsroom/press-releases/durbin-questions-judicial-nominees-in-senate-judiciary-committee-hearing,"WASHINGTON – During today’s Senate Judiciary Committee nominations hearing, U.S. Senate Majority Whip Dick Durbin (D-IL), Chair of the Senate Judiciary Committee, questioned Judge Dana Douglas, nominee to be United States Circuit Judge for the Fifth Circuit, and Bradley Garcia, nominee to be United States Circuit Judge for the District of Columbia Circuit. Durbin focused his questions on differentiating between advocating for a client in private practice and the impartiality of a judge.“You have been in private practice. You have represented clients, some of them controversial. Many people are going to draw conclusions about who you are and what you believe in based on your clients. Tell me your own thoughts on advocacy for a client versus the responsibility of a judge,” Durbin asked both Judge Douglas and Mr. Garcia to explain.In her response, Judge Douglas discussed her experience representing a wide-range of clients, from individuals to Fortune 500 companies to nonprofits. Judge Douglas explained that, while serving on the bench, she strives to preside over cases with Judicial Canon 3 in mind, which requires judges to approach cases with impartiality.Mr. Garcia noted that while both the role of advocate and judge are vital to the judicial system, they serve different functions. Explaining that his resume has allowed him to work on both ends of this spectrum, Mr. Garcia emphasized that his experience clerking for Supreme Court Justice Elena Kagan will assist him in remaining unbiased if he is confirmed as a judge for the District of Columbia Circuit.Video of Durbin’s questioning of Judge Douglas and Garcia in Committee is available here.Audio of Durbin’s questioning of Judge Douglas and Garcia in Committee is available here.Footage of Durbin’s questioning of Judge Douglas and Garcia in Committee is available here.-30-"
https://www.durbin.senate.gov/newsroom/press-releases/durbin-the-confirmation-of-highly-qualified-judges-is-one-of-the-great-shared-successes-of-president-biden-and-senate-democrats,"WASHINGTON – In a speech on the Senate floor, U.S. Senate Majority Whip Dick Durbin (D-IL), Chair of the Senate Judiciary Committee, today spoke about the upcoming vote on Seventh Circuit nominee John Lee, and Senate Democrats’ continued commitment to confirming highly qualified judges to the federal bench.“President Biden and Senate Democrats have made it a priority to elevate judicial nominees from demographically and professionally diverse backgrounds,” Durbin said. “And during the 117th Congress, we have shattered records when it comes to diversity on the federal bench… [including] a record number of nominees with experience serving not only as prosecutors, but also as public defenders, voting rights experts, and civil rights attorneys… Every one of these jurists is highly qualified and ready to serve our nation and the American people.”As of today, the Senate has confirmed 76 judges to lifetime positions during the 117th Congress—including 18 circuit court nominees, 57 district court nominees, and the first Black woman to serve on the United States Supreme Court. Of the 18 circuit judges confirmed by Senate Democrats, 14 are women and 13 are people of color. Of the 57 district judges, 42 are women and others represent historic firsts, including the first Muslim-American Article III judge and the first Latina Article III judge in the State of Illinois.This evening, the Senate will vote on another highly qualified nominee: Judge John Lee, who has been selected for an Illinois seat on the Seventh Circuit. If confirmed, Judge Lee will be the first Asian-American judge ever to serve on the Seventh Circuit.Durbin continued, “Since joining the bench, [Judge Lee] has written hundreds of opinions [and] presided over 35 trials that went to verdict or judgment. He has also sat by designation on the Seventh Circuit a number of times, writing several opinions for the majority. During his time on the bench, he’s always applied the law to the facts before him, in an even-handed and fair fashion… He has the strong support of myself and Senator Duckworth. I urge my colleagues to join us.”Durbin concluded, “I want to close by emphasizing this: our work is not finished by a long shot. Judge Lee is one of the ten circuit court nominees awaiting action by the full Senate, and many more nominees are still moving through the Judiciary Committee. Each one of these public servants will bring much-needed professional and demographic diversity. The judges being confirmed by this Senate will ensure that the rule of law applies to every single one of us—without fear or favor. They will work to uphold America’s most sacred promise: equal justice for all.” Video of Durbin’s floor speech is available here.Audio of Durbin’s floor speech is available here.Footage of Durbin’s floor speech is available here for TV Stations.-30-"
https://www.durbin.senate.gov/newsroom/press-releases/durbin-duckworth-applaud-nomination-of-colleen-lawless-to-serve-as-district-court-judge-for-the-central-district-of-ilinois,"SPRINGFIELD – U.S. Senate Majority Whip Dick Durbin (D-IL), Chair of the Senate Judiciary Committee, and U.S Senator Tammy Duckworth (D-IL) today released the following statement after the White House announced the nomination of Judge Colleen Lawless to serve as a District Court Judge on the U.S. District Court for the Central District of Illinois:“We are pleased that President Biden is nominating Judge Colleen Lawless to serve as a District Court Judge for the Central District of Illinois.  She brings strong qualifications and experience that will strengthen our federal bench.  We look forward to supporting her nomination in the Senate.”On May 12, 2022, Judge Sue Myerscough of the Central District of Illinois sent a letter notifying the President that she intended to assume senior status upon confirmation of her successor.  In May, the Senators established a screening committee to review applicants to be a Federal District Court Judge in the Central District of Illinois.  Their screening committee is comprised of distinguished members of the Central District’s legal community.  The screening committee’s task was to review and vet District Court candidates and advise the Senators regarding the candidates’ qualifications and fitness for the position.  In June, the Senators sent a letter to the White House recommending three candidates for President Biden’s consideration for the U.S. District Court for the Central District of Illinois, including Judge Lawless.The nominee’s biography from the White House is below:Colleen Lawless has served as an Associate Judge for the Seventh Judicial Circuit in Sangamon County, Illinois, since 2019.  Judge Lawless was previously a shareholder at Londrigan, Potter & Randle P.C. in Springfield, Illinois, from 2009 to 2019.  Judge Lawless received her J.D. from Northern Illinois University College of Law in 2009 and her B.A. from Illinois Wesleyan University in 2005.-30-"
https://www.durbin.senate.gov/newsroom/press-releases/durbin-visits-local-farm-to-discuss-impact-of-inflation-reduction-act-on-illinois-agriculture-industry-,"CARBONDALE – U.S. Senator Dick Durbin (D-IL), a member of the Senate Committee on Agriculture, Nutrition, and Forestry, today visited a local farm to discuss the impacts of the Inflation Reduction Act on the Illinois agriculture industry.“Illinois’ agriculture industry is not immune to climate change, with droughts in some parts of the state and flooding in others,” said Durbin. “These weather changes are not exclusive to Illinois–they’re a global issue.  Congress designed the Inflation Reduction Act to help farmers by providing a historic $40 billion investment in voluntary incentives for our nation’s agriculture industry.  More customers, and more agribusinesses, at home and globally, want climate-smart crops, and I want Illinois to be their first choice because it means additional markets for Illinois agriculture and additional revenues for farmers.  Our farmers who are ahead of the game, and our farms that invest in these new practices early, will strengthen their competitive advantage well into the future.”Over the last century, the Illinois growing season has lengthened by about two weeks while the climate has become 10 percent wetter—changes that are expected to continue in the coming decades. Illinois now experiences more extreme rainfall events followed by more dry spells. These can lead to planting delays, soil compaction, nutrient losses, and the need for replanting. Illinois is also experiencing greater humidity, which promotes plant diseases, pests, and fungus.The Inflation Reduction Act includes:The funds from the Inflation Reduction Act will provide farmers with incentives to improve conservation practices that can cut expenses like fertilizer applications while adopting carbon reduction practices such as expanding cover crops and reducing nitrogen runoff—all of which will increase the value of corn and soybeans in future markets. Illinois USDA will expand the following programs: Environmental Quality Incentives Program (EQIP), Conservation Stewardship Program (CSP), Agriculture Conservation Easement Program (ACEP), and Regional Conservation Partnership Program (RCPP). More information on those programs can be found here.-30-"
https://www.durbin.senate.gov/newsroom/press-releases/durbin-statement-on-department-of-educations-move-to-approve-15-billion-borrower-defense-group-discharge-for-former-westwood-college-students,"SPRINGFIELD – U.S Senate Majority Whip Dick Durbin (D-IL) today released the following statement on the U.S. Department of Education’s announcement that the Department has approved $1.5 billion in full loan discharges for 79,000 borrowers regardless of whether the borrower submitted an individual borrower defense application. Of the 79,000 claims discharged, 12,650 belonged to Illinois student borrowers, amounting to $228.2 million in relief.“After almost ten years of urging multiple Administrations to discharge these borrower defense claims, I am grateful that the Department of Education is finally relieving these students of the financial burden put on them by the predatory, for-profit Westwood College. With Attorney General Kwame Raoul’s continued advocacy, Illinois student borrowers are getting the relief they are entitled to after being conned into a fraudulent degree program.“Today’s announcement was a victory for students, but we must do more to crack down on for-profit colleges that lie and lead Illinoisans into mountains of student debt without a viable degree or career path.”In 2012, then-Illinois Attorney General Lisa Madigan filed a suit against Westwood College for using deceptive marketing in violation of the Illinois Consumer Fraud and Deceptive Business Practices Act. Westwood College deceived Illinois students about the costs and accreditation of its criminal justice program, misleading students into believing that the program was highly respected by employers and would ensure them a job in law enforcement. Upon graduation, students found that Illinois law enforcement agencies did not recognize their Westwood education, leaving them drowning in student debt with no job prospects.Durbin, alongside then-AG Madigan and current AG Kwame Raoul, has been continuously advocating for discharging these student borrower defense claims since the Obama Administration. In 2016, Durbin urged then-Secretary of Education John King to discharge the debt of defrauded Illinois Westwood students based on the evidence found in Illinois AG Madigan’s suit. He repeatedly pressed former Secretary Betsy DeVos on the matter during the Trump Administration.In his first letter to Secretary of Education Miguel Cardona, Durbin called on him to promptly provide federal student loan debt relief to students defrauded by Westwood College, citing Illinois’ lawsuit and its conclusive evidence that the for-profit institution misled students. Durbin followed up on his request with a second letter earlier this summer.In June, Durbin delivered a speech on the Senate floor calling on the Department to forgive the outstanding federal student loans of borrowers who were enrolled in Westwood College’s fraudulent criminal justice program.-30-"
https://www.durbin.senate.gov/newsroom/press-releases/durbin-duckworth-illinois-delegation-urge-president-biden-to-grant-fema-individual-assistance-to-metro-east-following-flash-floods,"SPRINGFIELD – U.S. Senate Majority Whip Dick Durbin (D-IL) and U.S. Senator Tammy Duckworth (D-IL), along with the entire Illinois Congressional delegation, sent a letter to President Biden requesting that Federal Emergency Management Agency (FEMA) provide federal assistance to the State of Illinois to help St. Clair County respond to significant damage from the flash floods on July 26.“We write in support of Illinois Governor JB Pritzker’s request for federal assistance for the State of Illinois to help St. Clair County to recover from severe flooding that occurred last month. Governor Pritzker has indicated that this incident is of such severity and magnitude that effective response and recovery is beyond the combined capability of the state and local governments.  As such, he requests Individual Assistance for St. Clair County to help the residents clean up and rebuild amid this large-scale flood damage,” the lawmakers wrote.In their letter, the lawmakers laid out the severity of the storm, which forced more than 20 Metro East families to evacuate.“On July 26, a historic storm in the area resulted in eight to 12 inches of rain in a mere 12 hours, causing the evacuation of more than 20 families, road closures, and widespread flood damage.  The Federal Emergency Management Agency (FEMA) worked with the Illinois Emergency Management Agency (IEMA) and the County to assess more than 700 homes reporting damage,” they continued.“We respectfully request that you approve Governor Pritzker’s request for Individual Assistance for St. Clair County,” the lawmakers concluded.Full text of the letter is available here and below: August 30, 2022Dear Mr. President:            We write in support of Illinois Governor JB Pritzker’s request for federal assistance for the State of Illinois to help St. Clair County to recover from severe flooding that occurred last month. Governor Pritzker has indicated that this incident is of such severity and magnitude that effective response and recovery is beyond the combined capability of the state and local governments.  As such, he requests Individual Assistance for St. Clair County to help the residents clean up and rebuild amid this large-scale flood damage.On July 26, a historic storm in the area resulted in eight to 12 inches of rain in a mere 12 hours, causing the evacuation of more than 20 families, road closures, and widespread flood damage.  The Federal Emergency Management Agency (FEMA) worked with the Illinois Emergency Management Agency (IEMA) and the County to assess more than 700 homes reporting damage.It is worth noting that these were the same storms that caused damage across the river in Missouri, following which you swiftly approved Missouri Governor Mike Parson’s request for a Federal Disaster Declaration.  We believe Illinois residents deserve equal consideration amid the same weather events to receive federal assistance toward recovery as well.                                               We respectfully request that you approve Governor Pritzker’s request for Individual Assistance for St. Clair County.  Thank you for your timely consideration of this important request.  We stand ready to assist in any way appropriate.Sincerely,-30-"
