url,text
https://www.burr.senate.gov/2022/1/burr-foxx-press-biden-admin-for-clarification-on-unilateral-changes-to-public-service-loan-forgiveness-program,"Today, Senator Richard Burr (R-NC), Ranking Member of the Senate Committee on Health, Education, Labor and Pensions, and Representative Virginia Foxx (NC-5), Ranking Member of the House Committee on Education and Labor, sent a letter again calling on U.S. Department of Education Secretary Miguel Cardona to clarify the Department’s statutory basis for reforming the Public Service Loan Forgiveness (PSLF) Program.In October 2021, the Department of Education claimed it had executive authority to waive existing PSLF Program requirements created by Congress. On October 29, 2021, Senator Burr and Representative Foxx sent a letter to determine the Department’s rationale in its move to unilaterally change existing law and to request a briefing with Under Secretary James Kvaal and General Counsel Lisa Brown. Today’s letter is a follow up to their original oversight request.“When announcing these changes, the Department claimed a liberal reading of a statute to find the executive authority to move forward,” the letter states. “In light of this overtly political reading of the statute, we requested the production of various documents to understand the Department’s rationale for its decision and the supposed authority to change unilaterally statutory requirements prescribed by Congress.”“While the briefing with Mr. Kvaal was finally scheduled months after our request, your staff refused to include the General Counsel in that briefing,” the letter continues. “In further proof that Ms. Brown’s absence was detrimental to our oversight effort, when Mr. Kvaal was asked to provide a copy of the legal memorandum from [the Office of the General Counsel], Mr. Kvaal declined to provide a direct answer and asked that we submit this request in writing, despite this request being among the many that remain outstanding from the letter.”Click here to read the full text of the letter."
https://www.burr.senate.gov/2022/1/burr-blunt-demand-answers-from-biden-administration-on-dire-covid-19-test-shortage-despite-ample-funding,"Today, U.S. Senators Richard Burr (R-NC), Ranking Member of the Senator Health, Education, Labor and Pensions (HELP) Committee, and Roy Blunt (R-MO), Ranking Member of the Senate Appropriations Subcommittee on Labor, Health and Human Services, Education and Related Agencies, sent a letter urging U.S. Department of Health and Human Services Secretary Xavier Becerra to detail the administration’s strategy for solving the nation’s severe shortage of COVID-19 tests as coronavirus cases driven by the omicron variant continue to skyrocket.Senators Burr and Blunt noted that the nation is facing a shortage of COVID-19 tests despite Congress having provided more than $80 billion over the last two years for the administration to improve and expand testing related capabilities.“With over $82.6 billion specifically appropriated for testing, and flexibility within the Department to allocate additional funds from COVID-19 supplemental bills or annual appropriations if necessary, it is unclear to us why we are facing such dire circumstances now. It does not appear to be because of lack of funding, but a more fundamental lack of strategy and a failure to anticipate future testing needs by the administration,” the senators wrote. “As we continue to fight the COVID-19 pandemic, it is important that Congress, and the American people, have an understanding of the administration’s strategy and accounting of how the Department is using taxpayer funding.”Click here to read the letter."
https://www.burr.senate.gov/2021/3/ranking-member-burr-questions-labor-nom-julie-su-on-failures-fraud-in-cas-massive-unemployment-crisis,"Today, the Senate Health, Education, Labor and Pensions (HELP) Committee held its nomination hearing for Julie Su, the California and Workforce Development Agency Secretary, to serve as Deputy Secretary of Labor.In his prepared opening remarks, Senate HELP Committee Ranking Member Richard Burr (R-NC) outlined California’s economic failures, which include its high unemployment rate and its mass evacuation by businesses to better markets, such as Texas and North Carolina. Ranking Member Burr also criticized Secretary Su’s role in failing to address the massive fraud within California’s unemployment insurance system and questioned whether Secretary Su has the skills to lead a larger department.WATCH: Ranking Member Burr delivers opening remarks before Julie Su’s nomination hearing Key excerpts:“California is not a model to emulate for the country. “According the Bureau of Labor Statistics, California’s unemployment stands at 9%, the second highest in the country and has had one of the worst increases in unemployment over the last year of COVID.“The state has imposed some of the most onerous restrictions on businesses and individuals and has been one of the slowest to recover from the pandemic. California is also known for high taxes, and that applies both to individuals as well as businesses, and those rates aren’t likely to go down anytime soon considering the staggering amount of state liabilities on the state’s balance sheet.“The tax and regulatory burden weigh heavily on employers, and it is another reason why we are seeing businesses flee California in favor of states with more reasonable policies. Maybe that explains why so many companies are moving from California and bringing their jobs with them to North Carolina, Texas, and elsewhere.…“Turning to our nominee, you have a few challenges to gaining support for your nomination.“First, some of your friends have made it clear that they think you will be a shadow Secretary, when the role of Deputy Secretary is really that of a Chief Operating Officer…I hope you can convince the Committee that you understand the job you’ve been nominated for. I also hope you can demonstrate that you aren’t aiming to drag Mayor Walsh away from the sensible agenda he committed to pursuing when he was sitting where you now sit.“Second, and more importantly, I’m even more concerned about the failures and fraud in the California Unemployment Insurance system. California has suffered from some of the largest fraud in our nation’s history during the pandemic. Over $11 billion, perhaps as much as $30 billion, in fraud occurred in California’s unemployment system. Even death row inmates received unemployment checks.“What’s worse about the fraud committed on California and U.S. taxpayers is that it was entirely preventable.“It’s my understanding that an auditor made a series of recommendations just as you took office, specifically recommending that California exclude sensitive information, including Social Security numbers, from its identification system.“But nothing changed.“In fact, when the fraud was ramping up, and billions being stolen from taxpayers, California actually made things worse. You ordered the agency to eliminate some important safeguards to speed up payments, which led to even more fraud.“What’s worse is that California has received hundreds of millions a year, every year, over the past decade, in federal funds for administration of their unemployment systems, but no changes or improvements to those systems were made.“As we discussed yesterday, it is true that all states struggled, but California’s struggles swamp everyone. And none of their Secretaries of Labor are here today seeking a promotion.“So, while you may not be personally responsible for every case of fraud that happened, the fraud did happen on your watch.“Please help this Committee understand why that is an experience the Senate should reward with a promotion.“I’ll keep an open mind as we go through this hearing, and I appreciate you being willing to discuss these issues with us today.”To read Ranking Member Burr’s full opening remarks, click here."
https://www.burr.senate.gov/2021/3/sens-burr-tillis-introduce-blue-ridge-national-heritage-area-reauthorization-act-,"Today, Senators Richard Burr (R-NC) and Thom Tillis (R-NC) reintroduced the Blue Ridge National Heritage Area (BRNHA) Reauthorization Act. This legislation extends the authorization of BRNHA through 2036 to preserve Western North Carolina’s cultural, historic, and natural resources while continuing to develop economic opportunities in the region. The Senators first introduced the bill in July 2020.“Western North Carolina is home to some of the most beautiful landscapes in the country,” said Senator Burr. “The Blue Ridge National Heritage Area is not only a stunning part of the country and culturally important, it is also a critical component of our state’s economy. It is vital that Congress take steps to preserve the rich history of this area to ensure visitors can continue to enjoy all that Western North Carolina has to offer for years to come. This legislation does just that by extending the program’s funding for the next 15 years.”“The Blue Ridge Parkway and Great Smoky Mountains were the most visited national parks in 2020, seeing more than 12 million visitors,” said Senator Tillis. “The Blue Ridge National Heritage Area, including the Blue Ridge Parkway and the Great Smoky Mountains, means so much to North Carolina and everyone who visits. Equally, it is important to the Western North Carolina tourism industry, creating thousands of jobs and contributing billions of dollars to the local economy. We are so lucky to have this beautiful land in our great state, and I am proud to have worked with Senator Burr on this important legislation to extend this program to continue to preserve and develop the unique culture of Western North Carolina.”Background:The Blue Ridge National Heritage Area (BRNHA) was created by Congress in 2003 to preserve and develop the distinctive culture of Western North Carolina and South Appalachia. It includes North Carolina’s 25 western-most counties and two of the state’s most visited National Parks, the Blue Ridge Parkway and the Great Smoky Mountains National Park.Since 2003, BRNHA has awarded 188 grants totaling over $2.4 million, with $5.7 million leveraged in matching contributions from local and private investments. Additionally, BRNHA supports more than 30,000 jobs and has an annual total economic impact of $2.39 billion.In 2017, Senators Burr and Tillis introduced legislation to extend the BRNHA authorization through 2021. This legislation was reintroduced last year and it was included in the John D. Dingell, Jr. Conservation, Management, and Recreation Act, which was signed into law on March 12, 2019.The Blue Ridge National Heritage Area (BRNHA) Reauthorization Act of 2021 will go one step further by extending BRNHA’s authorization through 2036. Congressman Patrick McHenry (NC-10) is leading companion legislation in the House of Representatives."
https://www.burr.senate.gov/2021/3/sens-burr-tillis-vote-to-confirm-ncs-michael-regan-as-epa-administrator,"Today, Senators Richard Burr (R-NC) and Thom Tillis (R-NC) voted to confirm Michael Regan, a native North Carolinian, to serve as the Administrator of the Environmental Protection Agency (EPA).Senators Burr and Tillis, who introduced Regan before his Senate confirmation hearing last month, applauded the Senate’s bipartisan vote of 66-34.“Secretary Regan will bring the right expertise, leadership, and experience to the EPA,” said Senator Burr. “During his time working for North Carolina, Secretary Regan demonstrated his commitment to sound environmental stewardship and to building constructive relationships with those who may have different points of view. I applaud the Senate’s bipartisan support of this qualified nominee, and look forward to working with him in this new role.”“Michael Regan has a strong record of service to the state of North Carolina, earning a reputation for being a thoughtful, engaging, and well-qualified leader through his work with the EPA, the Environmental Defense Fund, and as Secretary of the North Carolina Department of Environmental Quality,” said Senator Tillis. “I am proud to support Secretary Regan for Administrator of the EPA, which I conveyed last month when I had the honor to introduce him before the Senate Committee on Environment and Public Works. I have no doubt he will do a great job and serve our country well.”Background:Secretary Michael Regan was confirmed by the Senate by a vote of 66-34.Senators Burr and Tillis introduced Regan before his Senate confirmation hearing on February 3, 2021. Regan was confirmed by the Senate Environment and Public Works Committee by a vote of 14-6 on February 9, 2021.  Prior to being nominated by President Biden to serve as EPA Administrator, Regan served as Secretary of the North Carolina Department of Environmental Quality from 2017 to 2021. He also served at the EPA for nine years across a variety of policy positions. Regan is a proud North Carolinian, born and raised in Goldsboro, and a graduate of North Carolina A&T University.His nomination was supported by more than 20 of the largest agriculture organizations in the country."
https://www.burr.senate.gov/2021/3/sen-burr-current-moment-critical-for-learning-from-covid-19-response-and-letting-states-lead,"Today, the Senate Health, Education, Labor and Pensions (HELP) Committee held a hearing entitled “Examining Our COVID-19 Response: An Update from the Frontlines.” This is the first hearing focused on the response to the coronavirus pandemic the Committee has held this Congress.In his prepared opening remarks, Senate HELP Committee Ranking Member Richard Burr (R-NC) underscored the critical role that state and local officials play in leading the response to the pandemic. Additionally, Ranking Member Burr urged the Committee to exercise its oversight responsibility by regularly holding COVID-19 hearings to receive updates from Administration officials on the nation’s ongoing response efforts.WATCH: Ranking Member Burr’s opening remarks before the Senate HELP Committee’s first coronavirus pandemic hearing this yearKey excerpts:“We must take stock of lessons learned from the response to the coronavirus pandemic and learn together to see what worked, what didn’t, and what needs to be done to be more prepared in the future.“We should be proud of the important laws and programs and policies we have worked together to create and fund, because so much of it worked exactly as we envisioned. FDA used its emergency use authority to get vaccines and therapeutics to Americans in record time, while maintaining the gold standard of safety and efficacy. The Assistant Secretary for Preparedness and Response coordinated with health care providers on the ground to ensure the sharing of critical information and supplies as quickly as possible during the response… Using BARDAs authorities, Operation Warp Speed developed and scaled manufacturing for multiple vaccines in record, life-saving time.“But we should also be humble enough to know that more needs to be done to be prepared for the future. I hope now that the partisan spending bill - that only had 5% of its funding dedicated to the public health portion of the COVID response and 1% of their massive spending bill dedicated to COVID vaccines - has passed, we can shift our attention back to working together.“As we start this thorough review process, it is important to remember that we are still in the midst of our current response. But the tools we have today look very different than where we started over one year ago, largely because of the authority we have given the executive branch. In May of last year, some experts were predicting that a vaccine could take years – in partnership with the private sector, we did it in ten months. Testing is now widely available, with the FDA announcing just last week the emergency authorization of another test that delivers results at home, thanks to the public private partnership and leadership from the NIH…and our state and local officials have led the charge in tailoring our response to their communities’ needs, as they should.“Alongside our successes, we must acknowledge our failures. At the beginning of the academic year, just 17 % of our nation’s schools had fully returned to in-person learning... Businesses are still closed…And, the tool we have to solve these urgent problems – a vaccine – should be reaching more Americans, faster… The CDC stated that we are averaging 2 million shots in arms per day – but this Administration has not updated its goal to reach 100 million shots in 100 days, which was already the trajectory when the President took office in January. Instead, we should set aspirational goals, like we did with the development of the vaccine, not easily attainable ones.“When we look at where we are in the response today, the data shows a significant decline in COVID cases and hospitalizations. I share this with my colleagues, not because we should let-up on our response, but because I believe we are at the greatest moment, right now, to learn from our progress and our failures. The time to capture the lessons we are learning is now, in real time, and not months down the road when case levels are low, attention spans shorten, and urgency fades.….“I’d like to set the expectation for all of us on the committee, on both sides of the aisle, that we should expect to hear from Administration officials on a regular basis just like we did with the last Administration, if not more often. They have an obligation to be open and transparent with Congress, and the American people about what they are doing, in real time, and I know all of my colleagues on both sides of the aisle will join us in that request.”To read Ranking Member Burr’s full opening statement at today’s hearing, click here."
https://www.burr.senate.gov/2021/3/senate-confirms-dr-miguel-cardona-to-serve-as-us-secretary-of-education,"Today, the Senate voted on a bipartisan basis of 64-33 to confirm Dr. Miguel Cardona as Secretary for the U.S Department of Education.Senate Health, Education, Labor and Pensions (HELP) Committee Ranking Member Richard Burr (R-NC), who supported Dr. Cardona’s nomination before the Senate HELP Committee earlier this month, applauded the Senate’s confirmation of this critical role.“School closures across the nation have left many students stuck at home, disconnected from their peers and struggling under significant learning loss,” said Senator Burr. “Dr. Cardona has committed to following the science, and has agreed to prioritize bringing students back to the classroom quickly and safely. Dr. Cardona brings with him the background, qualifications, and temperament needed to serve in this position at a very challenging time. I’m glad to be able to support his nomination today, and I look forward to working with him on these important initiatives.”On February 26, 2021, Senator Burr delivered floor remarks expressing his support of Dr. Cardona to serve as U.S. Secretary of Education. Dr. Cardona testified before the Senate HELP Committee on February 3, 2021, and was confirmed by the Committee by a vote of 17-5 on February 11, 2021."
https://www.burr.senate.gov/2021/2/sens-burr-booker-introduce-legislation-to-posthumously-award-congressional-gold-medal-to-emmett-till-and-mamie-till-mobley-,"Today, Senators Richard Burr (R-NC) and Cory Booker (D-NJ) reintroduced legislation for the 117th Congress to posthumously award Emmett Till and Mamie Till-Mobley the Congressional Gold Medal, the nation’s highest civilian honor. The Senators first introduced the bill in September 2020.“Sixty-five years after his horrific murder and the acquittal of his killers, Emmett Till’s life and legacy continues to reverberate throughout this country,” said Senator Burr. “It is only right that we posthumously award the nation’s highest civilian honor, the Congressional Gold Medal, to Emmett Till and his mother, Mamie Till-Mobley, in recognition of the grave injustices they faced and the indelible impact they left on America’s Civil Rights movement. I am proud to work with Senator Booker on this important effort as we celebrate Black History Month.”“The lynching of Emmett Till and the impunity that followed was wrenching in its horror, and revealed the persistence of racialized terror and violence waged against Black Americans across the United States,” said Senator Booker. “The courage his mother, Mamie Till-Mobley, displayed in allowing the world to witness the unspeakable violence her son endured forced our nation to confront its collective failure to address the evils of racism and white supremacy. The Congressional Gold Medal, the highest civilian honor Congress can bestow, is a long-overdue recognition of Emmett and Mamie Till-Mobley’s legacy.”Background:In 1955, Emmett Till was kidnapped, beaten, and brutally murdered in Money, Mississippi while visiting his uncle, Moses Wright. Till’s murderers were acquitted despite Wright providing an eyewitness testimony that the men on trial kidnapped Till.Following Till’s death, his mother, Mamie Till-Mobley, brought his body back to Chicago and demanded an open casket funeral with more than 50,000 attendees. Till-Mobley allowed a photograph to be taken of Till in his casket, which galvanized activists who were working for civil rights.Till-Mobley continued her work for justice in honor of her son. She created the Emmett Till Players, where teenagers traveled throughout the country presenting Martin Luther King, Jr. speeches. Additionally, Till-Mobley was the co-founder of the Emmett Till Justice Campaign, which significantly impacted our justice system through pushing for the re-investigation of Till’s murder by the State of Mississippi, the Federal Bureau of Investigation (FBI), and the Department of Justice in 2004, and by working to pass the Emmett Till Unsolved Civil Rights Crime Act of 2007, to ensure the Justice Department and FBI investigate civil rights era cold cases.In 2016, Senator Burr, along with Rep. John Lewis, led efforts in the Senate to pass the Emmett Till Unsolved Civil Rights Crimes Reauthorization Act of 2016, which was signed into law by President Obama on December 19, 2016."
https://www.burr.senate.gov/2021/2/burr-supports-qualified-secretary-of-education-pick-underscores-importance-of-reopening-schools,"Today, Senator Richard Burr (R-NC), the Ranking Member of the Senate Health, Education, Labor and Pensions (HELP) Committee, expressed his support of Dr. Miguel Cardona to serve as U.S. Secretary of Education and stressed the importance of following science to bring students back to the classroom.WATCH: Senator Burr delivers remarks on the Senate floor ahead of Dr. Miguel Cardona’s confirmation voteKey excerpts:“[Dr. Cardona] has the background, qualifications, and temperament to serve in this position. “COVID-19 related school closures have led to significant learning loss, with millions of children stuck at home, trying to learn. Parents are at their wits end because many of the adults running public schools across our country are failing to actually follow the science. We should be seriously talking about reopening schools as quickly as possible. That's what the science tells us. And it's what students need.“When Dr. Cardona testified before the Senate HELP Committee, he stressed the need for students to get back in schools, and I'm glad that's now, finally, a bipartisan mission. At the same time, each school district, college, university, state, and local community faces different circumstances in dealing with this pandemic. Trying to treat them as a monolith, instead of providing flexible advice for states and localities to use if applicable and useful, would be a mistake. Dr. Cardona said he understands that one size fits all mandates from Washington won't work.“Dr. Cardona also agreed to be responsive to our oversight requests and to keep us updated on his plans and departmental actions. “We won't agree on everything, but we should be able to find places where we can agree. I support the nomination of Dr. Cardona and I look forward to working with him.”Dr. Miguel Cardona testified before the Senate HELP Committee on February 3, 2021, and was confirmed by the Committee by a vote of 17-5 on February 11, 2021."
