url,text
https://www.markey.senate.gov/news/press-releases/senator-markey-joins-senator-warren-representative-sherman-in-reintroducing-the-nationwide-right-to-unionize-act-call-for-passage-of-the-pro-act,"Washington (September 8, 2022) — Senator Edward J. Markey (D-Mass.) joined Senator Elizabeth Warren (D-Mass.) and Representative Brad Sherman (D-Calif.) as the two lawmakers today reintroduced the Nationwide Right to Unionize Act, legislation that would support the right to unionize by prohibiting states from banning union security agreements through “right-to-work” laws. Twenty-seven states have enacted “right-to-work” laws that prevent unions from collecting dues from non-union members who are covered under a union-negotiated contract. These laws make it more difficult for workers to form unions and fight for higher wages and better working conditions in the states that adopt them, resulting in a 5% decrease in unionization rates and a decrease in average wages for all full-time workers of 3.1%, according to a study by the Economic Policy Institute, or about $11,000 a year, according to a report released by Rep. Sherman’s office. A similar proposal is included in the Protecting the Right to Organize (PRO) Act, which the lawmakers support and would protect American workers’ right to organize and negotiate for better wages and working conditions.In addition to Senator Markey, the legislation is co-sponsored by Senators Duckworth (D-Ill.), Wyden (D-Ore.), Luján (D-N.M.), Padilla (D-Calif.), Blumenthal (D-Conn.), Gillibrand (D-N.Y.), Booker (D-N.J.), Merkley (D-Ore.), Hassan (D-N.H.), Sanders (I-Vt.), Smith (D-Minn.), Stabenow (D-Mich.), Cardin (D-Md.), Brown (D-Ohio), Hirono (D-Hawai’i), Baldwin (D-Wis.), and Klobuchar (D-Minn.) and Representatives Lynch (D-Mass.), Norton (D-DC), Garamendi (D-Calif.), Cárdenas (D-Calif.), Swalwell (D-Calif.), Moulton (D-Mass.), Speier (D-Calif.), Raskin (D-Md.), Brownley (D-Calif.), Kildee (D-Mich.), Nadler (D-N.Y.), and Jayapal (D-Wash.).Read a copy of the legislative text HERE.It has received support from the following advocacy and expert organizations: The American Federation of Government Employees (AFGE), AFL-CIO, Service Employees International Union (SEIU), International Brotherhood of Teamsters, United Steelworkers, Transport Workers Union of America, International Union of Operating Engineers, Communications Workers of America Union, Retail Wholesale and Department Store Union, International Federation of Professional and Technical Engineers, International Association of Machinists, United Food & Commercial Workers Union, and Aerospace Workers, Economic Policy Institute, Worker Power Coalition, and National Employment Law Project.“Senator Warren’s Nationwide Right To Unionize Act would finally start prioritizing the interests of workers in our nation’s labor laws, which have always been stacked in the favor of employers,” said Marc Perrone, President of the United Food and Commercial Workers International Union. “The brave, essential workers who make up the UFCW can attest to the fact that the best way to improve a workplace has always been for workers to organize, form a union, and fight for their rights together. Right now, thousands upon thousands of Americans are doing exactly that, and, despite all the unfair hurdles they must overcome, workers are successfully organizing in new industries and new workplaces. Passing this bill and rolling back decades upon decades of anti-worker legislation would be one of the single most important steps we can possibly take to empower the American workers that keep this country running.”“So called “right-to-work” laws have their roots in some of the ugliest parts of our country’s history,” said Rebecca Dixon, Executive Director, National Employment Law Project. “Like so many other workplace laws, “right-to-work” is a policy that was designed to make sure that white people did not have to join unions and join their fates and interests to those of Black workers in the South. Today, these laws operate exactly as intended, and drive down wages and conditions of work in far too many states where large proportions of the working class are people of color. NELP commends Senator Warren for introducing the Nationwide Right to Unionize Act to put an end to this policy and to ensure that all workers, regardless of the state in which they live, can join together with their co-workers and build power to help determine their terms and conditions of work.” ""So-called ‘right-to-work’ laws have nothing to do with guaranteeing anyone a job – these state laws are driven by anti-worker and anti-union forces seeking to undermine the bargaining power, wages, and the rights of working people,” said Matthew Biggs, President of the International Federation of Professional and Technical Engineers (IFPTE) and IFPTE Secretary-Treasurer Gay Henson. “Our union applauds Senator Warren for reintroducing the Nationwide Right to Unionize Act which restores a core labor standard across the U.S. so that all workers have the right to come together, bargain collectively, and build union power in labor unions that have resources to represent all members."" “We are living through an incredible moment in history where more and more workers are increasingly interested in bringing the power of a union to their workplaces,” said CWA President Chris Shelton. “We have an opportunity to transform the labor movement but only if we do what is required of us in this moment and eliminate the barriers workers face to exercise their power. It is way past time to eliminate the right to work for less laws that corporations have used to systematically chip away at the power of labor unions and the ability of workers to come together and collectively fight to better their lives and the lives of their families. We are encouraged by the leadership of Senator Warren and all the supporters of this legislation and committed to see it through the finish line.” ""AFGE supports the Nationwide Right to Unionize Act,” said AFGE. “AFGE strongly supports the right of all workers to unionize in the workplace to ensure safety, health, and equity on the job.  AFGE applauds Senator Warren for introducing this bill which will bring us one step closer to granting union rights to all workers.""“Across the country, working people are demanding the freedom to band together and claim a seat at the table – in fact, the latest Gallup Poll shows a 71% approval rating for unions,” AFSCME President Lee Saunders. “To unrig the system and make it easier to organize, we need to repeal so-called ‘right-to-work’ laws, which are rooted in white supremacy and allow employers to silence the voices of working people. We applaud Senator Warren for pushing back with the Nationwide Right to Unionize Act, which would get these unjust laws off the books and help level the playing field for private-sector workers.” “A recent Gallup poll showed that 71% of Americans support workers' right to unionize - and tens of millions of Americans would join a union today if they had the chance,” Chip Shannon, Executive Director, Worker Power Coalition. “Right now, a wave of organizing is sweeping the nation as workers at stores like Starbucks, Amazon, Trader Joes and Apple are standing up and demanding their rights to collectively bargain at the workplace. For far too long, so-called Right to Work laws have restricted workers from fully realizing their abilities to come together in union to fight for better pay, benefits and working conditions. The Worker Power Coalition, which represents 24 million workers from more than 40 labor and social justice organizations is committed to updating our labor laws to better protect workers. We enthusiastically support the Nationwide Right to Unionize Act.”###"
https://www.markey.senate.gov/news/press-releases/senator-markeychair-maloneyand-reps-khanna-bush-tlaiblead-colleagues-in-urging-biden-admintostrengthen-commitment-to-environmental-justice,"60 lawmakers call on Administration to strengthen Justice40 commitment to ensure Inflation Reduction Act’s climate, clean energy ​investments are directed to frontline communitiesWashington (September 6, 2022) – Today, Senator Edward J. Markey (D-Mass.), Chair of the Environment and Public Works Subcommittee on Clean Air, Climate, and Nuclear Safety, Rep. Carolyn B. Maloney (NY-12), Chair of the House Committee on Oversight and Reform, Rep. Ro Khanna (CA-17), Chair of the House Oversight and Reform Committee’s Subcommittee on Environment, Rep. Rashida Tlaib (MI-13)​, Vice Chair of the House Oversight and Reform Committee’s Subcommittee on Environment, and Oversight Committee Member Rep. Cori Bush (MO-01) led their colleagues in a letter to the White House Council on Environmental Quality, the Office of Management and Budget, and the Office of Domestic Climate Policy urging them to strengthen the Biden-Harris Administration’s implementation of the Justice40 Initiative, to deliver at least 40 percent of the overall benefits from the federal government’s investments in climate and clean energy to disadvantaged communities. Justice40 implementation is even more critical after President Biden signed into law the Inflation Reduction Act, which will provide $60 billion to remediate environmental injustice, as well as the ongoing deployment of $350 billion in Bipartisan Infrastructure Law funding to support more equitable federal, state, and local infrastructure projects.  The lawmakers wrote, “To maximize benefits and correct for chronic underinvestment, we strongly recommend that implementation guidance clarify that the Initiative’s 40% target is a funding floor, not a ceiling.  We also recommend that the guidance apply this target to investments in disadvantaged communities, not only to overall benefits in such communities.  Direct investments are the clearest path to achieve a flow of at least 40% of benefits to the intended communities, as well as to ensure Justice40’s accountable, long-term success.”The letter continued, “We strongly support the Administration’s efforts to direct funding and resources to communities to redress discrimination, fight pollution, and cut emissions in support of President Biden’s climate, environmental justice, and equity goals.”The lawmakers urged the Administration to:Senators Jeff Merkley (D-Ore.), Elizabeth Warren (D-Mass.), Cory Booker (D-N.J.), Tammy Duckworth (D-Ill.), Bernie Sanders (I-Vt.), ​Alex Padilla (D-Calif.) and Representatives Nanette Diaz Barragán (CA-44), Jamaal Bowman, Ed.D. (NY-16), Shontel M. Brown  (OH-11), André Carson (IN-07), Sheila Cherfilus-McCormick (FL-20), Yvette D. Clarke (NY-11), Bonnie Watson Coleman (NJ-12), Gerry Connolly (VA-11), Danny K. Davis (IL-7), Mark DeSaulnier (CA-11), Debbie Dingell (MI-12), Lloyd Doggett (TX-35), Adriano Espaillat (NY-13), Dwight Evans (PA-02), Jimmy Gomez (CA-34), Raúl Grijalva (AZ-03), Jared Huffman (CA-02), Sara Jacobs (CA-53), Pramila Jayapal (WA-07), Henry C. ""Hank"" Johnson, Jr. (GA-04), Mondaire Jones (NY-17), Brenda L. Lawrence (MI-14), ​Al Lawson (FL-05), Barbara Lee (CA-13), Alan Lowenthal (CA-47), Stephen F. Lynch (MA-08), Donald McEachin (VA-04), James P. McGovern (MA-02), Grace Meng (NY-06), Kweisi Mfume (MD-07), Jerrold Nadler (NY-10), Eleanor Holmes Norton (DC), Alexandria Ocasio-Cortez (NY-14), Katie Porter (CA-45), Ayanna Pressley (MA-07), Jamie Raskin (MD-08), Lisa Blunt Rochester (DE), Linda T. Sánchez (CA-38), ​John Sarbanes (MD-03), Jan Schakowsky (IL-09), Robert C. “Bobby” Scott (VA-03), Adam Smith (WA-09), Melanie Stansbury (NM-01), Mark Takano (CA-41), Bennie Thompson (MS-02), Juan Vargas (CA-51), Nydia M. Velázquez (NY-07), ​Maxine Waters (CA-43), and John Yarmuth (KY-03) joined the letter.The lawmakers’ efforts include key environmental justice asks of the Congressional Progressive Caucus Executive Action Agenda, and the letter is supported by leading environmental justice groups including Indivisible, United Frontline Table, Grassroots Global Justice Alliance, Climate Justice Alliance, WE ACT for Environmental Justice, Sierra Club, Green New Deal Network, Michigan Environmental Justice Coalition, Center for Economic Democracy, People’s Justice Council, Alabama Interfaith Power and Light, Ironbound Community Corporation, People's Action, MoveOn, California Green New Deal Coalition, Center for Earth, Energy and Democracy, ​Clean Energy Group, and Sunrise Movement.Read a copy of the letter HERE.""We thank the Administration for acknowledging, through the Justice40 Initiative, the long suffering of communities throughout the country that suffer from historical environmental injustices. However, we are concerned with the lack of investment that should accompany the acknowledgement. Leaving it up to states to shape these investments means that we are following the same paths that have historically debilitated our upward mobility in the South. The Administration should do everything in its power to make sure states and communities on the ground get resources they need, and that means strong Justice40 rules and enforcement . Tracking benefits to communities is not enough, we need direct investments and 100% of justice."" - Reverend Michael Malcolm, People’s Justice Council Alabama“For Justice40 to be the transformative legacy-establishing program we all wish to see, we need all levels of government fully engaged. We feel our government at the community level, we are most likely to know who our mayors and city council folks are. The federal government should be asking states and municipalities directly how they can be a part of the changes Justice40 can bring. Justice40 needs to be the talk around town so that every community member helps us hold accountable agencies, states and municipal governments. This is the way to a real ‘all of government’ approach.” - Maria Lopez-Nunez, Ironbound Community Corporation“California’s legislature recently killed AB 2419, the California Justice40 Act, a bill that would have committed the state to President Biden’s Justice40 Initiative by ensuring targeted investment of federal funds from the Inflation Reduction Act and the Infrastructure Investment and Jobs Act to frontline and disadvantaged communities. Without that bill, and with added concerns that the IRA contains elements that will cause harm to those communities, our hope now is for the Biden Administration to keep its word and strengthen rules to its J40 Initiative in order to address those harms while ensuring investments land in the hands of disadvantaged communities.” - Zach Lou, California Green New Deal Coalition""President Biden's Justice40 Initiative is an opportunity to correct the legacy of pollution in Black, Brown, Indigenous, and poor communities in Michigan and around the country. But, the federal government must also ensure that no new harms come our way from projects such as fossil fuel infrastructure, carbon capture technology, hydrogen, and nuclear energy. Those projects are incompatible with the principles of Environmental Justice, and they will not deliver any benefits to our people or the planet. The Justice40 Initiative should not count them as beneficial in any way. Instead, it must prevent and keep track of any harms from false solutions funded in the Infrastructure, Investments and Jobs Act, and the Inflation Reduction Act."" - Juan Jhong Chung, Michigan Environmental Justice Coalition.“Communities of color were critical to getting President Biden elected. With the Justice40 Initiative Biden made a commitment to ensure federal investments materially benefit frontline communities, and we are looking to him to deliver on his promise. His administration must not delay any further its final guidance to agencies on Justice40. The initiative has the potential to direct historic levels of critically-needed investments to communities at the frontlines of pollution and climate crisis who need them the most. The administration should listen to leaders in Congress echoing grassroots demands to implement Justice40 comprehensively, with deep engagement of impacted communities at every level of implementation, and to ensure no federal investments do harm to any communities.” - Adrien Salazar, Grassroots Global Justice Alliance“President Biden was listening to frontline communities who have long been organizing around targeted investments to impacted communities. Now, as the Administration is preparing its final guidance on J40 it is critical the White House follow the leadership of frontline organizations and strengthen the initiative by sending funds directly to frontline communities, creating good local jobs, centering justice, and ensuring the guidance is incorporated quickly. We thank the Congressional champions who worked to uplift these voices and this fight, and know it is due to the hard work of organizers and communities on the frontlines of the climate crisis that the boldest possible guidance will be won.” - Ann Clancy, Indivisible""Members of Congress should be commended for this bold set of recommendations and reform ideas to advance Justice40 and fulfill its promise as a whole-of-government vision of ensuring justice for frontline communities in the climate transition. With the Inflation Reduction Act, there is a mix of positive and harmful investments, which means that fully applying Justice40 is all the more important. Roosevelt Institute is eager to see Justice40 flourish as part of a better climate future, and we are grateful to partner with the United Frontline Table and other grassroots leaders in developing the strongest possible policies and rules toward advancing that goal. It is essential that the Administration follow through in implementing Justice40 by protecting communities from continuing harm and ensuring that federal resources for what they truly need are reaching the most impacted communities."" - Lew Daly, Roosevelt Institute“Clean Energy Group fully endorses the immediate adoption of these recommendations governing the implementation of the Justice40 Initiative. It is imperative that strong guidelines are put into place to ensure that Justice40 results in transparent, clearly beneficial, direct investment in communities most harmed by legacy fossil fuel infrastructure, systemic racism, and chronic underinvestment and strengthens those most vulnerable to hardships exacerbated by the climate crisis.” - Seth Mullendore, Clean Energy Group###"
https://www.markey.senate.gov/news/press-releases/markey-cardin-colleagues-seek-details-on-state/dhs-plan-to-increase-refugee-admissions,"“The need for robust refugee resettlement is high. If current conflict trends continue, the 21st century will be defined by an ever-rising population of people forced to flee their homes and by increasingly limited options for them to turn to.”Washington (August 31, 2022) — Senator Edward J. Markey (D-Mass.) today joined nine of his colleagues led by Senator Ben Cardin (D-Md.) in sending a letter to Secretary of State Antony Blinken and Secretary of Homeland Security Alejandro Mayorkas asking for clarity on plans for rebuilding the U.S. Refugee Admissions Program (USRAP). “At this critical moment for refugees around the world, the U.S.’s moral and legal obligation to our longstanding, bipartisan refugee resettlement program has never been more important,” the senators wrote. “We welcomed Executive Order (EO14013) on rebuilding and enhancing programs to resettle refugees in February 2021, which was desperately needed to address the harm inflicted on the program by the previous administration. This Administration has faced significant challenges in this work, including the numerous discriminatory policies enacted by the previous administration, the implications of the ongoing COVID-19 pandemic, and the need to evacuate over 70,000 Afghans through Operation Allies Welcome.”“Through your leadership of this interagency effort, we urge you to rapidly adjudicate refugee cases, in particular family reunification cases; to prioritize the implementation of reforms outlined in Executive Order 14013; and to collaborate substantively with Congress and with the refugee resettlement agencies to increase the pace of this work.” The senators include more than a dozen questions seeking more details on processing capacity of the USRAP, as the consultation process for the FY23 Presidential Determination begins.In addition to Markey, the letter was also signed by Senators Dianne Feinstein (D-Calif.), Tim Kaine (D-Va.), Amy Klobuchar (D-Minn.), Pat Leahy (D-Vt.), Chris Murphy (D-Conn.), Patty Murray (D-Wash.), Bernie Sanders (I-Vt.), Chris Van Hollen (D-Md.) and Elizabeth Warren (D-Mass.).Read a copy of the letter HERE.“The current Administration has taken important steps to rebuild the USRAP. But thousands of refugees have been waiting their turn for years, and for some time is running out. They’ve lost years that they could have spent rebuilding their lives and enriching our communities. Instead, they wait, they struggle, and try not to lose hope. As the world only gets more dangerous for religious minorities, political activists, women leaders, and others who face persecution, we call on the Administration to aim high with an FY23 admissions goal of 200,000. We look to our champions in Congress to provide resources to achieve this target. Now is the moment for the U.S. to reclaim its position as a leader in refugee resettlement,” said Melanie Nezer, Senior Vice President of Global Public Affairs, HIAS.""The need to rebuild and strengthen the U.S. Refugee Admissions Program has never been greater. As we face the worst refugee crisis in history, the United States has a moral obligation to invest in our capacity to welcome and make the necessary improvements to increase refugee arrivals,"" said Meredith Owen, Director of Policy and Advocacy at Church World Service. ""CWS calls on the administration to meaningfully consult with Congress and set the FY 2023 refugee admissions goal of 200,000, in line with global need. before September 30th. An admissions goal of 200,000 will signal to the world that the United States is serious about restoring moral leadership and will show allies that we’re committed to doing our part.""###"
