url,text
https://www.carper.senate.gov/public/index.cfm/2022/5/carper-cornyn-welcome-launch-of-indo-pacific-economic-framework,"Trade panel leaders applaud announcement, have long called for re-engagement in the Indo-Pacific region WASHINGTON, D.C.—U.S. Senators Tom Carper (D-Del.), Chairman of the Senate Finance Subcommittee on International Trade, Customs, and Global Competitiveness, and John Cornyn (R-Texas), the Subcommittee’s Ranking Member, today welcomed the launch of the Indo-Pacific Economic Framework announced by President Biden and twelve Indo-Pacific countries. The framework will help the United States write the rules of the road for trade and create a stronger, more resilient economy here in the U.S. and abroad.“One of the best ways we can counter China’s anti-competitive trade practices is by working productively with our Indo-Pacific allies to write global trade rules. And while I’ll never understand why the previous Administration decided to walk away from an agreement that would have allowed us to do that, I applaud President Biden’s action today to put the U.S. back in the driver’s seat,” said Carper. “The Indo-Pacific Economic Framework will boost American competitiveness and help shore up supply chains to lower costs for consumers. I look forward to continuing to work with the Administration on further developing the Framework to ensure it supports American workers and businesses and upholds our values.”    “While not perfect, this framework is a good first step toward a comprehensive free trade agreement in the region and reinforces the U.S. commitment to those nations and allies that abide by the rules-based, international trading system,” said Cornyn. “I look forward to working with my colleagues to push for critical priorities including market access for American businesses, farmers, and ranchers and prioritizing crucial areas such as digital trade.”  Background:Both Chairman Carper and Ranking Member Cornyn have long called for the United States to re-engage with our Asia-Pacific allies following the previous Administration’s misguided decision to withdraw from the Trans-Pacific Partnership (TPP). Last year, Chairman Carper and Ranking Member Cornyn sent a letter to U.S. Trade Representative (USTR) Katherine Tai calling for the U.S. to reassert trade leadership in the Asia-Pacific region by engaging again with allies to develop comprehensive, multilateral free-trade partnerships.Chairman Carper and Ranking Member Cornyn also penned an op-ed last year in the Washington Post arguing that the U.S. must re-engage our Asia-Pacific allies to forge multilateral trade partnerships to counter China’s geopolitical rise in the region and benefit American manufacturers, farmers and small businesses.##"
https://www.carper.senate.gov/public/index.cfm/2022/5/carper-calls-for-administration-to-include-taiwan-in-indo-pacific-economic-framework,"‘Including Taiwan in the IPEF would be an invaluable signal of our rock-solid commitment to Taiwan and its prosperity and freedom.’WASHINGTON, D.C. — U.S. Senator Tom Carper (D-Del.), Chairman of the Senate Finance Subcommittee on International Trade, joined Senators Bob Menendez (D-N.J.), Jim Risch (R-Idaho), and 50 of their Senate colleagues in urging the Biden Administration to include Taiwan as a partner in the proposed Indo-Pacific Economic Framework (IPEF). In a letter to President Biden, the senators noted Taiwan’s importance to the United States as an important trading partner and underscored that failing to include Taiwan in IPEF runs counter to U.S. economic interests in the region.“IPEF can be a meaningful first step for the United States to assure its allies and partners that we are economically engaged in the region, which accounts for sixty percent of the world economy and two-thirds of all economic growth over the last five years. For IPEF to be a useful vehicle to advance a free and open Indo-Pacific, however, we must make sure that all of America’s regional allies and partners are included,” the senators wrote. “This is just one necessary aspect to ensuring the framework is competitive in a region already saturated with economic treaties and agendas.”  “The more economic engagement U.S. and allies and partners have with Taiwan, the stronger our collective resilience against coercion,” the senators added. “Russia’s invasion of Ukraine shows the value of tangible economic support by the United States and like-minded allies and partners, and the same is true for Taiwan. Including Taiwan in the IPEF would be an invaluable signal of our rock-solid commitment to Taiwan and its prosperity and freedom.”Background:Chairman Carper has long called for the United States to re-engage with our Asia-Pacific allies following the previous Administration’s misguided decision to withdraw from the Trans-Pacific Partnership (TPP). Last year, Chairman Carper sent a letter to U.S. Trade Representative (USTR) Katherine Tai calling for the U.S. to reassert trade leadership in the Asia-Pacific region by engaging again with allies to develop comprehensive, multilateral free-trade partnerships. Chairman Carper and Ranking Member Cornyn (R-Texas) also penned an op-ed last year in the Washington Post arguing that the U.S. must re-engage our Asia-Pacific allies to forge multilateral trade partnerships that would counter China’s geopolitical rise in the region and benefit American manufacturers, farmers and small businesses.You can read the full letter HERE. ###"
https://www.carper.senate.gov/public/index.cfm/2022/5/senator-carper-now-accepting-applications-for-service-academy-nominations,"WILMINGTON, Del. – U.S. Senator Tom Carper (D-Del.), a 23-year veteran of the Navy and the last Vietnam veteran serving in the Senate, today announced his office is accepting applications from students interested in a nomination to a U.S. Service Academy. Each year, members of Congress nominate young constituents for the opportunity to be appointed to a U.S. Service Academy. The deadline for applications to be submitted is Oct. 15, 2022, at 11:59 p.m. The application can be found by going to www.carper.senate.gov and clicking on “Services” and “Service Academy Nominations.”“My time serving in the United States Navy made me the leader I am today. That is why I take the opportunity to nominate Delaware students to our nation’s service academies seriously,” said Senator Carper.  “The academies seek those who have good moral character, a commendable academic record, the desire to serve, and the motivation to lead. I encourage those who possess these qualities to look into applying to a service academy.” To be considered for an appointment to a U.S. Service Academy, students must have a nomination. In order to be considered for a congressional nomination, it is necessary that students meet all of the general requirements of the academy of choice and complete an online application. Those requirements include: For more information, call Senator Carper’s Dover Office at (302) 674-3308.###"
https://www.carper.senate.gov/public/index.cfm/2022/5/carper-pushes-white-house-for-national-formula-coordinator-to-ease-burden-on-delaware-parents,"Carper joins colleagues in calling on President Biden to immediately appoint a White House coordinator on infant formula and develop a national strategy to address shortages WASHINGTON, D.C. – U.S. Senator Tom Carper (D-Del.) encouraged President Biden to assign a coordinator within the White House to address the nationwide infant formula shortage. In a letter led by Senators Patty Murray (D-Wash.) and Bob Casey (D-Pa.), Carper urged the White House to appoint an adviser to work with manufacturers directly, and to implement a national strategy to increase the resiliency of the infant formula supply chain and protect against future contamination and shortages.“We need organized leadership and a clear plan for addressing this crisis. We cannot stop working on this issue until babies are fed,” wrote the Senators. “The federal government needs to do more to get formula back on shelves as soon as possible and secure the supply chain of infant formula to prevent this type of crisis from happening again. These actions require a government-wide response, as the issue spans food supply chain security, regulatory oversight, public health surveillance, market competition, government contracting, and more. We urge you to immediately assign a coordinator within the White House to work with manufacturers directly and oversee the development and implementation of a national strategy for increasing the resiliency of the infant formula supply chain and protecting against future contamination and shortages.”The letter was also signed by Senators Hassan (N.H), Smith (Minn.), Blumenthal (Conn.), Reed (R.I.), Hirono (Hawaii), Shaheen (N.H.), Rosen (Nev.), Kelly (Ariz.), Sinema (Ariz.), King (Maine), Warnock (Ga.), Wyden (Ore.), Merkley (Ore.), Baldwin (Wis.), Padilla (Calif.), Heinrich (N. M.), Gillibrand (N.Y.), Markey (Mass.), Booker (N.J.), Cortez-Masto (Nev.), Duckworth (Ill.), Menendez (N.J.), Hickenlooper (Colo.), Brown (Ohio), Whitehouse (R.I.), Kaine (Va.), Lujan (N.M.), Van Hollen (Md.), and Warren (Mass.).To view the full letter, click here.  ###"
https://www.carper.senate.gov/public/index.cfm/2022/5/carper-urges-suppliers-to-increase-infant-formula-production,"WASHINGTON, D.C. – U.S. Senator Tom Carper (D-Del.) urged infant formula manufacturers to take critical steps to prevent formula shortages. In a letter with Senate colleagues led by Senator Patty Murray (D-Wash.), Carper urged suppliers to increase production and distribution following a nationwide shortage of infant formula that has made it harder for parents and caregivers to obtain infant formula at local stores. This is a critical issue especially for Delaware, which reportedly has the second highest out-of-stock rate of formula in the nation.“This shortage has placed an unacceptable burden on parents and caregivers and has put the health of babies and infants at risk,” the Senators wrote. “For many families, infant formula is critical for ensuring their children receive the nutrition they need to grow healthy and well-nourished. This shortage has been especially challenging for some of the most vulnerable infants, with particularly acute shortages of specialty formulas to address health needs such as allergies, gastrointestinal issues, or metabolic disorders. There is no easy substitute for infant formula, and this shortage has left families across the nation scrambling to figure out how they will care for their children. We urge the Infant Nutrition Council of America and your member companies to do all you can to increase infant formula production and distribution, and prevent future supply chain disruptions.” To view the full letter, click here.Delaware Public Health provided guidance to families struggling to find formula, and urges Delawareans to visit dethrives.com for up-to-date information on Delaware’s response to the infant formula supply chain issue, or call 211 for community resources. ##"
https://www.carper.senate.gov/public/index.cfm/2022/5/carper-celebrates-bipartisan-postal-legislation-promoting-wildlife-conservation-becoming-law,"WASHINGTON, D.C. – U.S. Senator Tom Carper (D-Del.), Chairman of the Senate Environment and Public Works Committee, today celebrated the news that his Multinational Species Conservation Funds Semipostal Stamp Reauthorization Act was signed into law. The bicameral, bipartisan legislation— which Carper introduced alongside Senator Rob Portman (R-Ohio), Ranking Member of the Senate Homeland Security and Governmental Affairs Committee, and U.S. Representatives John Katko (R-N.Y.) and Jim Costa (D-Calif.)— requires the U.S. Postal Service to sell the approximately 41 million remaining Saving Vanishing Species Stamps left in stock. When the program began in 2011, the U.S. Postal Service printed 100 million stamps to help promote wildlife conservation.“With President Biden signing the Multinational Species Conservation Funds Stamp Reauthorization Act into law, Americans can continue to protect the at-risk species we love by purchasing postal stamps,”said Carper. “Supporting this program right now is critical as our world’s most threatened wildlife face threats like habitat loss, poaching, and climate change. My thanks go out to Senator Portman and all supporters of this legislation for their hard work in getting this bipartisan effort across the finish line.” “We owe it to our future generations to preserve our planet’s rich wildlife and natural resources so they can continue to be enjoyed,” said Portman. “This successful stamp program has raised millions of dollars to fund conservation without any taxpayer money. I’m proud this bicameral, bipartisan legislation has been signed into law so that we can ensure that every last stamp is sold.”“The Save Vanishing Species Semipostal stamp – or Tiger Stamp – gives every American the opportunity to easily and effectively contribute to programs that protect imperiled species including tigers, rhinos, great apes, turtles, tortoises, and elephants. To date, these stamps have raised over $6.5 million for critical conservation programs around the globe,” said Danielle Kessler, U.S. Country Director for the International Fund for Animal Welfare. “Thanks to the leadership of Senators Portman and Carper and Representatives Costa and Katko, these popular stamps will now remain available to postal customers, and continue to provide support for endangered animals around the world. A win for these beloved species and for postal customers.”“On the eve of Endangered Species Day, Congress and President Biden have given us a reason to celebrate now that the Multinational Species Conservation Funds Semi-Postal Stamp Reauthorization Act has been signed into law. The bipartisan bill ensures that the ‘Tiger Stamp’ will remain on U.S. Post Office shelves until the last stamp is sold,” said Ginette Hemley, senior vice president, wildlife conservation, World Wildlife Fund. “It seems fitting that, with 2022 the ‘Year of the Tiger,’ this beautiful stamp has been given new life and will continue to help fund U.S. Fish and Wildlife Service efforts to restore populations of these big cats and other magnificent species in their wild habitats. We commend the champions in Congress and the Administration who have made this program a lasting success and a legacy of U.S. leadership on global wildlife conservation.” “The Save Vanishing Species stamp makes the act of conserving wildlife as easy as mailing a letter,” said John Calvelli, Wildlife Conservation Society Executive Vice President of Public Affairs. “This continues to be a win-win as we can increase the financial support for conserving some of our most iconic, endangered species and engage everyday Americans in the cause. Thanks to Reps. Jim Costa and John Katko, Sens. Rob Portman and Tom Carper, and all the members of Congress that worked to keep this important conservation tool on sale.”“The Tiger Stamp has generated $5.7 million to conserve some of the world’s most iconic wild animals, and now Americans can continue to increase that sum each time they visit the post office,” said Sara Amundson, president of Humane Society Legislative Fund. “We are thrilled this legislation is now law. We thank Congress for passing it and President Biden for signing it, with special gratitude to Senators Portman and Carper and Representatives Costa and Katko for shepherding it through.”“Once again, Senators Portman and Carper and Representatives Katko and Costa have shown their willingness to work together to protect wildlife and wild places,” said the Association of Zoos and Aquariums. “In this case, quite literally, showing our nation’s continued commitment to stamping out extinction. Now everyone can play a role in conserving African and Asian elephants, great apes, rhinos, tigers, marine turtles, freshwater turtles, and tortoises simply by purchasing some stamps. Everyone should celebrate this achievement by purchasing Save Vanishing Species Stamps.”BackgroundOn September 20, 2011, the U.S. Postal Service issued the Saving Vanishing Species Stamp, depicting an endangered Amur tiger cub, priced above the normal price of a first-class stamp. The difference in price from this first-class stamp is transferred to the U.S. Fish and Wildlife Service to support the five Multinational Species Conservation Funds to protect tigers, rhinoceroses, Asian and African elephants, marine turtles, and great apes. These programs target poaching, illegal wildlife trade, habitat protection, and projects to incorporate species conservation into community development.Through purchases of 59 million tiger stamps to-date, out of a total of 100 million stamps, Americans have raised more than $6.5 million for conservation projects. This funding has helped support 135 on-the-ground conservation projects in 37 countries. These projects have leveraged more than $25 million in matching funds provided by partners. ###"
https://www.carper.senate.gov/public/index.cfm/2022/5/carper-tours-south-bethany-storm-damage-highlights-legislation-to-help-beach-recovery,"SOUTH BETHANY, Del. – U.S. Senator Tom Carper (D-Del.), Chairman of the Senate Environment and Public Works Committee, today joined South Bethany leaders, along with officials from the U.S. Army Corps of Engineers and the Delaware Natural Resources and Environmental Control, to view storm damage at South Bethany Beach from recent Nor’easter storms. Senator Carper spoke about how he recently introduced bipartisan legislation, the Water Resources Development Act, that would help Delaware beaches with storm recovery. This legislation is now ready for consideration by the full Senate.“I’m proud to have introduced the Water Resources Development Act of 2022, bipartisan legislation that will help give the Delaware the ability to recover from future storms like this. This bill will be critical to help protect our communities and keep our beaches beautiful and accessible to all,” said Carper.“We appreciated Senator Carper’s visit today to view the storm damage to our beach,” said South Bethany Mayor Tim Saxton. “Senator Carper has consistently worked to assure funding for beach replenishment here in Delaware.  We support his efforts with the Water Resources Development Act to enable recovery from damage due to future storms.” ###"
https://www.carper.senate.gov/public/index.cfm/2022/5/carper-statement-on-the-sale-of-the-trump-hotel-lease,"WASHINGTON, D.C. — U.S. Senator Tom Carper (D-Del.), Chairman of the Senate Environment and Public Works Committee, which has jurisdiction over the General Services Administration (GSA), released the following statement on the final sale of the Trump Hotel’s lease for the Old Post Office Building.“This sale closes a shameful five year chapter at the General Service Administrations. The only relief I find by this news is the removal of the Trump name on this building, signaling an end of the federal government entanglements with the previous President’s moral, ethical, and legal shortcomings.“However, this sale does not put an end to questions about GSA’s failures over the last few years to uphold the public’s trust in overseeing the lease of the Trump Hotel property to the Trump Organization.“Shortly after the November 2016 election, I asked GSA to look into obvious conflicts of interest then President-elect Trump held as the incoming the head of government with a major financial interest in his namesake hotel located on government property. GSA refused my multiple requests for information and failed the American people by its unwillingness to provide transparency into the government’s business relationship with the Trump organization.“Failures like this at our highest level of government erode the American people’s confidence in our democracy. Even now, the emerging details regarding this sale do not assuage my concerns about whether former President Trump unduly enriched himself through his political power, both while he held office and even after he left the Presidency. The American people deserve better.“"
https://www.carper.senate.gov/public/index.cfm/2022/5/carper-and-capito-introduce-legislation-to-support-national-wildlife-refuge-system,"WASHINGTON, D.C. — U.S. Senators Tom Carper (D-Del.), Chairman of the Senate Environment and Public Works Committee, and Shelley Moore Capito (R-W.Va.), the Committee’s Ranking Member, introduced legislation to support our National Wildlife Refuge System. The Keep America’s Refuges Operational Act will reauthorize appropriations for the National Wildlife Refuge System volunteer, educational, and community partnership program, an initiative that helps ensure public access to national refuges for exploring, hunting, fishing and studying wildlife.“National Wildlife Refuges are natural treasures for all Americans to enjoy. We especially saw the importance of our national public lands, including refuges, during the pandemic, when these critical wildlife habitats also served the public as safe outdoor spaces for recreation—thanks, in large part, to the hard work of dedicated volunteers. I’m delighted to introduce the Keep America’s Refuges Operational Act to support these volunteers and our refuges, and just in time to mark World Migratory Bird Day this Saturday. People come from around the world to see migratory birds at Delaware’s two national wildlife refuges, and volunteers are critical in helping these visitors have the experience of a lifetime,” said Senator Carper.  “The Keep America’s Refuges Operational Act of 2022 reauthorizes volunteer, community, and educational programs that will support America’s wildlife refuges. Some of our greatest assets are our lands and waters, and this legislation ensures that citizens can continue to volunteer and play a role in the National Wildlife Refuge System and preserve it for future generations,” said Senator Capito.   America’s 568 National Wildlife Refuges are located in all 50 states and the five territories. They make up 850 million acres of pristine public lands and waters dedicated to the conservation of fish and wildlife. Wildlife refuge volunteers are individuals who want to give back to their communities, parents who want to be good stewards of the land and set examples for their children, retired people willing to share their wealth of knowledge, concerned citizens of all ages who want to learn more about conservation, and passionate people who enjoy the outdoors and want to spread the word about America’s greatest natural treasures. Their contribution is significant: in Fiscal Year 2021, more than 11,000 volunteers donated 68,879 hours of their time to benefit the National Wildlife Refuge System. The value of their time contribution is equal to $18.5 million and equivalent to 318 full-time refuge staff.  The bill is supported by: The American Bird Conservancy; American Fisheries Society; American Hiking Society; American Sportfishing Association; U.S. Chamber of Commerce; Coalition of Refuge Friends and Advocates; Defenders of Wildlife; Ducks Unlimited; Izaak Walton League of America; National Audubon Society; National Wildlife Federation; National Wildlife Refuge Association; The Nature Conservancy; The Wilderness Society; Theodore Roosevelt Conservation Partnership; and Trout Unlimited.  Full text of the bill can be found here.### "
