url,text
https://www.durbin.senate.gov/newsroom/press-releases/durbin-duckworth-announce-3-million-for-illinois-state-board-of-education,"WASHINGTON – U.S. Senate Majority Whip Dick Durbin (D-IL) and U.S. Senator Tammy Duckworth (D-IL) today announced $3,000,000 in Competitive Grants for State Assessments for the Illinois State Board of Education (ISBE). This funding will allow ISBE to create innovative assessments for Spanish language arts students in grades 9 and 10, as well as significantly expand educator professional learning and parent/student engagement activities.“Today’s students are tomorrow’s future – it is critical that our assessments are equitable and allow students to show their knowledge,"" said Durbin. “This investment will allow educators to meet the needs of more students and engage families, and I look forward to seeing the positive outcome from these inclusive assessments.”“This infusion of federal support for Spanish-speaking students will contribute to more inclusivity in our state’s education system,” said Duckworth. “With these resources, the Illinois State Board of Education will be better equipped to meet the needs of so many high schoolers and their families, while helping more of Illinois’s young people succeed in school and beyond.”English-learner (EL) students are the country’s fastest growing students demographic, but the least likely to graduate. ISBE’s implementation of these high-quality assessments will provide valuable information foreducators, students, and to help close the gaps in student opportunities and improve outcomes for EL students. Along with developing the new assessments for students in grades 9 and 10, ISBE will engage up to 150 educators across the state in intensive, year-long learning activities to help them better understand the new assessments and strategies to improve the success of Spanish-dominant high school students.-30-"
https://www.durbin.senate.gov/newsroom/press-releases/durbin-visits-quincy-bay-discusses-restoration-project,"QUINCY – U.S. Senator Dick Durbin (D-IL) today visited Quincy Bay, one of the largest natural bays of the Upper Mississippi River, to discuss its restoration project. This project aims to reverse the impact of sedimentation and erosion at Quincy Bay to improve the quality and diversity of waterfowl, fish, and wildlife populations, aquatic and forest habitat, and other ecologically significant features such as water depth and wetlands.Durbin pushed the U.S. Army Corps of Engineers to include the project as part of the Upper Mississippi River Restoration (UMRR) Program, resulting in the current feasibility study which began last year and will be completed in 2024. Durbin will continue to work to secure funding for the UMRR program to ensure the Quincy Bay project moves forward.“Eighty years of river traffic has brought sediment, silt, and a significant loss of water volume to Quincy Bay, making the environmental need for this restoration project very clear,” said Durbin. “Restoring Illinois’ waterway ecosystems are an essential component of our state’s environmental diversity, and I’ll keep pushing for federal investments to make sure these critical projects have the funding they need.”Quincy Bay has experienced severe sedimentation and land erosion that is impacting the area’s ecosystem, including more than 70 percent loss in water volume during the past 80 years. This restoration project will dredge Quincy Bay to 10-foot depths. A rock dam will be built to prevent further erosion from river traffic and topological improvements, such as island elevation and wildlife habitat restoration.In July, Durbin secured several key Illinois priorities in the Senate-passed Water Resources Development Act (WRDA), including an increase in the funding limit for the UMRR Program from $40 million to $75 million. The additional $35 million—if appropriated—would help ensure the full completion of UMRR projects like the restoration of Quincy Bay.  Durbin also helped secure $33 million for UMRR in the FY22 Omnibus. -30-"
https://www.durbin.senate.gov/newsroom/press-releases/durbin-questions-cftc-chairman-at-agriculture-committee-hearing-on-digital-assets,"WASHINGTON – U.S. Senate Majority Whip Dick Durbin (D-IL), today, in a Senate Agriculture, Nutrition, and Forestry Committee hearing, questioned the Commodity Futures Trading Commission (CFTC) Chairman Rostin Behnam about financial market stability given the extreme volatility of the crypto market.“My concern is this: I’m glad we’re talking about regulation. We have to have it. But I worry we are doing enough to salve our conscience, but not doing enough to put up guardrails and stop signs on the crypto express,” Durbin said. Mr. Behnam agreed that cryptocurrency is disrupting financial markets. He said that while being deliberate and cautious, the CFTC must engage and instill regulatory principles.Durbin responded, “If you’re serious about regulation of an industry where one in five Americans has invested… and we’re now getting into retirement accounts… there’s a lot more exposure and a lot more risk than just a year or two ago.”Durbin has raised concerns about cryptocurrency and the dangers it poses to personal finances and retirement. Durbin, along with Senators Elizabeth Warren (D-MA) and Tina Smith (D-MN), previously requested answers from Fidelity Investments on their decision to allow 401(k) plan sponsors to offer plan participants exposure to Bitcoin, a highly volatile and unregulated digital asset. Fidelity is one of the largest 401(k) providers with around 40 million individual investors and around $11.3 trillion in assets under administration. Video of Durbin’s remarks from the hearing is available here.Audio of Durbin’s remarks from the hearing is available here.Footage of Durbin’s remarks from the hearing is available here for TV Stations.  -30-"
https://www.durbin.senate.gov/newsroom/press-releases/durbin-slams-fdas-missed-deadlines-to-protect-our-children-from-nicotine-addiction,"WASHINGTON – In a speech on the Senate floor today, U.S. Senate Majority Whip Dick Durbin (D-IL) condemned the Food and Drug Administration’s (FDA) failure to meet e-cigarette and synthetic nicotine deadlines, unwillingness to take action against companies that defy the agency’s orders, and general lack of urgency when it comes to protecting children from the harms of tobacco and nicotine use.  The court-ordered deadline for FDA to finish reviewing e-cigarette applications was more than one year ago, September 9, 2021, and yet the agency has only completed reviews of about half of those e-cigarettes with submitted applications that represent a large share of the market—leaving dangerous, kid-friendly e-cigarettes available on store shelves to hook children.Durbin said, “As a result of FDA’s inaction, dangerous, kid-friendly e-cigarettes remain available on store shelves without FDA review or authorization.  The Truth Initiative estimates that in the year since the FDA missed the federal court deadline to approve or reject e-cigarette applications, nearly two and a half million children and young adults started using vaping products.  Many of those young people may go on to develop nicotine addictions, with serious harm to their health.  That is the human cost of the FDA’s unwillingness to do its job.”Durbin also condemned FDA for failing to meet synthetic nicotine application deadlines.  Durbin and Senator Susan Collins (ME-R) successfully secured a bipartisan provision in the Fiscal Year 2022 Omnibus Appropriations bill that clarified FDA’s ability to regulate products containing synthetic nicotine as tobacco products.  This legislative fix was necessary to close legal loopholes that manufacturers of kid-friendly, flavored e-cigarettes sought to sidestep FDA regulation, which had the potential to erase recent progress made toward curbing the nationwide youth vaping epidemic.  Unfortunately, FDA also failed to complete its review of synthetic nicotine products by a July 13th deadline, leaving these addictive products on the market without authorization and in violation of the law. One of the most popular e-cigarettes among children today, Puff Bar, uses synthetic nicotine.  “To make matters worse, even when the FDA does review a product and issues a denial, many e-cigarette companies just ignore them.  It's reached a point that they're not viewed seriously.  The number one regulator of food and drugs in America when it comes to protecting our kids from these deadly addictive products isn't viewed seriously.  The FDA has the legal right and the legal authority to do something. They can pull these products off the shelves tomorrow. And yet with respect to illegal e-cigarettes, they do nothing,” Durbin continued.Given these ongoing failures of FDA to meet deadlines or enforce orders, last week, Durbin sent a letter to Health and Human Services (HHS) Secretary Xavier Becerra to step in.During his speech, Durbin also urged his colleagues to attach his bipartisan dietary supplement legislation to an upcoming reauthorization of FDA’s “user fee” programs. These programs authorize FDA to collect various user fees from the companies they oversee, including prescription drug and medical device companies.“Many people were surprised to learn that today dietary supplement companies are not even required to register their products with the FDA. They aren't required to tell the FDA the ingredients of their products,” Durbin said.Durbin and Senator Mike Braun’s Dietary Supplement Listing Act of 2022 would require dietary supplement manufacturers to list their products with the FDA, as well as provide basic, common sense information about ingredients and labels.  Durbin is currently pushing for the legislation to be included in any final “user fee” package that reaches the Senate floor.Durbin concluded, “The FDA is one of the most important agencies in the federal government. It's fallen on hard times.  It is there to protect the health of families across the country, especially our children.  Whether it's dietary supplements, tobacco, or e-cigarettes, we need to make sure the FDA not only has the tools for the job, but uses them.”Video of Durbin’s floor speech is available here.Audio of Durbin’s floor speech is available here.Footage of Durbin’s floor speech is available here for TV Stations.-30-"
https://www.durbin.senate.gov/newsroom/press-releases/durbin-we-should-work-together-to-create-an-immigration-system-that-reflects-the-best-of-america,"WASHINGTON – In a speech on the Senate floor, U.S. Senate Majority Whip Dick Durbin (D-IL), Chair of the Senate Judiciary Committee, reflected on his recent visit to the Salvation Army Freedom Center in the Humboldt Park neighborhood in Chicago to meet with migrant families who were forced to come to Chicago from Texas by Governor Greg Abbott (R-TX). During his speech, Durbin praised Chicago’s agencies for stepping up to support these migrants. Durbin’s mother is an immigrant who came from Lithuania to the United States in 1911.Durbin said, “These modest acts of generosity have changed everything for the families arriving at that Salvation Army Freedom Center. In Chicago, we are honored to offer a warm, welcoming hand to these families escaping unimaginable horror… America opened its doors to my family all those years ago—and gave us a chance to find stable footing in a new land of opportunity. Today, it is our responsibility to welcome families fleeing violence and persecution, seeking nothing more than safety and a fair shot. This is fundamental to who we are as Americans. But sadly, it seems some politicians think otherwise.”Durbin blasted Governor Abbott for exploiting a humanitarian crisis to score political points. Abbott also refused to notify Illinois or Chicago that these migrants were coming.  “He took advantage of the fear and confusion. He rounded these families up, boarded them onto a bus, and shipped them to cities like Chicago and New York, without even telling them where they were headed, and without any consultation with their destination states. This is cruelty of the highest degree,” Durbin continued.During his visit, Durbin met a man named Carlos, who came to the United States with his wife and two young daughters from Venezuela. The family traveled to reach the Texas-Mexico border by foot. The journey took four months, and they were faced with violence, theft, and exploitation. Durbin also met another man, William, who fled Venezuela, looking for a better life in America.  “Carlos had no intention of ending up in this great city. When he and his family arrived in America, he told me, with real gratitude, that he wanted to stay in Chicago. I warned him to get ready for the winter. They've been amazed by the welcome they've received from the Salvation Army and from so many others,” Durbin said.As the lead author of the Dream Act and Chair of the Judiciary Committee, Durbin has been a champion for immigration reform for years. Both Carlos and William are eager to work in the United States, but because they are asylum seekers, they are at least six months away from being able to legally work here.“This is yet another example of a broken immigration system. The system has failed not just these families, but our nation's economy as well. We have ten million unfilled jobs in this country. We have five million unemployed Americans. There are jobs in every direction... In every direction they need these workers and now. Yet we don't have a system that allows for these people to come to this country and to legally work. It doesn't make any sense,” said Durbin. “We are a nation desperate for workers—particularly young, able-bodied people like Carlos and William. But we can’t put them to work. How does that make any sense? It’s the same story for millions of people living throughout our hemisphere: even though American employers would be willing to sponsor them, there are few, viable legal immigration pathways for them to make it to America. And as a result, the arduous journey to the Mexican-American border is the only option they have in front of them. I’ll be the first to agree with my colleagues on the other side in saying we need an orderly process at our border.”Durbin continues to work with his colleagues to find viable options for comprehensive immigration reform. Durbin, along with seven of his Republican and Democratic colleagues worked on a comprehensive immigration reform package that would have addressed many of the challenges our nation faces at the border today.  That legislation passed the Senate with bipartisan support in 2013 but did not receive a vote in the Republican-controlled House. Durbin concluded, “Our nation’s immigration system should reward hard work and a determination to make it in America. Instead of exploiting families who are fleeing for their lives, we should work together to create an immigration system that reflects the best values of America.”Video of Durbin’s floor speech is available here.Audio of Durbin’s floor speech is available here.Footage of Durbin’s floor speech is available here for TV Stations. -30-"
https://www.durbin.senate.gov/newsroom/press-releases/durbin-menendez-senators-unveil-resolution-urging-international-cooperation-to-address-sri-lankas-political-and-economic-crises,"WASHINGTON – As the United Nations General Assembly convenes in New York this week, U.S. Senate Majority Whip Dick Durbin (D-IL), U.S. Senator Bob Menendez (D-NJ), Chairman of the Senate Foreign Relations Committee, along with Patrick Leahy (D-VT), and Cory Booker (D-NJ), introduced a Senate resolution calling for a comprehensive international approach to address Sri Lanka’s current political and economic crises, including challenges related to poor governance and economic policy under the Rajapaksa family’s rule. “After decades of conflict, political mismanagement, and unaddressed inequalities, the Sri Lankan people have made it clear they aspire for something better,” Durbin said.  “Introduction of this resolution shows that the U.S. Senate stands with peaceful democratic efforts to address these long neglected challenges.” “I am proud to be joined by my colleagues in introducing our resolution that necessarily calls attention to the devastating political and economic turmoil plaguing the people of Sri Lanka,” Menendez said. “As the country grapples with its worst domestic crisis since the end of its civil war, the international community must continue to provide robust support and ensure that accountability for war crimes and respect for human rights in Sri Lanka remain top priorities. I applaud efforts by the Biden administration, our Quad partners, and the IMF in providing critical humanitarian and economic assistance, and affirm my commitment to continue to work with my colleagues to advance stability and prosperity in Sri Lanka and the broader region.”  “The Rajapaksa family enriched themselves at the expense of the Sri Lankan people, ruthlessly silencing their opponents, inciting ethnic tensions, and leaving the country an economic shambles,” Leahy said. “After years of civil war and government mismanagement and abuse, Sri Lanka needs a government that is committed to ethnic tolerance, equitable economic development, human rights, and justice.  That should also be the focus of U.S. policy.” “The Sri Lankan people have sent a firm message that they want their government to address the dire economic and humanitarian crises that are afflicting their country,” Booker said. “I stand with the Sri Lankan people and support their peaceful efforts to address their needs. Furthermore, the international community must continue to push for justice, transparency, and accountability for human rights violations committed during the civil war to help the people of Sri Lanka move forward.” While commending the Biden administration and other Quadrilateral Security Dialogue (Quad) members’ support for Sri Lanka, the resolution calls on the UN Human Rights Council to extend its war crimes accountability resolution; urges Sri Lankan security forces to respect Sri Lankans’ rights to protest peacefully; and presses President Ranil Wickremesinghe to work with opposition parties and ethnic minority groups in efforts to address the crisis.  Find a copy of the resolution here.-30-"
