url,text
https://www.burr.senate.gov/2022/4/burr-on-fda-user-fee-agreements-innovation-is-key-when-fda-does-not-live-up-to-commitments-patients-suffer,"Today, the Senate Committee on Health, Education, Labor and Pensions (HELP) held a hearing titled, “FDA User Fee Agreements: Advancing Medical Product Regulation and Innovation for the Benefit of Patients.” This is the Committee’s first hearing to examine the commitment letters submitted by the Food and Drug Administration (FDA) and industry leaders earlier this year for the reauthorization of the prescription drug, generic drug, biosimilar, and medical device user fee agreements.Ranking Member Burr’s full prepared opening statement:“Chair Murray, thank you for holding this important hearing today.“To the witnesses, welcome. I am looking forward to our discussion.“Every five years, this committee is charged with evaluating FDA’s user fee programs and the agency’s performance in meeting its existing commitments.“At their core, these programs are about bringing new hope to Americans. The faster, more predictable, and more accountable the programs are, the more patients stand to benefit from life-saving, innovative drugs and devices. “When FDA does not live up to its commitments, patients are the ones who suffer.“I have served in Congress since 1995, so I have been here for all but the very first user fee process.“Each time, I have gradually added provisions to improve FDA’s accountability to the commitments it makes.“Every five years, industry agrees to provide more funding under the duress of negotiating with their regulator.“So, it is Congress’ job to make sure that the negotiations were not a hostage situation, and that these agreements are a good deal for patients and the industries that bring them hope.“The user fee programs are intended to supplement FDA’s congressionally appropriated resources to speed the review of medical products and get treatments to patients as quickly as possible.“The user fee agreements negotiated between FDA and industry partners lay out the process for bringing new products to market that will treat, prevent, and cure diseases.“In 1992 under the first prescription drug user fee agreement, or PDUFA, the drug application fee was about $100,000. Today, the drug application fee is more than $3.1 million.“The medical device user fee agreements were first signed into law in 2002.“In 2007, a 510(k) submission was just over $4,000. Today, this application costs more than $12,700.“When Members of Congress complain about the cost of prescription drugs or medical devices, we should evaluate all aspects of the pipeline, including the cost of development and regulatory review to make sure costly and burdensome regulations are not part of the problem.“The enormous growth in the oldest of the user free programs underscores my longstanding concerns.“In 1993, FDA collected just over $35 million in annual fees for the prescription drug user fee program.“Today, FDA collects over $1 billion in PDUFA user fees annually. Even accounting for inflation, that’s an increase of more than 1,500 percent since the start of the program.“Yet FDA continues to request more and more resources from industry, even when they don’t meet the agreed upon performance goals.“For example, in fiscal years 2019 and 2020, FDA missed 12 out of 14 goals related to scheduling meetings, delaying needed conversations for innovators to move forward with their products.“As part of the proposed new prescription drug program commitments, FDA is requesting an additional $324 million over the five year cycle.“The proposed agreement includes $111 million for hiring an additional 352 new people. That’s 122 more new hires than the agency committed to in the last cycle.“In fact, across all four programs, FDA is committing to more than 880 new hires, when the agency has more than 700 vacancies outstanding.“Generic and biosimilar drugs are our best tool in driving down the cost of prescription drugs, and should be a top priority of the agency.“The biosimilar agreements should help bolster the number of biosimilars in the market, including biosimilar insulin products.“FDA, again, has struggled to meet some important program goals. “During fiscal year 2020, FDA missed nine out of 15 goals related to product development meetings.“Under the proposed biosimilar agreement, FDA is requesting an additional $5 million over the five-year cycle and 15 new hires.“The generic drug program collects more than $494 million in annual fees and supports more than 2,100 staff positions. Under the proposed generic drug agreement, FDA is requesting additional funding of more than $40 million and 128 new hires. “While FDA appears to be on track to meet the majority of its commitments under the current generic agreement, its performance has been impacted by the COVID-19 pandemic in terms of delayed facility inspections. “As of last August, these inspection challenges had delayed more than 29 generic drug applications, with many more applications likely delayed since then.“Turning our attention to the medical device agreement, I’ve watched this very carefully and I am concerned.“This committee only recently received the draft medical device commitment letter. The final medical device agreements were due, by law, to Congress on January 15.“By the time we receive these final agreements, the device commitment letter will be more than three months late.“Under this proposed agreement, FDA is requesting up to $1.9 billion dollars over the five-year cycle, nearly a $1 billion increase.“This proposed increase is roughly doubling fee collections.“Yet again, FDA did not meet deliverables under this user fee program. The FDA missed goals for 510(k) reviews, resulting in longer review times; failed to explain its reasoning to sponsors each time it sent a letter of deficiency about their product; and failed to issue an important digital health guidance on time.“Let me remind my colleagues, these were not optional actions, these were requirements under the last deal.“Under the proposed agreement, FDA is committing to holding steady or improving performance for most categories of submissions.“For the first two years, review times for Premarket Approval applications would hold steady at 290 calendar days, and in the last three years, review times would reduce to 285 calendar days.“However, FDA is significantly walking back its current commitment to review 510(k) submissions within 108 days. Instead, FDA is proposing longer review times of 128 days.“The FDA Safety and Innovation Act, which we passed in 2012, required FDA to review 95 percent of these applications within 90 days.“This agreement almost doubles the user fees, and includes longer review times for some categories of products.“Pay more, get less is not exactly a selling point to me.“MDUFA V also includes a new pilot program called TAP that aims to initiate early and frequent engagement between FDA and sponsors of innovative devices.“As the author of the breakthrough device pathway, I still can’t figure out whether this new program will offer anything different from FDA’s current activities for breakthrough devices.“This new pilot program is set to grow over the five year cycle, without clear accountability metrics or deliverables to help measure the success of the program.“The pilot has the ability to grow to 325 devices, which would cost at least $338,000 per device. Congress deserves a full accounting of how FDA plans to spend these resources and operate this new, nebulous program. “And I’ll tell you right now, Congress is going to require accountability in here for this new program.“With each reauthorization, FDA receives huge increases in resources, despite not fully delivering what it previously promised.“And with a declining percentage of congressional appropriations for the overall programs, FDA is increasingly removing itself from Congress’ reach.“I question whether the agreements, both past and proposed, reflect a good deal for the patients they are designed to serve.“In 2017, during the user fee hearings in this Committee, I asked each industry representative testifying about the importance of the user fee agreements and whether they would support a mechanism to hold FDA more accountable.“The response was clear: FDA should be held accountable to its commitments.“I look forward to hearing from each of you about why you have agreed to these commitments and how they will accelerate innovative products for Americans.“I yield back.”"
https://www.burr.senate.gov/2022/4/burr-statement-on-biden-admin-ending-title-42-border-policy,"Today, Senator Richard Burr (R-NC), Ranking Member of the Senate Health, Education, Labor and Pensions Committee, released the following statement on the Biden Administration’s discontinuance of Title 42:“The Biden Administration’s messaging on the status of and response to COVID-19 continues to be a contradictory mess. On the one hand, the Administration is clamoring for additional emergency funding and costing taxpayers $5 billion per month by delaying student loan repayment, citing the continued threat of COVID-19. On the other hand, they’re rescinding safeguards in place to prevent new, potentially undetected variants from entering the country and encouraging Americans to return to normal life. They cannot have it both ways. The inconsistencies, particularly from the Centers for Disease Control and Prevention, do not inspire confidence that these decisions are being made based on science instead of politics.”"
https://www.burr.senate.gov/2022/3/senator-burr-statement-on-nomination-of-judge-ketanji-brown-jackson-to-the-u-s-supreme-court,"Today, Senator Richard Burr (R-NC) released the following statement on the nomination of Judge Ketanji Brown Jackson to the United States Supreme Court: “Earlier this week, I met with Judge Jackson to discuss the experience and judicial philosophy she would bring to the Supreme Court if confirmed.  “My top concern going into our meeting was ascertaining Judge Jackson’s position on radical proposals to pack the Supreme Court by expanding the number of justices. Court packing is a transparent power grab – one that would forever compromise the integrity, impartiality, and independence of the Supreme Court. Justice Ginsburg and Justice Breyer both rejected court packing and the next justice who joins the Court should do the same. “Unfortunately, Judge Jackson’s answers on the question, in both her confirmation hearing and our personal discussion, continue to be unsatisfactory. While she is undoubtedly highly qualified, knowledgeable, and experienced, based on our discussion, I cannot support Judge Jackson’s nomination when it comes before the Senate.”"
https://www.burr.senate.gov/2022/3/senate-help-committee-examines-ways-to-enhance-american-retirement-savings-encourage-participation-and-planning,"Today, the Senate Committee on Health, Education, Labor and Pensions (HELP) held a hearing titled, “Rise and Shine: Improving Retirement and Enhancing Savings.”Ranking Member Burr’s prepared opening statement:“Good morning.  Thank you Chair Murray for scheduling this hearing to highlight the need for Congress to consider legislation to encourage Americans to save more for their futures. “It’s not often we have hearings on the pension part of the HELP Committee, but as I look at my remaining nine months in the Senate I’m very aware of the importance of working and saving towards a secure retirement. “Our labor committee hook into retirement issues is ERISA – the Employee Retirement Income Security Act.  ERISA sets standards for retirement and health plans in private industry to protect individuals in these plans.  The Finance Committee handles the Internal Revenue Code portion.“Retirement bills require our Committees to work in concert so that ERISA and the tax code properly work together to help Americans save for their own retirement. “As a member of both HELP and Finance Committees, I consider my office a one-stop shop on retirement matters.  Not only will I help shepherd ERISA matters through this Committee, I will also shape the work of the Finance Committee.  “At our hearing last year, we focused on defined contribution plans, the reliable superstar of the retirement world.  Today we will examine how we can make further improvements to these plans.   “The questions before us are simple: what is working well and what needs improvement?“The answer to that first question seems easy at the surface level.  The system works great, when you participate.“The two most important words for a secure retirement are compound interest.“If you put a little bit of money aside every paycheck and let it grow, your future retirement will be a lot better off.“But the system doesn’t work great when individuals don’t or can’t participate.   “What we need to do is help Americans and their employers offer, operate, and fund individual retirement plans. “One option we’ll learn about from TIAA, which has a great North Carolina presence as all smart companies should, is Multiple Employer Plans.  TIAA has picked up the mantle as an administrator and advocate for the enhancement of these plans.  “Under these plans, employers pool together to gain efficiency to reduce costs and administration of plans.  Less money spent on administration means more money being saved.“Congress has been working to reinvigorate these pooled employer plans to get retirement plans out to more and more worksites and employees, especially small business employees.“The wonderful thing about defined contribution plans is that Americans who participate in them can pick up a piece of paper and see at least two things: their name and an account balance. “It’s their money.  And it’s there.  It’s not a concept. It’s not an accounting notation.  It doesn’t require a bailout. “It requires personal contributions, maybe an employer match, some basic financial knowledge, and then compounded interest does its work. “Here’s a truth: Americans need to save more.“The gap between the retirement savings that Americans have and the savings they need is already in the trillions of dollars and likely to grow.“Not only are many Americans struggling to keep track of their savings needs, even more alarming is how many people have no savings at all, outside of Social Security.“The data we’ve seen says that over one-quarter of non-retirees have nothing in their retirement piggy banks, many of whom are already nearing traditional retirement age.“And while the long-term impact of the pandemic and economic lockdowns and the Great Resignation remain to be seen, we know that many Americans chose to tap into their retirement savings, draining assets from their intended retirement purpose. “The bright side is that we’ve learned some good lessons.“According to AARP, workers are 15 times more likely to save for retirement if they can make a payroll deduction to a savings plan at work – you don’t spend what you don’t see.“We have also seen the success of automatic enrollment and employer matching to defined contribution plans. “So, the challenge to this Congress is finding ways to help employees and employers take advantage of the savings programs that already work.“I look forward to hearing from the panel today about how to overcome the barriers individuals face in their retirement planning, and the barriers employers face in offering retirement plans to workers. “I hope throughout this process Congress remembers that we shouldn’t be trying to take our opinions of how to plan for the future and take choices of retirement options away from individuals.“The American people didn’t send us up here to be maternalistic or paternalistic and make their investment decisions for them or limit their choices.“If we were all that good with planning ahead we probably wouldn’t have a $30 trillion debt.“What I want the most is for Americans to control their own money, have safe options on how to invest and save, and live with as few government and industry middlemen or middlewomen as possible.“Thank you.  I look forward to our discussion.”"
https://www.burr.senate.gov/2022/3/senator-burr-urges-federal-officials-to-apply-lessons-from-pandemic-to-address-mental-health-and-substance-use-disorder-challenges,"Today, the Senate Committee on Health, Education, Labor and Pensions (HELP) held a hearing titled, “Strengthening Federal Mental Health and Substance Use Disorder Programs: Opportunities, Challenges, and Emerging Issues.” Today’s hearing follows Ranking Member Richard Burr (R-NC) and Chair Patty Murray’s (D-WA)announcement last month that the Committee would be working on meaningful, bipartisan proposals to reauthorize, improve, and expand federal mental health and substance use disorder programs.Ranking Member Burr’s prepared opening statement:“Good morning. I am glad that the chair is holding this bipartisan hearing today.“Even before the pandemic, we knew the need to address mental health and substance use disorders was dire. Opioids took hold and the result was a crisis families and communities had not dealt with for some time. “As we look to reauthorize a number of these programs, we face a problem that has been compounded by the pandemic, but can be informed by our COVID-19 response.“We learned that research, innovation, partnerships, and real-time data are the keys to our success in overcoming an unprecedented public health challenge. Today’s hearing will help us determine how to apply these lessons and these actions to the mental health and substance use challenge that continues to devastate our communities.“The last time the committee examined our mental health and substance use programs, we heard from Sam Quinones on opioids, who shared his belief that isolation and lack of community was a driving factor in the substance use disorder crisis facing America.  “Isolation only worsened when the pandemic struck. Months on end of remote learning, time separated from aunts, uncles, grandparents, friends, and teachers, and families with critically ill and dying loved ones who could not say goodbye has taken a tremendous toll on America, especially our children. “We are seeing the results of the past two years in the alarming rates of people, particularly young children, arriving in emergency departments in a state of mental health crisis.“In 2020 alone, the number of young people seeking care for their mental health in an emergency room increased by 31 percent.“Between 2016 and 2020, the number of children experiencing depression increased by 27 percent, and the number of children experiencing anxiety rose by 29 percent.“Last year, more than 100,000 people lost their lives to a drug overdose, a nearly 30 percent increase from the year before.  Two-thirds of these deaths were linked to synthetic opioids, such as fentanyl.“But in the face of these tragedies, we see strength and resilience.  Families turning tragedy into action, to bring awareness and understanding to help others. “In hearings over the past year, we have heard examples of leaders and local communities ready to meet these challenges, partnering to bring local solutions to address local challenges.  As we consider reauthorizing these programs, it would serve us well to remember this too.“Since 2016, we have authorized or reauthorized more than 40 different federal programs to address mental health and substance use disorders.“In addition, the fiscal year 2022 Omnibus Appropriations bill provided nearly $5 billion for mental health and substance use disorder-related programs.“But at least nine of these authorized programs did not receive funding.“We have seen time and time again that creating a new program that does not get funded is a false promise. That creating new program for the press release at a markup isn’t actually a solution.“So, we need to figure out what we can do with the tools that we have, improve current programs, and fund the programs we do create.“And we should be honest with ourselves and the country and terminate programs that haven’t received funding in the last five years. If a program hasn’t received funding, it shouldn’t stay on the books.“We will have to prioritize and answer key questions, like how to better target our programs to make sure they’re both meeting the needs of today, but also have the flexibility to address the needs of tomorrow.  “To our witnesses, welcome. We need your expertise to ensure we have the right performance measures in place to track progress in the programs you oversee. “GAO recently found that many of our mental health and substance abuse programs lack the measures we need to know whether programs are working.“You only know what you can measure.“If we cannot track progress in a meaningful way, we will not know how to improve programs to better meet the needs of the people they are intended to serve and reprioritize those that are underperforming.  “Additionally, we need to make sure that we are using up-to-date data to inform our response and address emerging issues. “States and local communities must be empowered to address these issues, and they need accurate information to identify the problems they are facing – like emergence or reemergence of a new drug in an area, or identifying increased rates of suicide in certain populations.“Sometimes this requires thinking outside the box. We saw communities pull together during the pandemic to come up with solutions that worked – and we need the same spirit and ingenuity for this challenge. “One of the trends in that success was partnership with the private sector. Local public-private partnerships are the foundation of many of our successful federal mental health and substance use disorder programs.“I look forward to hearing more about how SAMHSA is encouraging partnerships and facilitating local engagement through its programs and how this can be improved.“Leveraging innovation to help address our mental health and substance use disorder crisis is another area I look forward to focusing on and hearing more about. NIMH and NIDA supported research has the potential to advance the field and improve our knowledge of the causes and consequences of mental illness and drug use to better inform prevention and treatment activities.“And critical to all of this is a strong workforce. This committee reauthorized a number of health workforce programs in 2020 in addition to those included in the pandemic package.“The health workforce, particularly our doctors, nurses, counselors, and therapists, have been through a lot. They rose to the challenge during this pandemic and it has taken a toll.“Earlier this Congress, the committee passed the Dr. Lorna Breen Health Care Provider Protection Act, which was just signed into law, to make sure that these providers get the support and care they need for their own mental health and substance use concerns, especially as they continue to care for all of us. “I look forward to hearing more about how HRSA is leveraging and prioritizing existing federal health workforce programs to fill gaps in the mental health and substance use disorder workforce.“I thank the chair.”"
