url,text
https://www.schumer.senate.gov/newsroom/press-releases/schumer-gillibrand-announce-legislation-to-put-an-end-to-unsolicited-robocalls,"Billions of Illegal Robocalls Target Older Americans and Put Consumers At Risk Annually; Consumers Lose Approximately $40 Billion a Year Through Telemarketing Fraud Washington, DC – U.S. Majority Leader Charles E. Schumer and Senator Kirsten Gillibrand joined Senate colleagues in calling for legislation to enhance penalties for automated and illegal phone calls wreaking havoc on consumers nationwide. The Deter Obnoxious, Nefarious, and Outrageous Telephone (DO NOT) Call Act would increase penalties for individuals and companies intentionally preying on consumers through unsolicited and illegal robocalls.  “From every corner of New York there is one thing everyone can agree upon, and that is the enduring hope that the robocalls stop,” said Senator Schumer. “Americans are desperate to ‘hang up the phone’ and the DO NOT Call Act is the antidote we need to cut the cord on ‘spoofing’ scams that target especially elderly New Yorkers. Whether it’s the landline or cell, no one should be scared to pick up the phone, and I will fight tooth and nail to ensure that New Yorkers can have some peace and quiet from the incessant ringing of robocalls.”“Robocalls are surging nationwide as advancements in technology have made it easier for scammers to prey on vulnerable New Yorkers with little to no consequence. Not only is this harmful to consumers, but frankly, we don’t have time for the nuisance and deception,” said Senator Gillibrand. “This vital piece of legislation will give the FCC the tools needed to combat scammers who grossly violate the Telephone Consumer Protection Act and, all too often, target and defraud senior Americans. I am a fierce advocate of the DO NOT Call Act, and will do everything I can to put sensible protections in place and put an end to unsolicited robocalls.”According to YouMail, nearly 4.5 billion robocalls targeted Americans in April of 2021 alone. Of those calls, 229,042,000 took place in New York State, making it the fifth most-called state in the nation. Consumers lose approximately $40 billion a year through telemarketing fraud. The Deter Obnoxious, Nefarious, and Outrageous Telephone (DO NOT) Call Act would:Senator Gillibrand has been a strong advocate of increasing protections for New York consumers. In addition to cosponsoring the DO NOT Call Act in the 116th Congress, Senator Gillibrand was a cosponsor of the Telephone Robocall Abuse Criminal Enforcement and Deterrence (TRACED) Act, which was signed into law in 2019. For more information and official FCC guidance on the TRACED Act program, click here. Additionally, Senator Gillibrand championed the bipartisan Senior Financial Empowerment Act to ensure that older Americans and caregivers have access to critical information and protections regarding financial abuse, and establish a national hotline to advise seniors on reporting fraud.###
                             Please be advised that due to the implementation of enhanced mail screening procedures, all mail sent to my state offices will experience a two to three week delay in delivery.  In the meantime, if you have an urgent matter, the best way to reach me is by phone at (202) 224-6542 or through any of my eight district offices."
https://www.schumer.senate.gov/newsroom/press-releases/schumer-statement-on-syracuses-plan-for-american-rescue-plan-funding,"Following his delivering millions for Syracuse as part of the American Rescue Plan he led to passage in the Senate, U.S. Senate Majority Leader Charles E. Schumer released the following statement on Syracuse’s plan for those funds:Senator Schumer said, “As Majority Leader, I made funding state and local governments my top priority in the American Rescue Plan and fought so hard to ensure that places like Syracuse would get the resources needed to both defeat COVID and revive our local economies. This plan – which invests in children and families, small businesses, critical infrastructure and restoring vital city services - is a first step towards a brighter future for Syracuse.”###
                             Please be advised that due to the implementation of enhanced mail screening procedures, all mail sent to my state offices will experience a two to three week delay in delivery.  In the meantime, if you have an urgent matter, the best way to reach me is by phone at (202) 224-6542 or through any of my eight district offices."
https://www.schumer.senate.gov/newsroom/press-releases/following-his-push-schumer-announces-multi-million_fix-to-charles-point-breakwall-in-sodus-bay-now-complete,"Lake Ontario Floods Have Cost Millions Of Dollars Of Damage To Wayne County Homes, Businesses, & Beaches, Including Charles Point Bluff Putting Homes At Risk of Falling Into Lake Ontario Because Breakwall is Broken & Eroded Today After Securing $4.5 Million To Rebuild Charles Point Breakwall Better & Stronger Schumer Announces Construction of New Wall is Now CompleteU.S. Senator Charles E. Schumer today announced that following his push to secured $4.5 million last year for the U.S. Army Corps of Engineers (USACE) to finally repair and rebuild the battered Charles Point barrier beach break wall to protect Sodus Bay and to safeguard homes on Charles Point bluff at risk of falling into Lake Ontario, construction of the new robust wall is now completed. “Over the past few years, Lake Ontario’s historic flooding has battered Wayne County communities and their bays and harbors and eroded away the vital Charles Point breakwall in Great Sodus Bay,” said Senator Schumer. “That’s why last year I was produce to join Wayne County homeowners and officials to announce I had secured $4.5 million last year to finally repair and rebuild the Charles Point barrier beach break wall.  Today I’m pleased to announce construction of the new more robust wall is now complete.  The Charles Point breakwater wall is a vital shield, protecting Sodus Bay and safeguarding homes on Charles Point bluff from falling into Lake Ontario. No one should have to fear for the safety of their home, but until now families along the Charles Point bluff have had to do just that, as Lake Ontario water levels threatened to cause serious damage. That’s why I was proud to deliver the much-needed $4.5 million for the Army Corps of Engineers to repair and rebuild the Charles Point break wall. Now the repaired wall will serve as a shield, improving resiliency along the Lake Ontario shoreline, protecting Sodus Bay, and ensuring the safety of our community and their families.”In 2017, following Lake Ontario’s floods, Schumer met with Wayne County Officials and Charles Point homeowners to begin his push for the U.S. Army Corps to allocate funding to repair the badly damaged Charles Point break wall.  The floods broke through the wall in several places, allowing Lake Ontario waters to dangerously erode the Charles Point bluff, jeopardizing and undermining the land supporting homes on top of the bluff.  Besides protecting Charles Point, the wall is a major component of the infrastructure that the Army Corps of Engineers built decades ago across the mouth of Sodus Bay to protect the Bay and the hundreds of homes and job-creating businesses located within the Bay from damaging Lake Ontario waters, waves, and erosion.  The Charles Point wall together with Crescent Beach and the Army Corps’ navigation channel wall form a vital barrier that shields Sodus Bay but the floods damaged this barrier system by destroying the Charles Point wall and by breaching and washing away entire sections of Crescent Beach land.  In 2018, Schumer first succeeded in getting the Army Corps to allocate $150,000 to design the Charles Point wall repair, then estimated to cost $1.5 million. However when the designs revealed $4.5 million would instead be required to reconstruct and rebuild the Charles Point wall to a higher resiliency standard to prevent future flood damage, Schumer wrote in late 2019 to US Army Corps Commanding General Todd Semonite to push for the Army Corps to allocate the needed $4.5 million. “The Sodus Point community is breathing a deep sigh of relief, now that Charles Point is secured.  The funds that Senator Charles Schumer was able to secure were instrumental in making this happen.  This was the highest risk area for catastrophic damage, and it has now been averted.  We appreciate the senator’s support and look forward to working with him to secure additional funds for the East breakwater which is also in need of repair,” said Dave McDowell, Mayor, Sodus Point, NYEric Depew, Charles Point resident and past Charles Point Homeowner Association Vice President said, ""It is an immense relief to see this project come to conclusion after 4 years in the making knowing that Charles Point is safe from the ravages of Lake Ontario today and for generations to come!  As the primary resident advocate for this project I know this would not have been possible without the immense efforts and influence of Senator Schumer and his staff.  We look forward to continuing to work with the Senator to finish securing Sodus Bay's future by acquiring the additional funding needed by the USACE to fix the functionally failed East Breakwater they hold responsibility for maintaining and that threatens the continued viability of the Bay itself.”Last year, Schumer announced the Army Corps heeded his push and included the $4.5 million in the Corps’ FY20 work plan to construct the new upgraded and more resilient armored stone revetment Charles Point protection wall. Last summer the Army Corps of Engineers awarded the $3.86 million construction contract to replace the wall with a new wall structure to replace the existing failed 525 ft Charles Point steel sheet pile wall.  A gap in the existing wall  caused increased erosion to the land and bluff behind it.  The new wall will provide better protection for erosion of the bluff and potential breach into the harbor. Work commenced last August and was completed May 19,, 2021.###
                             Please be advised that due to the implementation of enhanced mail screening procedures, all mail sent to my state offices will experience a two to three week delay in delivery.  In the meantime, if you have an urgent matter, the best way to reach me is by phone at (202) 224-6542 or through any of my eight district offices."
https://www.schumer.senate.gov/newsroom/press-releases/schumer-announces-southwest-airlines-to-launch-service-to-syracuse-days-after-senator-pushed-for-southwest-ceo-to-add-routes-to-hancock-international-airport-syracuse-lands-southwest-service-,"Schumer’s Lands Southwest Airlines Service To Syracuse Airport After Decades-Long Fight; On Call With CEO, Senator Urged Southwest To Make Bold Investment At Syracuse Airport Following Securing Massive Investment In Airline Industry, Schumer Says Southwest Will Establish Presence At Hancock Intl Airport Starting Schumer: My Longtime Push To Bring Southwest To Syracuse Has Now LandedAfter urging Southwest to add service to Syracuse Hancock International Airport (SYR) last week on a personal call with CEO Gary Kelly, U.S. Senator Charles E. Schumer announced today that Southwest Airlines has agreed to expand and enhance its presence in Upstate New York by establishing service out of SYR for the first time. With the addition of new routes to SYR, Southwest will now service every major airport in Upstate New York.On his call with Southwest CEO Kelly last week, Schumer highlighted his long history of working with Southwest and other airlines to bring service to Upstate New York, the success of those routes, and the widely predicted post-pandemic economic boom as proof that establishing service for Syracuse Hancock would be a win-win. Schumer said the new routes to SYR would boost competition, availability of low-cost flights, and connectivity for travelers and businesses in Central New York.“Today’s news, landing Southwest in Syracuse, is no small peanuts, said Senator Schumer. “And let’s not forget, the decision by Southwest to finally land in Syracuse solidifies years of hard work by all of us to get the airport in tip-top shape—inside and out. The federal funds we’ve used to make the Syracuse airport the crown of regional and affordable travel ensures jewels of service like Southwest are here to stay, with more to come.” Schumer has long fought to bring affordable air service to Upstate New York. In fact, Senator Schumer’s first major victory on that front came when he successfully advocated for Southwest to start flights from Albany. Southwest’s profitable decision led many other carriers to begin servicing airports across the state that previously were not considered viable. Since then, Schumer has fought to bring new airlines and routes to Upstate New York cities, including JetBlue to Buffalo, Albany, Syracuse and Rochester. Recently, Schumer successfully pushed JetBlue to establish service to Boston from Syracuse. Lastly, Schumer secured nearly $934 million for New York airports during the pandemic, including more than $29 million to Hancock airport.###
                             Please be advised that due to the implementation of enhanced mail screening procedures, all mail sent to my state offices will experience a two to three week delay in delivery.  In the meantime, if you have an urgent matter, the best way to reach me is by phone at (202) 224-6542 or through any of my eight district offices."
https://www.schumer.senate.gov/newsroom/press-releases/schumer-statement-on-senate-passage-of-us-innovation-and-competition-act,"Following Senate passage of his bipartisan U.S. Innovation and Competition Act, which includes his Endless Frontier Act and a $52 billion investment for domestic semiconductor manufacturing and R&D that he has fought for as a top priority since June of last year to help further build New York as a global hub for the semiconductor industry, U.S. Senate Majority Leader Charles issued the following statement:Senator Schumer said, “Today’s Senate passage of the bipartisan U.S. Innovation and Competition Act moves forward historic legislation to invest in science, technology, and U.S. manufacturing that will shore up critical industries like semiconductors, artificial intelligence, advanced communications like 5G, quantum computing, biotechnology, and advanced energy, and create opportunity to reshape the Upstate New York economy with investment in new regional tech hubs and support for New York entrepreneurs and research at universities and laboratories.”Schumer added, “With its rare combination of a world-class workforce, advanced manufacturers, and renowned higher education institutions, I wrote and championed this legislation with Upstate New York always at the forefront of my mind. In the midst of one of the most consequential battles in our nation’s history, the U.S. Innovation and Competition Act, which includes my Endless Frontier Act as its centerpiece, lays the foundation for the next century of American economic leadership and preserves our competitive edge for generations to come, and I’ll continue to fight to put Upstate New York on the frontlines of that battle.” ###
                             Please be advised that due to the implementation of enhanced mail screening procedures, all mail sent to my state offices will experience a two to three week delay in delivery.  In the meantime, if you have an urgent matter, the best way to reach me is by phone at (202) 224-6542 or through any of my eight district offices."
https://www.schumer.senate.gov/newsroom/press-releases/schumer-and-gillibrand-announce-1-million-for-the-greater-binghamton-airport-after-years-of-advocacy-federal-funding-will-support-broome-countys-economic-takeoff,"DOT Funding Will Bolster Local Efforts To Improve Airport And Expand Air Service; Senators Say Binghamton Airport Vital To Continued Growth Of Regional Economy Schumer, Gillibrand: Ready For Binghamton’s Ascent As Regional Air Service HubU.S. Senate Majority Leader Charles E. Schumer and U.S. Senator Kirsten Gillibrand announced $1 million for Greater Binghamton Airport through the Department of Transportation’s Small Community Air Service Development Program to make improvements to facilities and expand air service to other regional transportation hubs. The funding will support the region’s continued economic growth and open up the area to more opportunities in the future.“Binghamton Airport’s expansion means continued success for the community and the entire Broome County region,” said Senator Schumer. “Transportation connections to the wider world are essential for community development and economic opportunity, and I have long been a champion of bringing those connections to Binghamton Airport. The funding announced today means opportunities for more jobs, more growth, and more investment in the future. I will always work with the community to fight for the Southern Tier’s economic take off.”“Broome County’s economic and business activity has grown in recent years, producing greater demand for air services. The Greater Binghamton Airport is invaluable in maintaining the region’s connectivity and growth as it continues to serve its nearly 200,000 local residents,” said Senator Gillibrand. “These funds will help modernize the Greater Binghamton Airport, bolster regional economic development, and ensure businesses and travelers are connected to the rest of the country. I will always fight in the Senate for programs that support New York’s transportation infrastructure.”""BGM is extremely excited to receive the Small Community Air Service Development award. The timing for this award is incredible as BGM looks to regrow and restore air service for our community and upstate NY in the wake of the pandemic,” said Mark Heefner, Commissioner of Aviation for the Greater Binghamton Airport. “This award will assist in creating a strong package that allows us to solicit additional air service.  The SCASD grant will help put BGM on a more level playing field that will allow us to focus on the right service to meet our community's needs. Without the help of Senator Schumer, Senator Gillibrand, and our NYS elected leaders, we would not have been able to create the competitive application that ultimately resulted in an award. ""“As more people resume traveling across the country and abroad following the pandemic, we want them to fly BGM. Broome County has been working nonstop to bring more flights here and the Small Community Air Service Development will help us in that effort. I’d like to thank Senator Schumer and Senator Gillibrand for their leadership and continued advocacy on behalf of the Greater Binghamton Airport,” said Jason Garnar, Broome County Executive.The senators have long advocated for Binghamton Airport, securing over $3.5 million in COVID relief packages. Schumer has also consistently fought for federal investments to fund improvements to Binghamton Airport, including to promote the airport, repair the taxiway, and make runway improvements. Binghamton Airport served ~38,000 enplanements in CY2019 according to the FAA, and with today’s federal investment, has the potential to create more jobs and land more opportunities for economic growth in Broome County.A copy of Schumer’s original letter to Secretary Buttigieg appears below:Dear Secretary Buttigieg:I am pleased to write in support of the application submitted by the Greater Binghamton Airport (BGM) for funding through the Small Community Air Service Development Program (SCASDP). This critical funding will enable airport administration to bolster existing efforts to establish BGM as a regional air service hub by expanding access to destinations, enhancing services, and supporting the needs of existing business in the Southern Tier region.The Greater Binghamton Airport, located in Upstate New York’s Broome County, is a vital component to the region’s economy, supporting the travel of many of the area’s prominent employers. The airport offers a convenient location, just outside the City of Binghamton, and helps service many of the other cities in the Southern Tier of New York. Historically, the Greater Binghamton Airport has offered its passengers a variety of travel and carrier options at competitive rates, all while maintaining the convenience of a regional airport. In 2016 and 2017, however, American and United Airlines selected to eliminate services at the airport. The diminished travel options and unreliability pushed enplanements down, threatening the vitality of this valuable community resource. Currently, the airport’s offerings have been reduced to a single carrier operating only a few flights daily to a single hub. These reduced services have limited the airport’s capacity to meet the ever-growing travel needs of the community.Since this reduction, Broome County’s economy has grown and countless new initiatives have succeeded in revitalizing the community. Binghamton University is on the precipice of opening a new Health Science Complex and Pharmacy School to support their expanding nursing and health research programs. In addition, the area recently has experienced an explosion of investment into the industrial hemp oriented space, with the development of multiple processing plants currently underway. The absence of robust and reliable connections to domestic and global transportation hubs is a disincentive to the expansion of new and developing business opportunities in the region.The SCASDP grant will provide Broome County the opportunity to improve the airport and expand its service options from the Greater Binghamton Airport to sought after hubs. The airport has assembled a consortium of support and commitment from local private sector stakeholders, Broome County, and New York State for contributions to air service development. This vast association of resources demonstrates the unwavering commitment the local community and its leaders have to creating a vibrant regional airport, and highlights the tremendous value this project holds.I ask that you please give this application your full consideration. A SCASDP grant will enable Broome County to continue to provide reliable air service to the region and will greatly support the continued economic development of this growing area.Thank you for your consideration.Sincerely,A copy of Gillibrand’s original letter to Acting Secretary Hurdle appears below:Dear Acting Secretary Hurdle,I write in support of the application submitted by Greater Binghamton Airport (GBA) for funding from the Small Community Air Service Development Program (SCASDP) through the U.S. Department of Transportation. This funding will be used to increase air service development efforts and improve access to air services throughout New York’s Southern Tier.Located in Broome County, eight miles north of the City of Binghamton, Greater Binghamton Airport serves a population of nearly 200,000 local residents. The county is home to SUNY Binghamton, which brings together students and faculty from across the United States and more than 100 countries abroad. Between 2016 and 2017, GBA lost the services of two airlines, and has seen nearly 50,000 customers lose access to flights. Meanwhile, the County has grown in recent years, both in terms of population and business activity, producing greater demand for air services.The requested funding will be used to enhance a package for air service development that includes contributions from local businesses and Broome County to increase the availability of air service at the Greater Binghamton Airport. This new funding will ensure that the region’s air services reflect the County’s recent growth and economic development efforts. Such air service development will bolster regional economic development and ensure the community’s transportation needs are met.I ask that you please give this application your full consideration. If you have any questions, or desire further information, please do not hesitate to contact my staff member, Anisa Dhillon, at (202) 224-4451.###
                             Please be advised that due to the implementation of enhanced mail screening procedures, all mail sent to my state offices will experience a two to three week delay in delivery.  In the meantime, if you have an urgent matter, the best way to reach me is by phone at (202) 224-6542 or through any of my eight district offices."
