url,text
https://www.murray.senate.gov/senator-murray-pushes-for-more-action-on-affordable-housing-in-olympia-stresses-need-to-boost-housing-supply/,"ICYMI: At Hearing with HUD Secretary, Senator Murray Highlights Urgent Need to Address Homelessness and Fund Affordable Housing – MORE HERESenator Murray: “Working families should be able to afford a decent home without putting more than half their income towards their rent or mortgage—and no one should ever go without a roof over their head.”***PHOTOS OF THE ROUNDTABLE HERE******AUDIO OF THE ROUNDTABLE HERE***(Olympia, WA) – Today, U.S. Senator Patty Murray (D-WA), hosted a roundtable at the Housing Authority of Thurston County with local housing leaders to discuss how the American Rescue Plan has helped to deliver critical relief, prevent evictions, and put more people in safe, affordable homes. During the event, Senator Murray highlighted her continued commitment to smart, just housing policy and bold investments from the federal government in affordable housing, and—importantly—increased housing supply.Senator Murray has expressed strong support for President Biden’s Housing Supply Action Plan and proposed fiscal year 2023 budget for federal housing programs. The proposed budget includes a total of $50 billion in new mandatory funding to boost the nation’s housing supply. The budget also requests an increase of the Department of Housing and Urban Development’s Housing Trust Fund and would also raise the cap on low-income housing tax credits to make low- and moderate-income housing worth building. President Biden’s requested budget would provide the resources necessary to build 500,000 new homes.Senator Murray was joined by Craig Chance, the Executive Director of the Housing Authority of Thurston County; a local voucher recipient supported by American Rescue Plan funds; Karen McVea, Director of Rental Assistance for the Thurston County Housing Authority; and Margaret Salazar, HUD’s Regional Administrator serving Washington, Oregon, Idaho, and Alaska.“Washington state is dealing with a really serious housing crisis—and while the American Rescue Plan I helped pass delivered the largest federal investment in mortgage and rental relief in our country’s history, we still need long-term solutions,” said Senator Murray. “Right now, we need more housing and we’ve got to help our communities build it—that’s why I’m pushing to boost federal funding to help states and local communities plan and develop more affordable housing. Working families should be able to afford a decent home without putting more than half their income towards their rent or mortgage—and no one should ever go without a roof over their head.”“We are grateful for Senator Murray’s leadership,” said Craig Chance, Executive Director of the Housing Authority of Thurston County. “One example is the Emergency Housing Voucher program made possible by the American Rescue Plan Act. A 62 year old neighbor, previously enduring without shelter, shared with us that before he secured permanent housing through this program he’d given up hope of having decent housing.  Individual neighbors and the entire community benefit from Senator Murray’s engagement in this noble work.”“Across Washington and throughout the Northwest we are in a housing crisis,” said Margaret Salazar, HUD Regional Administrator. “But with every family we house, we have greater inspiration and greater resolve. At HUD, we have awarded unprecedented funding through the American Recue Plan and it’s making a difference. We are grateful to Senator Murray for her continued stalwart leadership and advocacy around housing, in Washington and nationally.”Senator Murray has been a strong advocate for housing investments, securing more than $400 million in rental assistance, $170 million in homeowner assistance, over 2,400 new Emergency Housing Vouchers, and nearly $100 million for housing and services to support people experiencing homelessness in Washington state specifically through the American Rescue Plan. These federal investments resulted in the largest eviction prevention effort in history. Earlier this year, Senator Murray also announced $143.6 million in Low Income Home Energy Assistance Program (LIHEAP) funding for Washington state from the American Rescue Plan, in addition to annual federal appropriations, that would go to families with low-incomes to help with utility and energy costs during the winter. In May, Senator Murray questioned U.S. Secretary of Housing and Urban Development (HUD) Marcia Fudge on the homelessness crisis and the inadequate supply of affordable housing—and reiterated her commitment to pushing for a major federal investment to tackle the national housing and homelessness crisis.###Sign up to receive Senator Murray’s newsletter and get updates on the workshe’s doing on behalf of Washington state.  "
https://www.murray.senate.gov/senator-murray-tours-port-of-longview-highlights-federal-investments-in-supply-chains-and-infrastructure/,"Senator Murray: “When we invest in our infrastructure and strengthen supply chains, those dollars go a long way towards lowering the prices of products on shelves and creating good-paying, union jobs here in Washington state.”***PHOTOS AND B-ROLL OF THE EVENT HERE******AUDIO OF THE EVENT HERE***(Longview, WA) – Today, U.S. Senator Patty Murray (D-WA), a senior member of the Senate Appropriations Committee, joined local leaders from the Port of Longview and International Brotherhood of Electrical Workers (IBEW) for a tour of the port facilities and a roundtable discussion on recent efforts by Senator Murray to support the Port of Longview, strengthen supply chains, and help create good-paying jobs.Senator Murray was joined by Dan Stahl, Chief Executive Officer of the Port; Jennifer Brown, Chief Financial Officer of the Port; Christian Clay, Director of Business Development of the Port; and Mike Bridges, Business Representative from IBEW Local 48. During the roundtable, Senator Murray spoke with participants about their ongoing work, the federal funding she has secured for the Port of Longview, and what other ways the federal government can support Washington state ports.Last year, Senator Murray secured $2.5 million in Congressionally-directed spending through the Fiscal Year 2022 appropriations bill for the Port of Longview’s Industrial Rail Corridor Expansion (IRCE) project. This project will expand rail capacity to underutilized marine terminals to unleash economic potential for private sector investment. This project will double freight capacity through the corridor, and leverage the Port’s position as an economic engine for the region. Senator Murray also secured a $16 million Rebuilding American Infrastructure with Sustainability and Equity (RAISE) grant for the IRCE in addition to her recent Congressionally-directed spending request.“The Port of Longview is an important economic driver for the entire region—and it’s my job to support the work that happens here every day,” said Senator Murray. “Whether through the Bipartisan Infrastructure Law or my seat on the Appropriations Committee, we have been able to secure some really significant and meaningful federal infrastructure investments for the Port of Longview and all of Southwest Washington. When we invest in our infrastructure and strengthen supply chains, those dollars go a long way towards lowering the prices of products on shelves and creating good-paying, union jobs here in Washington state.”During the event, Murray, discussed how important RAISE grant funding has been for local infrastructure projects across Washington state. Senator Murray originally created the RAISE program (previously known as TIGER and BUILD) in 2009 and has been a longtime supporter of the program, most recently helping secure $7.5 billion for the RAISE program – a 50% annual increase – in the Bipartisan Infrastructure Law. RAISE grants can be used for a wide variety of infrastructure projects with local or regional impact. The program is funded specifically via the Transportation, Housing and Urban Development, and Related Agencies Appropriations Subcommittee, of which Senator Murray is a senior member. Just this month, Senator Murray announced nearly $100 million in additional RAISE grant funding for projects across the state. Senator Murray has secured nearly $460 million in RAISE funding for Washington state projects since she founded the program.The Bipartisan Infrastructure Law Senator Murray helped pass invests more than $17 billion in port infrastructure and waterways with the primary aim of addressing needed repairs and maintenance backlogs, reducing congestion to strengthen our supply chains and remove bottlenecks to expedite commerce, cutting emissions near ports by boosting electrification, and investing in other low-carbon technologies to reduce environmental impacts on neighboring communities.In particular, the Bipartisan Infrastructure Law designates $450 million annually for the next five years for the Port Infrastructure Development Program. This will allow significant improvements to port facilities and projects that include: loading and unloading of goods at a port; movement of goods into, out of, around, or within a port; resilience projects addressing rising sea-level, flooding, extreme weather events, and natural disasters; and environmental and emissions mitigation measures.Senator Murray has been a longtime advocate of Washington state ports. The 2020 Water Development Resources Act includes changes secured by Murray to the Harbor Maintenance Tax and Harbor Maintenance Trust Fund. These changes will provide billions of dollars each year to invest in and enhance the global competitiveness of ports in Washington state and across the country.###Sign up to receive Senator Murray’s newsletter and get updates on the workshe’s doing on behalf of Washington state.  "
https://www.murray.senate.gov/senator-murray-hosts-roundtable-on-historic-measures-to-lower-drug-prices/,"ICYMI: Sen. Murray on IRA Keeping Health Care Costs Low: “Stress Off Patients’ Shoulders, Money in Their Pockets” – MORE HERESenator Murray: “This bill is going to be life changing—and lifesaving—for so many seniors and people with disabilities who rely on Medicare to get the care they need.”***PHOTOS OF THE ROUNDTABLE HERE******AUDIO OF THE ROUNDTABLE HERE***  (Vancouver, WA) – Today, U.S. Senator Patty Murray (D-WA), Chair of the Senate Health, Education, Labor, and Pensions (HELP) Committee, hosted a roundtable with patient advocates and local leaders from Southwest Washington to discuss her work to pass the Inflation Reduction Act, which includes historic provisions to lower drug costs for seniors and people with disabilities. As Chair of the Senate Health Committee, Senator Murray helped lead the Senate Democrats in passing the Inflation Reduction Act’s prescription drug provisions.“Skyrocketing drug costs have been hard on families across Washington, and across the country—and I know Clark County is no exception,” said Senator Murray. “Too many people have been facing impossible choices because of skyrocketing drug costs, like skipping meals or skipping their medication just to make ends meet—all while drug companies are jacking up prices and raking in massive profits. That’s why I fought tooth and nail to pass the Inflation Reduction Act, lower drug costs, and hold pharmaceutical companies accountable. This bill is going to be life changing—and lifesaving—for so many seniors and people with disabilities who rely on Medicare to get the care they need.”“The Clark County Commission on Aging regularly hears presenters and members of the public speak about financial insecurity for a growing number of older adults,” said Cass Freedland, Ph.D., Chair of the Clark County Commission on Aging. “We hear about aging adults who are currently making ends meet but face an uncertain future if their life circumstances change, such as the loss of a partner or a decline in health status. Because the largest expenses for most older adults are housing and health care costs, actions that help reduce cost burdens are critical.”“It’s an honor for the Area Agency on Aging & Disabilities of Southwest Washington to host Senator Murray and her staff for this important roundtable discussion,” said Mike Reardon, Executive Director of the Area on Aging and Disabilities of Southwest WA. “Additionally, we say “Thank You” to Senator Murray for championing solutions to the rising costs of prescription medications for Medicare recipients. The Medicare prescription drug provisions in the Inflation Reduction Act will benefit the lives of millions of older adults across the nation, particularly those on fixed incomes. This bill will benefit 1.4M Washingtonians, 115,000 of whom live in Southwest Washington. These are significant numbers and again want to thank Senator Murray for her hard work on this important issue.”“Nosotras somos mejores juntas,” said Pat Cano, LULAC Senior Member, Advisory Council Member for the Area Agency on Aging and Disabilities of Southwest Washington.The Inflation Reduction Act includes several groundbreaking steps to bring down prescription drugs for Washington state’s more than 1.4 million Medicare patients, like finally allowing Medicare to negotiate lower prescription drug costs—something Senator Murray has been fighting to do for years and will bring down costs for patients everywhere and generate enormous savings for taxpayers. It also caps Medicare beneficiaries’ out-of-pocket prescription drugs costs at $2,000 a year, caps their insulin costs at $35 a month, and caps price increases on their prescriptions at the rate of inflation so that drug makers cannot jack up prices to pad their own profits.Senator Murray held the roundtable at the Clark County Area Agency on Aging and Disability. She was joined by Mike Reardon, Executive Director of the Area on Aging and Disabilities of Southwest WA; Lisa Bayautet, a citizen representative for Area on Aging and Disabilities of Southwest WA; Bridgette Fahnbulleh, advocate and former Vancouver NAACP President; Pat Cano, LULAC Senior Member, Advisory Council Member for the Area Agency on Aging; and Cass Freedland, Chair of the Clark County Commission on Aging.###Sign up to receive Senator Murray’s newsletter and get updates on the workshe’s doing on behalf of Washington state.  "
https://www.murray.senate.gov/murray-cantwell-visit-sw-wa-semiconductor-manufacturer-as-chips-science-act-spurs-industry-growth/,"CAMAS, WA – Today, U.S. Senators Patty Murray (D-WA) and Maria Cantwell (D-WA) toured semiconductor manufacturer nLight to tout the major opportunities coming to Southwest Washington in the recently-passed $250 billion CHIPS & Science Act. The competitive grant funding, loans, and loan guarantees as well as the investment tax credit in the bill will potentially support major investments in Clark County’s cluster of semiconductor and electronics manufacturing companies. The Greater Portland Region supports over 30,000 jobs in computers and electronics, with over 2,800 jobs in semiconductor and related device manufacturing in Clark County alone.“Right here in Clark County, nLight and companies like them make up a hub of semiconductor manufacturing in the U.S.,” said Sen. Murray. “This bill is a game changer. It’s going to bring down costs on everything from appliances to cars to medical equipment—everything that requires chips, it will create good-paying jobs here in Clark County and across our state, and it’s going to protect us against the price spikes we saw as a result of the pandemic, by strengthening a really critical supply chain. We are building an economy that not only leads the world in innovation, but leads to good-paying jobs right here at home and lower costs on our store shelves.”“We want to be the leaders in the production of semiconductors and we want to be the leaders in advanced chip manufacturing,” said Sen. Cantwell. “We want to be the leaders in the design of the future applications for this great technology. And Camas and Clark County are leading the way.”“Since the beginning of last week, Micron Technology, GlobalFoundries, Qualcomm, and SEH have all announced plans for over $40 billion to build new semiconductor fabs – and increase production right here in the United States,” Sen. Cantwell continued.The Senators emphasized the opportunities to improve science, technology, engineering, and mathematics education in the region, including $200 million for the National Science Foundation to grow the semiconductor workforce.Said Scott Keeney, CEO, nLight: “As the world changes, there’s been more pressure. And I think this CHIPS Act comes at a critical time, not only to enhance what we’re doing in industry, but also to go deeper into science and technology, and to go into workforce development, and to go into education.”Said Jennifer Baker, President of the Columbia River Economic Development Council: “We must optimize our efforts on the national stage to anchor in the benefits right here … We can support every young person in our community to explore career pathways in STEM, feeding their curiosity, not just with technology, but also challenging them to ask how it works…To colleagues in the room, I say let’s get after it.”During the tour, the senators and media saw the chip manufacturing process in action, from automated wafer construction to semiconductor laser cutting.The recently passed CHIPS & Science Act will enable the Department of Commerce to provide $39 billion in incentives via loans, loan guarantees and grants to chip manufacturers, as well as to companies that do not make chips (e.g., chip equipment and materials suppliers). The Act also provides a 25 percent investment tax credit for semiconductor manufacturing equipment and the construction of semiconductor manufacturing facilities. Additional funds can support local workforce development efforts. These activities may be beneficial to a range of local companies, like Analog Devices, nLight, WaferTech, and SEH America.The CHIPS & Science Act also reauthorizes National Science Foundation’s Advanced Technological Education (ATE) program and doubles the budget for ATE from the current level of $75 million per year to $150 million per year. This program helps community colleges like Clark College improve and expand educational programs for technicians to work in high-tech STEM fields that drive the U.S. economy and secure good paying jobs in Clark County.Additionally, the CHIPS & Science Act provides support for expanding internship and experimental learning opportunities at Washington State University Vancouver like the school’s Future Leaders Project, which aims to connect historically underserved students with paid summer internships and mentoring. The bill also supports the school’s ongoing efforts to increase the access, entry and retention of women and people of color in STEM fields. The campus serves a large population of first-generation college students (44 percent) and students of color (33 percent).MORE PHOTOS FROM THE EVENT CAN BE FOUND HERE. VIDEO FOOTAGE OF THE PRESS CONFERENCE CAN BE FOUND HERE. VIDEO FOOTAGE OF NLIGHT LASERS IN ACTION CAN BE FOUND HERE. AUDIO OF THE PRESS CONFERENCE CAN BE FOUND HERE. ###Sign up to receive Senator Murray’s newsletter and get updates on the workshe’s doing on behalf of Washington state.  "
https://www.murray.senate.gov/senator-murray-applauds-president-biden-singing-the-inflation-reduction-act-into-law/,"ICYMI: Senator Murray Helps Pass Historic Bill to Lower Prescription Drug and Health Care Costs; Tackle Climate Crisis, Build Stronger Clean Energy Economy – MORE HEREICYMI: Senator Murray Highlights Landmark Climate Bill in Seattle to Lower Energy Costs and Create Clean Energy Jobs – MORE HERE***WATCH: Senator Murray Delivers Floor Remarks on Inflation Reduction Act*** (Washington, DC) – Today, U.S. Senator Patty Murray (D-WA), Chair of the Senate Committee on Health, Education, Labor, and Pensions, applauded President Biden for signing the Inflation Reduction Act of 2022 into law and issued the following statement:“The Inflation Reduction Act is going to lower everyday costs for the basics like prescription drugs and health care while building a stronger clean energy economy right here in Washington state—and it’s all paid for by simply ensuring giant corporations pay their fair share in taxes.“We are finally giving Medicare power to force drug companies to the bargaining table and negotiate lower drug prices for patients across the country and we are extending health care tax credits to make health insurance more affordable. This isn’t  just about saving patients’ money—this will save lives. We are helping patients who are rationing their prescriptions to make ends meet, or who are afraid to see their doctors—not because they are scared of getting a diagnosis, but because they are scared of the price tag.“This historic legislation will be the largest-ever investment in climate action in our country’s history. And Washington state is uniquely poised to take full advantage of federal clean energy tax credits and grants that will deliver lower energy costs for consumers, millions of good-paying jobs, and promote real energy independence.“Getting this legislation signed into law will help communities in every part of Washington state—and it marks a historic turning point in how we tackle the climate crisis in this country, while lowering everyday costs for families everywhere in Washington state. This is an important step forward and I’m committed to building on this historic progress.”The Inflation Reduction Act lowers prescription drug and health care costs and delivers the largest-ever investment in climate action —lowering energy costs, promoting energy independence, and creating good-paying jobs.  The Inflation Reduction Act is fully paid for by ensuring the very wealthiest and giant corporations simply pay their fair share and would actually reduce the deficit by more than $300 billion.More on the Inflation Reduction Act HERE. ###Sign up to receive Senator Murray’s newsletter and get updates on the workshe’s doing on behalf of Washington state.  "
