url,text
https://www.peters.senate.gov/newsroom/press-releases/peters-pushes-for-passage-of-american-recue-plan-to-deliver-robust-covid-relief-for-michiganders-,"Peters Highlights How Relief Package Would Support Struggling Americans, Provide Funding to Help Schools Safely Reopen and Resources to Speed up Vaccine DistributionWASHINGTON, DC – During a speech on the Senate floor, U.S. Senator Gary Peters (MI) today pushed for quick Senate passage of the American Rescue Plan Act, which would deliver robust and comprehensive Coronavirus relief to Michiganders. The Senate is considering the package that will provide critical aid to Michiganders and Americans across the nation, includes funding to distribute stimulus checks, accelerate vaccine distribution and help schools reopen safely.“We must act quickly to meet the urgency of this moment by swiftly passing the American Rescue Plan,” said Senator Peters. “This is about relief for Michiganders and Americans who are reeling and desperately trying to make ends meet, funding to help schools safely reopen, resources to speed up vaccine distribution and support for small businesses fighting to staying afloat.”“We are beginning to emerge from a very dark winter — but our work is not done,” Senator Peters continued. “We cannot be complacent — we cannot let up. This virus does not take a day off, and so neither can we. There’s widespread support across the country for this package — from mayors, to governors to economists across the political spectrum and the majority of Americans. We must deliver comprehensive and urgently needed relief, and we can do just that by passing the American Rescue Plan.”Click here to watch Senator Peters’ remarks on the Senate Floor. Below are Senator Peters’ remarks, as prepared for delivery:“As we near the one-year anniversary of the Coronavirus pandemic gripping our country, there is no question that Michiganders and people all across our country are still hurting.“While we are making important progress in the fight to combat this virus, this public health and economic crisis continues to take a significant toll — on families — workers who are out of a job— educators — students — small businesses — hospitals — and communities all across our country. “We passed targeted, temporary relief in December. But we knew at that time it was not enough.“We need more robust, meaningful relief.“We must act quickly to meet the urgency of this moment by swiftly passing the American Rescue Plan.“This is about relief for Michiganders and Americans who are reeling and trying to make ends meet – funding to help schools safely reopen – resources to speed up vaccine distribution – and support for small businesses fighting to staying afloat.“I continue to hear from Michiganders from all across the state who are struggling to put food on the table, pay their rent and keep the lights on.“These folks aren’t asking for a handout—they simply want a lifeline to get to the other side of the pandemic.“When we passed $600 relief checks in December, I pledged that we must do more—and that we could do that by providing people with an additional $1,400—to fulfill the promise of $2,000 relief funds.“With the American Rescue Plan, the majority of Michiganders and Americans who received these relief checks in December are going to be eligible once again.“This bill would mean a family of four could receive an additional $5,600.“That support is vital to make sure that people survive and more families do not fall into poverty as a result of this pandemic and can get back on their feet as quickly as possible. “We know that millions of workers across our country, including workers in Michigan — are on the verge of seeing unemployment benefits expire on March 14th.                                                                                             “We cannot abandon folks who are out of work through no fault of their own because of COVID-19. They have seen this pandemic disrupt their jobs and their incomes.“The need for unemployment assistance is widespread — and it is necessary – in Michigan.“For example – there were over 840,000 active claims from Michiganders for unemployment assistance in Michigan in just February. That’s up from 529,000 in January.“And these claims for assistance come from every county all across our state.“We need to act now so these individuals remain eligible for unemployment benefits, including if they were self-employed workers like small business owners, freelance workers, independent contractors or gig workers.“We must ensure families receiving unemployment have enough assistance to get by, which is why I support an additional $400 in weekly benefits.“We also need to provide certainty that this assistance will continue to be there for them in the months ahead, not just for the next few days.“The American Rescue Plan will do just that by bolstering our state unemployment programs with additional federal support through August 29.“To help families get back to work, we all know that we must also safely reopen our schools.“Many parents and educators are struggling to assist children through lessons while juggling other work and caregiving demands during the pandemic.“The American Rescue Plan reflects a point of consensus that we want our students to return to in-person learning as quickly and safely as possible – and that the more resources we can provide the better.“In response to the negative impact that COVID-19 has had on education, a stronger and urgent investment in our schools is absolutely critical for achieving safe operations and recovering from gaps in learning.“That is why the American Rescue Plan is absolutely essential. This legislation will provide $170 billion in emergency funding to our schools and to our students, with $130 billion for K-12 schools.  “The funding will help schools take steps based on science and recommended by the CDC to ensure students and educators can safely return to the classroom.“This includes repairing ventilation systems —reducing class sizes and implementing social distancing guidelines — purchasing personal protective equipment — and hiring support staff to care for students’ health and for their well-being.“Every family and community has been facing a very unique set of challenges. And we need to provide robust funding relief so schools and parents have what they need to keep children connected with learning opportunities that are both safe and effective. “And while these are important steps — we also know that if we’re going to come back stronger from this pandemic, we also need to support the backbone of our economy, which is our small businesses.“While we have passed several rounds of relief for small businesses, too many of our hard-hit small businesses are still reeling — from restaurants — to boutiques — to family-owned and minority-owned businesses.“The American Rescue Plan has significant small business relief — including: $25 billion in grants for restaurants and bars that have lost revenue because of the pandemic; $15 billion for Economic Injury Disaster Loan Advance grants; $7 billion in funding for Paycheck Protection Program loans and expanded eligibility for non-profits.“Additionally, this package reauthorizes and provides $10 billion in federal funding — including $1.5 billion specifically for minority-owned small businesses — to the State Small Business Credit Initiative.“I was proud to help establish this program in 2010 while serving in the House of Representatives.“This program is a proven success. In Michigan, it has helped small businesses create or retain over 12,000 jobs and it strengthens state programs that support financing of small businesses, allowing them to both grow and create more jobs.“I am pleased to again champion this program — and with additional investment — it will again provide crucial support to small businesses in Michigan and all across our country. “And finally — to completely get this pandemic under control — we must ramp up the distribution of vaccines. That’s one of my top priorities as Chairman of the Committee on Homeland Security and Governmental Affairs.“Thanks to the extraordinary work of our scientists, researchers and vaccine makers — especially those in my home state of Michigan — we now have three safe and effective vaccines.“But I know that many people have been frustrated and downright angered by the difficulties they have experienced trying to secure vaccines for their loved ones or for themselves.“But I’m encouraged that President Biden and his Administration have been working tirelessly to expand vaccine production and speed up vaccine distribution.“But to get these additional vaccines in arms, it will take additional resources. Through my work on the Senate Homeland Security Committee — I have been leading the charge to ensure that the Federal Emergency Management Agency has the essential staff — supplies —transportation — and other resources necessary to ensure every vaccine dose is actually reaching the arms of Americans.“I have spoken with President Biden both in the Oval Office and at the Pfizer facility in Portage, Michigan about the critical need to expedite the deployment of vaccines — and do everything in our power to ensure vaccines are free and widely available to every community as quickly and efficiently as possible.“The American Rescue Plan includes $50 billion to help FEMA support a national vaccination program to efficiently administer vaccines — including in underserved communities.“It also provides frontline medical professionals the personal protective equipment, testing supplies and workforce needed to slow and to eliminate the spread of COVID-19.“All of these resources are mission critical as FEMA plays a leading role in assisting the federal government’s response to COVID-19 — by coordinating medical supply acquisition and distribution — and assisting state and local governments with funds for response activities —such as vaccine distribution and overtime pay for public health officials.“As we consider the American Rescue Plan there are signs of hope — particularly with ramped-up vaccine production.“We are beginning to emerge from a very dark winter —but our work is not done.“We cannot be complacent — we cannot let up. This virus does not take a day off — and so neither can we.“We must pass the American Rescue Plan. This package is not only what the American people need but it is what they want.“There’s widespread support across the country for this package — from mayors, to governors to economists across the political spectrum and the majority of Americans.“We must deliver comprehensive and urgently needed relief — and we can do just that by passing the American Rescue Plan.“This package will not mark the end of our efforts to crush this virus, but it will provide a massive shot in the arm — to help families, to safely open our schools and to accelerate the deployment of vaccines.“I urge all of my colleagues to support the motion to proceed and final passage.”###"
https://www.peters.senate.gov/newsroom/press-releases/peters-presses-senior-national-security-and-defense-officials-for-answers-on-preparation-and-response-failures-that-led-to-january-6th-capitol-attack,"At Second Joint Senate Hearing Examining Security & Intelligence Failures, Peters Continues Leading Charge to Provide Answers to the American People on January 6th AttackWASHINGTON, D.C. – U.S. Senator Gary Peters (MI), Chairman of the Homeland Security and Governmental Affairs Committee, today pressed senior officials from national security, law enforcement and defense agencies about breakdowns in intelligence gathering, security preparations and the delayed response on January 6, 2021 when domestic terrorists attacked the U.S. Capitol. Peters pushed for information on how our nation’s law enforcement and intelligence agencies misjudged the likelihood of violence and why a response from the National Guard was delayed once the building was breached. Peters also continued to raise the alarm about domestic terrorism and how our national security apparatus has not effectively focused on this growing and deadly threat.Peters convened the bipartisan oversight hearing jointly with Senators Rob Portman (R-OH), Ranking Member of the Homeland Security and Governmental Affairs Committee, and Amy Klobuchar (D-MN) and Roy Blunt (R-MO), Chairwoman and Ranking Member of the Rules and Administration Committee, to examine the security and intelligence failures that led to a breach of the U.S. Capitol and ensure such an attack never happens again. This was the second joint hearing examining the January 6, 2021 attack on the U.S. Capitol. The previous hearing featured testimony from current and former officials responsible for securing the area surrounding the U.S. Capitol on the preparations and response efforts on January 6, 2021.Testifying before the committee were: Melissa Smislova, Senior Official Performing the Duties of the Under Secretary, Office of Intelligence and Analysis, Department of Homeland Security; Jill Sanborn, Assistant Director, Counterterrorism Division, Federal Bureau of Investigation; Robert Salesses, Senior Official Performing the Duties of the Assistant Secretary of Defense, Homeland Defense and Global Security, Department of Defense; and Major General William J. Walker, Commanding General of the District of Columbia National Guard.“The January 6th attack must mark a turning point. There can be no question that the domestic terrorist threat – including violence driven by white supremacists and anti-government groups – is the gravest terrorist threat to our homeland security,” said Peters, in part during his opening statement. “Today’s witnesses are uniquely qualified to discuss what intelligence was produced in the days leading up to the attack – what officials missed as they assessed the likelihood of violence that day – and why our intelligence community failed to heed the crystal clear warnings that were broadcast on social media and publicly reported in the days leading up to the 6th – that a violent attack on the Capitol was imminent.”Peters continued: “The January 6th attack on the citadel of our democracy remains a dark stain on our nation’s history. Our committees have a responsibility to continue that each of us have a responsibility to carry out our oversight duties in a serious and nonpartisan way.” To watch video of Senator Peters’ opening remarks, click here. For text of Peters’ opening remarks as prepared, click here.To watch video of Senator Peters questioning officials responsible for security of the U.S. Capitol complex, click here.To watch video of Senator Peters’ closing remarks, click here.The joint oversight hearing is part of a broader bipartisan effort Peters is leading to examine the security and intelligence failures on January 6th and determine if reforms are needed to prevent a similar attack in the future. Peters also led a bipartisan request from Senate Committee leaders pressing 22 agencies and departments to provide information related to the preparations for and response to the January 6, 2021 Joint Session of Congress and the subsequent security failures.  ###"
https://www.peters.senate.gov/newsroom/press-releases/peters-helps-confirm-gina-raimondo-as-secretary-of-commerce,"Peters Previously Secured Raimondo’s Commitment to Work with Him on Key Michigan PrioritiesWASHINGTON, DC – U.S. Senator Gary Peters (MI), a member of the Senate Commerce, Science and Transportation Committee, released the following statement after joining his colleagues on a bipartisan basis to confirm Gina Raimondo as Secretary of Commerce:“I’m excited to work with Secretary-designate Raimondo on a wide variety of issues affecting Michigan. In our conversations, she has made clear her commitment to addressing challenges affecting Michigan workers: whether it is getting through this pandemic – honing a greater federal focus on manufacturing strategy – or more aggressively using the tools at the Commerce Department to self-initiate investigations into trade abuses.“Through my role as Chairman of the Homeland Security and Governmental Affairs Committee, I also look forward to working with Secretary-designate Raimondo on strengthening the Census Bureau and ensuring an accurate census – which the previous Administration repeatedly undermined. There is no shortage of pressing challenges facing our economy and our nation, but I know Secretary-designate Raimondo is prepared and equipped for this new role.”Peters has spoken with Raimondo on key Michigan priorities and secured commitments to work together on issues including strengthening manufacturing and ensuring a level playing field against unfair trade practices that have hurt workers like Michigan’s cherry growers.###"
https://www.peters.senate.gov/newsroom/press-releases/peters-releases-gao-report-showing-more-action-is-needed-to-address-pfas-contamination,"Peters will Continue to Champion Efforts to Fight PFAS Crisis & Help Michigan CommunitiesDETROIT, MI – U.S. Senator Gary Peters (MI), Chairman of the Homeland Security and Governmental Affairs Committee, released a report by the Government Accountability Office (GAO) that shows the federal government needs to take further action to clean up and prevent contamination from per- and polyfluoralkyl substances (PFAS). The report found that the Trump Administration made limited progress in protecting communities and drinking water resources from exposure to toxic “forever” chemicals known as PFAS, and much of the progress identified in the report was due to Congressional efforts.  Peters originally requested the report in 2019, along with U.S. Senator Tom Carper (DE), to obtain information about ongoing federal agency efforts to address the PFAS contamination crisis and to ensure that taxpayer dollars are being used effectively.“Exposure to PFAS chemicals continues to harm the health and wellbeing of families in Michigan and across America. This report clearly shows that while progress is being made, the federal government must step up their efforts to ensure our drinking water is safe and protect communities from these hazardous chemicals,” said Senator Peters. “From establishing a national drinking water standard to securing the resources needed to cleanup affected communities– I will continue working with the Biden Administration to ensure we address PFAS contamination in Michigan and across the nation.”“Communities across the country are impacted every day by exposure to PFAS chemicals in their drinking water,” said Senator Carper. “This report lays out where we stand on addressing this critical issue affecting millions of Americans, and its findings are crystal clear: we have a lot of work to do. I’ll be continuing the fight in Washington to ensure all families have access to clean water.”READ THE REPORT HEREThe report found that the Environmental Protection Agency (EPA) has made some progress on only three out of six regulatory actions laid out in a 2019 plan to address the PFAS crisis. This includes measures required by the 2020 National Defense Authorization Act (NDAA), including ensuring that products containing PFAS chemicals are not imported into the United States without first being reviewed by the EPA. However, the report also found that under the previous Administration, the EPA failed to complete three additional regulatory actions laid out in their plan to combat these harmful chemicals, including taking a step back on efforts to designate PFAS as a hazardous substance. Peters is committed to working with the Biden Administration to quickly implement science-based safeguards to address the PFAS crisis.As the top Democrat on the Homeland Security and Governmental Affairs Committee, Peters has led Congressional efforts to address PFAS contamination in Michigan and across the country. Peters supported or led provisions in the 2019 national defense bill banning the Department of Defense from purchasing firefighting foams containing PFAS. The bill also immediately prohibited the use of firefighting foams containing PFAS in military training exercises, and enhanced state cooperation with the Department of Defense regarding clean-up due to PFAS contamination stemming from military-related activities. His bill to help protect firefighters and emergency responders from PFAS exposure in the line of duty passed the Senate last year. In September 2018, Peters helped convene the first hearing on PFAS in the Senate, assessing the federal response to contamination and remediation. He then convened a field summit in Grand Rapids in November 2018 to shine a light on how the local, state and federal governments are coordinating their response to PFAS.###"
https://www.peters.senate.gov/newsroom/press-releases/peters-applauds-house-passage-of-american-rescue-plan-pushes-for-quick-senate-passage,"Next week Senate to begin considering relief package to provide $1,400 stimulus checks, critical funding to safely reopen schools and speed up vaccine distributionDETROIT, MI – U.S. Senator Gary Peters (MI) today applauded House passage of robust and comprehensive Coronavirus relief that would provide critical aid to Michiganders and Americans across the nation. He urged the Senate, which is scheduled to begin considering the package next week, to pass it swiftly. The American Rescue Plan includes funding to distribute direct stimulus checks, accelerate vaccine distribution and help schools reopen safely.Peters supports the American Rescue Plan and has spoken directly with President Biden and Vice President Harris in the Oval Office about the need to swiftly pass this legislation. Last week, he joined President Biden during a visit to Pfizer’s facility in Portage, where they thanked Michigan workers and discussed the importance of ramping up vaccine production and equitable distribution.“As we close in on the one-year anniversary of this pandemic gripping our nation, it’s very clear that more action is needed to deliver urgent relief to struggling Michiganders and emerge from this public health and economic crisis,” said Senator Peters, Chairman of the Homeland Security and Governmental Affairs Committee. “Whether it’s direct stimulus checks – ramping up vaccinations – or ensuring schools have the resources to safely re-open – the American Rescue Plan has the robust relief needed to help our state and country get through this pandemic. The vast majority of Americans – as well as mayors, governors, business leaders and economic experts from across the political spectrum – support this bill, and I will work with my Senate colleagues to swiftly pass this package and send it to the President’s desk.”Critical provisions in the American Rescue Plan include:###"
