url,text
https://www.peters.senate.gov/newsroom/press-releases/peters-statement-on-senate-republicans-blocking-legislation-to-codify-roe-v-wade,"Peters Spoke on Senate Floor Yesterday in Support of the Women’s Health Protection Act; Shared Personal Family Story with AbortionWASHINGTON, DC – U.S. Senator Gary Peters (MI) today released the following statement after Senate Republicans blocked the U.S. Senate from advancing the Women’s Health Protection Act, which would codify Roe V. Wade at the federal level:“Overturning Roe v. Wade would have immediate, tragic and disastrous consequences for people in Michigan and across the country. Accessing an abortion and making extremely personal health care decisions has been a fundamental right for half a century – and taking it away would put lives at risk. This issue is not abstract or theoretical, and that’s why I shared my family’s abortion story, because families across the country go through these heartbreaking experiences every day.“Despite Senate Republicans blocking us from moving forward on this critical legislation to codify Roe v. Wade, we cannot give up. While Republicans are preparing legislation to make abortion illegal across the country and impose cruel new restrictions, banning exceptions for rape, incest or life of the mother, I remain as resolved as ever — and will continue fighting to protect women’s health care and keeping these decisions between a woman and her doctor.” To watch video of Peters speaking on the steps of the U.S. Capitol after Republicans blocked a bill to codify Roe v. Wade, click here.Peters spoke on the Senate floor last night in support of the Women’s Health Protection Act and shared his family’s abortion story. Peters was the first Senator to share his personal family story with abortion in October 2020 during the confirmation process of Amy Coney Barrett. He again recently told his story in a roundtable with four colleagues in the U.S. House of Representatives, as the stakes have never been higher for women’s access to this critical health care. ###"
https://www.peters.senate.gov/newsroom/press-releases/video-on-senate-floor-peters-urges-passage-of-womens-health-protection-act-and-shares-family-abortion-story,"WASHINGTON, DC – U.S. Senator Gary Peters (MI) today delivered remarks on the Senate floor in support of the Women’s Health Protection Act and shared his family’s personal abortion story. The Women’s Health Protection Act would protect against dangerous state laws that limit health care professionals’ ability to carry out and provide essential reproductive health care services by codifying Roe V. Wade into law.Peters was the first and only Senator to share his personal family story with abortion – which he shared again recently as the U.S. Supreme Court considers a case that would severely undermine a key right that women and families have relied on for over 50 years. “Right now, we may see a Supreme Court come out with a decision to basically end Roe v. Wade, and in the process, end a fundamental right that women in this country have had available to them for 50 years.” said Senator Peters. “…Let's preserve the right of women to do what they think is best. That's why we have to pass the Women's Health Protection Act – and why I would urge all my colleagues to search their heart and listen to the stories that people will tell them and understand that the right thing to do is to protect reproductive freedoms and rights in America.” To watch video of Senator Peters’ remarks on the Senate floor, click here.The Women’s Health Protection Act would enact a federal law that would make any targeted restrictions against medical providers who carry out this critical work unlawful. Specifically, it would create a statutory right for health care providers to provide abortion care, and a corresponding right for their patients to receive that care, free from medically unnecessary restrictions that single out abortion and impede access.Below are Senator Peters’ full remarks, as delivered:“Madam President, I also rise to speak about the need to pass the Women's Health Protection Act. Certainly the Senator from Maryland outlined a very strong argument as to why this fundamental protection – this fundamental right – needs to be protected.“And we know that right now, we may see a Supreme Court come out with a decision to basically end Roe versus Wade, and in the process end a fundamental right that women in this country have had available to them for 50 years.“You know, we can hear all the arguments, and my colleagues will present an awful lot of arguments tonight and tomorrow as to why we need to pass this Act. But for me, this is personal, a personal experience that I have had.“And it's an experience that unfortunately, many, many families have.“In fact, as I've shared this story, I've been really overwhelmed by people reaching out to me and saying that they too had a very similar story and how me talking about it brought out their willingness to share the experience as well.“And in addition to that, they understand how important it is that we protect Roe versus Wade, and we protect the right for women to make critical decisions for themselves along with their doctor and not have politics interfere with those decisions.“So my story involves my first wife, when she was pregnant with a child that we very much wanted. We were looking forward to have a second child.“And then in the fourth month – towards the end of the fourth month – her water broke. Clearly a very dangerous situation.“She went to go see her physician. Her physician examined her and said, ‘With this water breaking the amniotic fluid has now left the uterus. There's no way the baby can survive in this situation.’ But he examined her – there was a very faint heartbeat. So he says ‘there's a faint heartbeat here but there's no way this this this baby's going survive. What I think will happen is you're going to have a miscarriage. So go home tonight. And you'll have a miscarriage and then come in and see me tomorrow.’“Well, you can imagine the anguish the horrible evening and despair that she was in and I was in. It was a long, long night.“The next morning nothing happened. She went back to the physician – we went back to the physician – examined her again and said, ‘Well, I'm really surprised I don't know why this – you didn't miscarry.’ Because it's clear that there's no way this baby can survive in this situation. The amniotic fluid is gone. The cushion is gone.“But he goes, ‘You know, I don't think I can do anything because there's still a faint heartbeat here. I don't know why they're still a faint heartbeat. So go home again tonight. I think tonight is going to be the night you have a miscarriage.’“We went back again. It didn't happen. Another horrible night. Horrible. The mental anguish is intense. And families who've gone through this know exactly what I'm talking about.“We went the next day. Again, the examiner, he goes, ‘I can't understand this.’ He goes, ‘But you know this is going on, I'm really worried that there's going to be an infection here. There isn't the protection there. But you could go into septic shock and your health is definitely in danger here.’“Again, the baby can't survive. In fact, without the amniotic fluid and the cushion your baby could lose its limbs – and the horrible, horrible, nightmarish kind of thoughts in our mind.“So he says ‘You know, I’m going to go to the hospital. And I'm going to say even though there's a faint heartbeat, this is a medical necessity that we have to do d and c abortion here to protect your health. And potentially your life if we don't take care of this. So I'll go the hospital, go home. And I'll call you let you know when I can bring you in.’“Well, he called it – and I'll never forget the voicemail that was left. He goes, ‘You know, I'm really sorry to say this. I went to the hospital board. I explained the medical necessity here. I understand what you're going through how we have to take care of this because it could clearly be a serious situation if you go into septic shock. And the board said no. As long as there was a faint heartbeat. You can't perform this procedure.’“And then he goes, “There is no reason for this decision from the hospital board. It is not based on sound medicine. It's not based on medical practice, it's not based on what's best for your health. This is based on politics, plain and simple. This is politics.’“And he goes, ‘I'm ashamed that this happened. And I'm embarrassed that I have to call you and tell you I can't do it because the hospital will not grant me privileges to do it.’“So he says, ‘My advice to you is find a doctor now – immediately – that can take care of this procedure.’“Well, you can imagine how scary that is. How frightening that is, and what we're going through, like, ‘Who do we call in that situation?’“Now, we were fortunate in the fact that we had a friend who was a hospital administrator at another hospital. And he got us in to see the gynecologist – OBGYN – at the hospital to examine her. We went in there and he examined her and he said, ‘Oh my gosh, I have to do this procedure now, there is no more time, this is getting incredibly dangerous. We have to do the d and c abortion.’“He said, ‘You're about to go – this infection is starting – it's going to get worse. If I don't do this quickly, you're going to lose your uterus. And if we don't do it quickly, you could very well lose your life with the infection that can occur here.’“So he immediately performed the procedure.“But just think of that. If we didn't have the opportunity to see another doctor who was able to perform it – understood the severity of it – my wife, at the time, my former wife could have easily lost a uterus, have severe significant health impacts and could have lost her life.“And it just kept ringing in my mind what that doctor said: this is about politics. This is not about what's good medicine, medical practice, this is not about caring about someone's health and caring about their life. It was about politics.“And that is why we have to protect Roe versus Wade, we have to protect the right for women to control their bodies – to control their reproductive health. It cannot be a decision made by politicians here in this in this body or other places.“And this is a real situation that families face. As I mentioned the outpouring of folks who have come to me that have had similar situations.“And I think about Michigan right now – Michigan has a law on the books that was written in 1931 that says all abortion is prohibited in our state. It doesn't matter whether or not it's involves the health of the mother, doesn't matter if it's the life of the mother, doesn't matter if a woman is the victim of rape or incest. It's just simply not allowed.“Well I think that's unconscionable. And that's what will happen. It's a real-life situation that could happen if the court decides to go forward and reverse Roe vs. Wade.“Situations like what my former wife went through and families all across America will be not able to have that kind of option. And you think about the no exception for rape or incest that you'll have a 17 year old girl in Michigan who is raped, she will have no options.“I know a majority of people in the United States believe that is unacceptable. I know a majority of people in the United States believe that women have the right to make these most personal – these most intimate – decisions themselves with the advice of their physician and whoever else that they want to consult.“This is not about politics. This is not about the opinions of folks who think that they know better.“Let's preserve the right of women to do what they think is best. That's why we have to pass the Women's Health Protection Act – and why I would urge all my colleagues to search their heart and listen to the stories that people will tell them and understand that the right thing to do is to protect reproductive freedoms and rights in America.”###"
https://www.peters.senate.gov/newsroom/press-releases/video-peters-introduces-michigander-bridget-brink-at-confirmation-hearing-to-be-next-us-ambassador-to-ukraine,"At Senate Foreign Relations Committee, Peters Highlights Ambassador Brink’s Upbringing in Michigan, Extensive and Accomplished Career in U.S. Foreign ServiceWASHINGTON, DC – U.S. Senator Gary Peters (MI) today introduced Ambassador Bridget Brink before the Senator Foreign Relations Committee, as part of her confirmation hearing to be the next U.S. Ambassador to Ukraine. Brink – a Michigan native who has spent her career in the U.S. Foreign Service and is currently U.S. Ambassador to Slovakia – was nominated by President Biden to serve as the U.S. Ambassador to Ukraine in April.“Ambassador Brink will be charged not just with supporting our Ukrainian partners in the immediate fight against the Russian invasion, but also in the recovery and rebuilding phases after,” said Peters, a former Lieutenant Commander in the U.S. Navy Reserve and member of the Senate Armed Services Committee. “As someone who was working in U.S. Embassies during conflict in the Balkans, and in Tblisi after the Rose Revolution, Ambassador Brink knows what it takes. Her leadership is more vital than ever.”“I am proud to recognize Ambassador Brink for her extraordinary professional achievements and to congratulate her on this opportunity to serve her country,” Peters continued. “Her success will be our country’s success and I can’t think of anybody more equipped for this position, and it’s why I encourage her swift confirmation.”  To watch video of Peters’ introductory remarks, click here.Ambassador Bridget Brink – a Michigan native from East Grand Rapids – is a career member of the U.S. Senior Foreign Service and currently serves as the U.S. Ambassador to the Slovakia. Prior to that, Brink served as Senior Advisor and Deputy Assistant Secretary in the Bureau of European and Eurasian Affairs at the U.S. Department of State, responsible for issues related to Eastern Europe and the Caucasus. She also served as Deputy Chief of Mission at the U.S. Embassies in Tashkent, Uzbekistan, and Tbilisi, Georgia.Brink began her twenty-five-year career in the Foreign Service in Belgrade, Serbia, and has since been focused on advancing U.S. policy in Europe and Eurasia. She was the Director for the Aegean and the South Caucasus at the National Security Council and served in the State Department as the Deputy Director for Southern European Affairs, Special Assistant to the Under Secretary for Political Affairs, and Cyprus Desk Officer.Brink is the recipient of numerous performance awards. She holds Master’s degrees in International Relations and Political Theory from the London School of Economics and Political Science, as well as a Bachelor’s degree in Political Science from Kenyon College.Below is the text of Senator Peters’ remarks, as prepared for delivery:“Thank you Chairman Menendez and Ranking Member Risch. It is my honor to introduce Ambassador Bridget Brink to the Committee.“I also want to recognize Ambassador Brink’s family with her today – her husband Nick, who is also serving our country as a diplomat, and her two sons Jack and Cole. Like our servicemembers and their families, our diplomats do not serve alone. As every member of this Committee knows, their families often go unrecognized as our diplomats perform their crucial work in foreign lands thousands of miles from their country, so we thank them all for their service.“Ambassador Brink was born and raised in East Grand Rapids and graduated from East Grand Rapids High School in Michigan. Growing up she remembers driving by a sign that proudly recognized her hometown as the home of President Gerald Ford. President Ford’s decency, integrity, and humility served as a marker for the Midwest values that Ambassador Brink lives by. And Ambassador Brink still keeps Michigan very close to her heart, visiting family in West Michigan every year. Although she’s lived all across the globe through her career, she will tell you that her favorite place in the entire world to visit is the shoreline of Lake Michigan.“And that makes sense. As I have always said, the Great Lakes are more than a national treasure to Michiganders, they are ingrained in our DNA. Clearly the Great Lakes are in Ambassador Brink’s DNA as well.“Now, Ambassador Brink will have an opportunity to uphold those Michigan values at a time of incredible upheaval in Ukraine. And I know Ambassador Brink is ready for the challenge.“She is a seasoned diplomat who first joined the State Department in 1996 and has spent her career in places like Georgia, Serbia, Slovakia and Uzbekistan. Places where she learned the intricate dynamics that underpin much of the Post-Soviet order in Eastern Europe and Central Asia and where she learned early on how Russia chooses to treat its neighbors.“Ambassador Brink will be charged not just with supporting our Ukrainian partners in the immediate fight against the Russian invasion, but also in the recovery and rebuilding phases after. As someone who was working in U.S. Embassies during the conflict in the Balkans, and in Tblisi after the Rose Revolution, Ambassador Brink knows what it takes. Her leadership is more vital than ever. And her service across five administrations is fitting tribute to the apolitical service to country that we expect from our civil servants.“I am proud to recognize Ambassador Brink for her extraordinary professional achievements and to congratulate her on this opportunity to serve her country. Her success will be our country’s success and I can’t think of anybody more equipped for this position, and it’s why I encourage her swift confirmation. Thank you for this opportunity to introduce an absolutely extraordinary woman.”###"
https://www.peters.senate.gov/newsroom/press-releases/peters-recognized-by-non-partisan-lugar-center-as-one-of-the-most-bipartisan-senators,"Ranked 5th-Most Bipartisan Senator, 3rd-Most Bipartisan Democrat for His Work in 2021WASHINGTON, DC – U.S. Senator Gary Peters (MI) was recognized as the 5th-most bipartisan Senator — and 3rd-most bipartisan Democrat — in new rankings released by the non-partisan Lugar Center and McCourt School of Public Policy at Georgetown University for his work in 2021. This follows Peters’ recognition as the #1 most effective Senator in the 116th Congress by the non-partisan Center for Effective Lawmaking. Peters earned the effectiveness recognition based on his ability to enact and advance bipartisan legislation – despite the fact that he was serving in only his first term and was in the minority party at the time.“Michiganders expect me to work across the aisle to get things done, and my top priority has been finding common ground to solve problems and deliver results for the people I represent. The best way to achieve that goal is by working with members of both parties, and I’m proud of my bipartisan record,” said Senator Peters. “Our nation faces enormous challenges that require both commonsense and innovative solutions. That is why I will continue working with all of my colleagues to improve the lives of people in Michigan and across the nation.”The Lugar Center established the Bipartisan Index to measure how often Members of Congress work across party lines, including the frequency with which a member reaches across the aisle when bills are introduced. It examines the number of times a member cosponsors legislation introduced by the other party and how often a member’s own legislation attracts cosponsors from the other party. The late and former U.S. Senator Dick Lugar described the Lugar Center’s Bipartisan Index by writing in an op-ed, “The aim of the Index is to highlight members’ willingness to get results, regardless of party.”Peters led and cosponsored many bipartisan legislative efforts that are now law. Last year he led and advanced a number of bipartisan provisions, including measures to:Protect the Great Lakes and Bolster Disaster Response and PreparednessStrengthen CybersecurityPostal Service ReformSupport First RespondersSave Taxpayer Dollars and Improve Government EfficiencyInvest in Domestic Manufacturing ###"
https://www.peters.senate.gov/newsroom/press-releases/photos-in-sault-ste-marie-peters-highlights-500-million-in-funding-for-storm-act-loan-program-to-protect-michigan-communities-from-coastal-erosion-and-rising-water-levels-,"Peters Secured First Funding for Loan Program in Bipartisan Infrastructure LawSAULT STE. MARIE, MI – U.S. Senator Gary Peters (MI), Chairman of the Homeland Security and Governmental Affairs Committee, toured the Sherman Park beachfront in Sault Ste. Marie and highlighted the $500 million he secured in the bipartisan infrastructure law to fund a loan program he created to help communities in Michigan and across the nation invest in resilient infrastructure projects that will protect against coastal erosion, rising water levels, and severe flooding. This is the first funding for the program created by Peters’ Safeguarding Tomorrow through Ongoing Risk Mitigation (STORM) Act, which was signed into law last year. With the new funding Peters secured, the program will help states establish revolving loan funds that can be used to support local infrastructure projects to protect against natural disasters that have put homes, small businesses, property, and communities at risk, and caused millions of dollars in damages. Peters was joined by Sault Ste. Marie Mayor Don Gerrie and Executive Director for the Sault Convention & Visitors Bureau Linda Hoath. “The endless beachfronts like the one here at Sherman Park are essential to the tourism industry and local economy in the Soo and across Michigan. For years, I have heard from communities across our state that they need more federal support to help protect residents, homes, and small businesses from the impacts of coastal erosion and rising water levels on the Great Lakes,” said Senator Peters. “That is why I helped create a low-cost loan programs through the STORM Act, and the funding I secured will ensure these communities can access resources to help them build more resilient infrastructure that can withstand erosion and other natural hazards for years to come.” “Coastal erosion continues to damage homes and businesses, highlighting why communities like ours need help to invest in projects that will mitigate the effects of rising water levels and coastal erosion. I’m thankful to Senator Peters for his efforts to create and secure funding for a loan program that will allow cities like ours to build resilient infrastructure that will keep our residents safe,” said Mayor Gerrie. “The beachfront at Sherman Park is an essential part of the community in Sault Ste. Marie and I appreciate Senator Peters for his tireless work to ensure we can keep our coastlines like this one pristine for years to come.”  “Sault Ste Marie’s tourism industry is critical to supporting our economy and small businesses. When coastal erosion damages local attractions – like Sherman Park’s beach front – it threatens our local businesses and employees that depend on tourism for their livelihoods,” said Linda Hoath. “I am grateful to Senator Peters for his tireless work to create a low-cost loan program, and secure funding for it, so that communities like Sault Ste Marie can invest in mitigation efforts and protect our local economies in a cost-effective manner.” During the walking tour, Peters saw firsthand how these resources could help Sault Ste. Marie update their current infrastructure and invest in new structures like sea walls, breakers and barriers that will improve the city’s ability to address coastal erosion and rising water levels that damage property and businesses. The loan program and funding for Peters’ STORM Act will allow local governments to access needed funds to make critical infrastructure upgrades and help mitigate the impact of natural disasters in a more cost-effective way. Studies have shown that resilience and mitigation spending saves taxpayers an average of $6 for every $1 invested. Unlike existing Federal Emergency Management Agency (FEMA) grants, the low-interest loans created by Peters’ STORM Act would allow local governments to invest in resiliency and mitigation projects that reduce the effects of shoreline erosion and rising and high water levels, along with other natural disasters. These loans would reach communities more quickly than FEMA’s traditional grants, and provide local communities with the capital necessary to invest in more resilient infrastructure. To download high-resolution photos from the visit, click here or on the images below.    Images are courtesy of Senator Peters’ office ### "
