url,text
https://www.schumer.senate.gov/newsroom/press-releases/in-putnam-county-schumer-details-critical-fed-relief-now-on-the-way-to-putnam-via-american-rescue-plan-covid-relief-will-keep-putnams-great-venues-small-businesses-and-performers-going,"Schumer Secured Dedicated Fed COVID Relief For Putnam County Venues And Theaters, An Increase In The COBRA Health Insurance Program To Keep Laid Off Workers Insured, And An Extension Of Historic Unemployment InsuranceHelp Is On The Way For Stages; American Rescue Plan Provides Vital Support To Artists Out Of Work And Cultural Hubs Struggling To Stay AfloatSchumer To Putnam County: With Millions For Independent Live Venues On The Way, The Show Must Go On! At the Boscobel House and Gardens in Garrison, NY which will host the return of the Hudson Valley Shakespeare Festival (HVSF) to Putnam County this season, U.S. Senate Majority Leader Charles E. Schumer detailed the benefits available to the Hudson Valley’s live venues, performers, and artists through the American Rescue Plan, including critical relief to struggling independent live venues, movie theaters, and cultural institutions, increased COBRA health insurance benefits, and additional federal relief for struggling New Yorkers, including gig workers and others in non-traditional employment.Schumer explained how each of these pieces of legislation will help artists, performers, and live venues, like the HVSF, stay afloat throughout the pandemic. Schumer said independent venues, performers, and artists are the beating heart of the Hudson Valley’s cultural life and a driving force in the local economy, and the COVID package that he negotiated, prioritizes the venues and everyone who supports them as the critical cultural hubs that they are.“I’ve said it before and I’ll say it again, independent venues, like theaters and concert halls, are the beating heart of the Hudson Valley’s cultural life and a driving force in the economy,” said Senator Schumer. “Far too many seasonal local venues, like the Hudson Valley Shakespeare Festival, had to cancel their 2020 season because of the pandemic, and they've been struggling to stay afloat. The COVID package that I negotiated, prioritizes these venues and everyone who supports them as the critical cultural hubs that they are.”Schumer added, “The dedicated federal assistance to independent venues ensures that when it is safe to do so, we can gather again for comedy, music, theater, and movies and to once again enjoy the cultural institutions that have been around for generations. The final COVID relief package will help these places keep the lights and the laughs on, and keep the curtain from closing on Putnam County.”Schumer said that live venues are a part of one of the hardest-hit industries right now, and the dedicated assistance will save many venues from permanently shutting their doors to the public. The senator said the federal assistance was imperative because independent venues not only drive economic activity within communities through restaurants, hotels, taxis, and other transportation and retail establishments, but live events provide 75% of all artists’ income.""COVID-19 left the Hudson Valley Shakespeare Festival completely dark in the summer of 2020 - it was devastating for our theater to lose 100% of earned income and for our community to lose the beloved summertime ritual of gathering together under our Theater Tent,"" said Kate Liberman, Managing Director of the Hudson Valley Shakespeare Festival. ""Save Our Stages will allow us to reopen. Our audience and seasonal staff of artists, many of whom spent this past year out of work, will once again contribute to the Hudson Valley's economy through spending at local restaurants, small businesses, and more.  We are thrilled to be able to be one of the first theaters to reopen in New York State, reinvigorating the local economy, and \once again safely gathering with our community in the powerful act of theater making. We are incredibly grateful to Senator Schumer for his efforts in bringing our iconic open-air Theater Tent back to the grounds of the Boscobel this summer.""Founded in 1987, Schumer explained that the HVSF has presented repertory theatre under its iconic open-air Theater Tent each summer for over 35,000 audience members, while also reaching over 30,000 students, families, and educators in schools and communities throughout the Hudson Valley. The HVSF audience is mostly comprised of local, Hudson Valley residents and its annual economic impact is estimated at $4.6 million per year. On top of the annual HVSF audience of nearly 35,000 supporting local small businesses as they go out to dinner and shop along Main Street, the HVSF is one of the largest employers in western Putnam County. The HVSF's160-person seasonal staff of directors, designers, actors, technicians, ushers, concessionaires, and more, consists of local and national union talent. These staff members live, work, and play in the community during the summer season leaving a significant impact on local small businesses. HVSF was completely dark in the summer of 2020 due to the COVID-19 pandemic. Schumer explained how the American Rescue Plan (ARP) benefits artists who are out of work and cultural hubs throughout the state struggling to stay afloat. Specifically, ARP covers 100 percent of costs for the COBRA health insurance program which will help workers who lost their job through no fault of their own retain their health insurance. Additionally, the legislation provides multiple sources of critical relief to struggling independent live venues, movie theaters, and cultural institutions by allowing eligible entities under the Save Our Stages program to get a PPP loan and a Shuttered Venue Operators Grant, and it included $1.25 billion in additional funding for the program, on top of the $15 billion Schumer secured in December. The bill also provides billions in additional federal relief for struggling New Yorkers by extending the historic unemployment insurance reforms established in the CARES Act, through September 6, 2021. It continues the critical lifeline of the enhanced federal unemployment assistance, providing an additional $300 per week on top of all state and federal unemployment benefits. The bill extends the Pandemic Unemployment Assistance program for the self-employed, gig workers, freelancers, and others in non-traditional employment, as well as the additional weeks of federal unemployment insurance for workers who exhaust their regular state benefits.Previously, in December 2020, Schumer negotiated the Save Our Stages Act into the bipartisan COVID relief package, which provided $15 billion nationally for independent live venue operators, independent movie theaters, and cultural institutions such as live performing arts organizations and museums that have been significantly impacted by the economic effects of the COVID crisis. Specifically, the COVID relief package created a new Small Business Administration (SBA) grant program for independent live venue operators, promoters, producers, talent representatives, independent movie theaters, and cultural institutions. These grants can be used for payroll costs, rent, mortgage, utilities, and personal protective equipment, and other needs, and will help keep the industry alive and rebound as the Hudson Valley emerges from the pandemic. According to the HVSF, Save Our Stages will be a lifeline for reopening so that HVSF’s audience and large seasonal staff of artists, who have spent the last year out of work, can once again contribute to the Hudson Valley economy through spending at local restaurants, small businesses, and more.  Schumer also briefly discussed other wins for Putnam County in the American Rescue Plan. Out of the estimated more than $100 billion headed to New York, the Putnam County and the Hudson Valley will receive:Putnam County and the Hudson Valley will also receive a sizable portion of the following funds:###
                             Please be advised that due to the implementation of enhanced mail screening procedures, all mail sent to my state offices will experience a two to three week delay in delivery.  In the meantime, if you have an urgent matter, the best way to reach me is by phone at (202) 224-6542 or through any of my eight district offices."
https://www.schumer.senate.gov/newsroom/press-releases/schumer-gillibrand-deliver-nearly-37-million-in-economic-relief-for-airports-in-upstate-new-york,"DOT Funding Will Provide Lifeline For Cash-Strapped Airports Drained By The COVID-19 PandemicResources Will Help Make Critical Upgrades To Airport Infrastructure, Aprons, And RunwaysWASHINGTON, D.C. — U.S. Majority Leader Charles E. Schumer and U.S. Senator Kirsten Gillibrand today announced $3,647,300 in federal funding for five airports across New York State. This funding was allocated through the Federal Aviation Administration (FAA) under the Department of Transportation (DOT) and will serve as a lifeline to local airports struggling to stay afloat after nearly a year of limited operations. Airports and tourism play an important role in New York’s regional and rural economies and have faced ongoing uncertainty as travel decreased due to the pandemic. This funding will help offset the costs of critical rehabilitation projects and enhance safety standards for airports that have lost substantial revenue and require urgent financial support. “Air travel is vital to the connectivity and success of the Upstate economy, which is why I have fought tooth and nail over the last year to get airports the funding they need to keep services running,” said Senator Schumer. “Airports serve important functions in many communities, connecting people to the rest of the world and allowing for economic opportunities to land. I will continue to fight for federal funding to keep our airports open and operational and to make sure Upstate New York has the help it needs to revive and thrive.”“As New Yorkers continue battling the COVID-19 crisis, we cannot leave airports behind,” said Senator Gillibrand. “Airports, travel, and tourism will be a critical part of our economic recovery. This federal funding will provide New York State’s local airports with the resources needed to increase safety standards and improve lighting, taxiways, and aprons so we’re fully prepared when travel takes off.” Funding Recipients Listed Below:RegionAirport CountyFundingNorth Plattsburgh InternationalClinton$765,000WesternChautauqua County/Dunkirk AirportChautauqua$90,000WesternBuffalo Niagara InternationalErie$650,000CentralCortland County-Chase FieldCortland $1,875,000CentralGriffiss InternationalOneida$267,300###
                             Please be advised that due to the implementation of enhanced mail screening procedures, all mail sent to my state offices will experience a two to three week delay in delivery.  In the meantime, if you have an urgent matter, the best way to reach me is by phone at (202) 224-6542 or through any of my eight district offices."
https://www.schumer.senate.gov/newsroom/press-releases/schumer-statement-on-president-bidens-plan-to-invest-in-the-us-semiconductor-industry-that-can-fuel-major-job-creation-across-upstate-new-york,"Following his advocacy, Schumer released the following statement regarding President Biden’s Plan to Invest in the U.S. Semiconductor Industry, that included $50 billion to fund and implement the federal semiconductor manufacturing and R&D incentives, which Schumer introduced last year as part of his American Foundries Act, and that passed into law as part of the Fiscal Year 2021 National Defense Authorization Act:U.S. Senate Majority Leader Charles E. Schumer said, “I have made it a top priority to work with President Biden to prioritize the absolute necessity of making a major investment in the nation’s semiconductor domestic manufacturing and R&D, which can also fuel new high-paying jobs across Upstate New York. President Biden delivered on my requests with his inclusion of $50 billion to implement the new federal semiconductor manufacturing and R&D programs, that I fought for and passed into law in last year’s defense authorization bill. With the industry’s top companies considering expansion and new investment at New York sites like STAMP in Western New York, White Pines in Central New York, Marcy Nanocenter in the Mohawk Valley, and Luther Forest in the Capital Region, we have no time to waste, so I want to move quickly to pass this funding to support the semiconductor industry’s plans to invest in the U.S., enhance our global competitiveness, promote our national security, and create thousands of new jobs. As I announced weeks ago, I am working to bring to the Senate floor this spring a competitiveness package that includes my bipartisan Endless Frontier Act to invest in American innovation and manufacturing. As part of this legislative effort, I am working with members of both parties and the administration to include emergency spending to fully fund the federal semiconductor manufacturing and R&D programs authorized in the defense bill.”###
                             Please be advised that due to the implementation of enhanced mail screening procedures, all mail sent to my state offices will experience a two to three week delay in delivery.  In the meantime, if you have an urgent matter, the best way to reach me is by phone at (202) 224-6542 or through any of my eight district offices."
https://www.schumer.senate.gov/newsroom/press-releases/schumer-statement-on-calls-for-federal-investigation-into-the-mount-vernon-police-department,"U.S. Senator Charles E. Schumer’s office released the following statement regarding the City of Mount Vernon and the Westchester County District Attorney’s calls for a federal investigation into the Mount Vernon Police Department:Schumer Spokeswoman Allison Biasotti said, “Senator Schumer strongly supports the City of Mount Vernon and the Westchester County District Attorney’s calls for a federal investigation and hopes that the Department of Justice does a thorough, top-to-bottom report to enact productive and meaningful change within the Mount Vernon Police Department.”###
                             Please be advised that due to the implementation of enhanced mail screening procedures, all mail sent to my state offices will experience a two to three week delay in delivery.  In the meantime, if you have an urgent matter, the best way to reach me is by phone at (202) 224-6542 or through any of my eight district offices."
https://www.schumer.senate.gov/newsroom/press-releases/schumer-gillibrand-deliver-nearly-13-million-in-economic-relief-to-local-new-york-airports-for-operational-and-cleaning-costs,"Funding Will Help Keep Airports Clean and Combat the Spread of Pathogens; Provide Lifeline For Cash-Strapped Airports Drained By The COVID-19 Pandemic WASHINGTON, DC - U.S. Majority Leader Charles E. Schumer and U.S. Senator Kirsten Gillibrand today announced $12,901,648 in federal funding for seven airports across New York. Secured in the CARES Act championed by the senators, this funding was allocated through the Department of Transportation (DOT) and will serve as a lifeline to local airports struggling to stay afloat after more than a year of limited operations. This funding will help alleviate the cost required to meet increased safety standards and properly sanitize airports, including resources for janitorial services, supplies, and debt service payments. Additionally, this CARES Act funding will provide assistance for rent and minimum annual guarantees to on-airport car rental, parking, and in-terminal concessions. Airports and tourism play an important role in New York’s regional and rural economies and have faced ongoing uncertainty as travel decreased due to the pandemic.“Air travel is vital to the connectivity and success of the Upstate economy, which is why I have fought tooth and nail over the last year to get airports the funding they need to keep services running as air travel picks up again,” said Senator Schumer. “Airports serve important functions in many communities, connecting people to the rest of the world and allowing for economic opportunities to land. I will continue to fight for federal funding to keep our airports open and operational and to make sure Upstate New York has the help it needs to revive and thrive.”“As New Yorkers return to air travel, we must ensure our airports are equipped to protect the health of both travelers and transportation workers,” said Senator Gillibrand. “Personnel and sanitation costs will be a critical part of keeping airports afloat and aiding our economic recovery. This federal funding will provide New York State’s local airports with the resources needed to increase safety standards and mitigate the spread of COVID-19.”Funding Recipients Listed Below: RegionAirportCountyFunding Central  Oswego County Airport  Oswego $13,000 Central Griffiss International Airport  Oneida $57,162  Western Buffalo Niagara International  Erie$6,992,645WesternNiagara Falls International AirportNiagara$1,456,206 CapitalSaratoga County AirportSaratoga$23,000 Hudson ValleySullivan County International AirportSullivan$13,000 Hudson ValleyWestchester County Airport Westchester$4,346,635 ###
                             Please be advised that due to the implementation of enhanced mail screening procedures, all mail sent to my state offices will experience a two to three week delay in delivery.  In the meantime, if you have an urgent matter, the best way to reach me is by phone at (202) 224-6542 or through any of my eight district offices."
