url,text
https://www.durbin.senate.gov/newsroom/press-releases/durbin-questions-illinois-judicial-nominees-in-senate-judiciary-committee-hearing,"WASHINGTON – During today’s Senate Judiciary Committee nominations hearing, U.S. Senate Majority Whip Dick Durbin (D-IL), Chair of the Senate Judiciary Committee, questioned John Z. Lee, nominated to be United States Circuit Judge for the Seventh Circuit, and Salvador Mendoza Jr., nominated to be United States Circuit Judge for the Ninth Circuit.  During the hearing, Durbin highlighted their extensive qualifications and asked them about their unique life experiences.  Judge Lee came to this country as an immigrant at the age of four.  Judge Mendoza’s parents immigrated to the United States from Mexico working as farm laborers, maids, and factory workers—and as a child, Judge Mendoza worked as a migrant farmworker. “I remember that [Judge Lee’s] immigrant story… Judge Mendoza, I’m sure you have a similar story to tell,” Durbin said.  “I could go through, with each of you, and recount what you’ve achieved as Judges… but the record speaks for itself.”The American Bar Association rated Judge Lee and Judge Mendoza unanimously “Well Qualified” to serve as Circuit Court judges.Video of Durbin’s questions to Judge Lee and Judge Mendoza in Committee is available here.Audio of Durbin’s questions to Judge Lee and Judge Mendoza in Committee is available here.Footage of Durbin’s questions to Judge Lee and Judge Mendoza in Committee is available here for TV Stations.Durbin also questioned Nancy L. Maldonado, nominated to be United States District Judge for the Northern District of Illinois, about her service to the people of Cook County and the State of Illinois in a variety of capacities.“Ms. Maldonado, I’m just amazed when I look at your background and find you clerking on the Northern District Court for two years and then your many years in private practice.  But then how many times you’ve been called to serve in a special capacity—Special Assistant State’s Attorney to Cook County to investigate fraud alleged by a whistleblower, appointment by the Illinois Attorney General to serve as a consent decree monitor in two cases, and also appointment by the Illinois AG to serve as a Special Assistant to investigate consumer fraud,” Durbin said.  “What lessons have you learned in those special capacities beyond the regular practice of law?”Ms. Maldonado responded by saying that those special capacities have enriched her professional life “tremendously,” and allowed her to work alongside government.  She also noted that she believes she was selected for these special capacities not only for her knowledge in those areas of law, but also for her temperament and reputation of being fair and even-keeled.Video of Durbin’s questions to Ms. Maldonado in Committee is available here.Audio of Durbin’s questions to Ms. Maldonado in Committee is available here.Footage of Durbin’s questions to Ms. Maldonado in Committee is available here for TV Stations.Today’s nominations hearing also included Stephen Henley Locher, nominated to be United States District Judge for the Southern District of Iowa, and Gregory Brian Williams, nominated to be United States District Judge for the District of Delaware. Durbin and U.S. Senator Tammy Duckworth (D-IL) have established nonpartisan screening committees to assist them in evaluating candidates for vacant federal district court, U.S. Attorney, and U.S. Marshal positions in Illinois.  The task of the screening committees is to review and vet candidates for the vacancies and advise the Senators regarding the candidates’ qualifications and fitness for the position.Bios of the Illinois nominees from the White House are included below:Judge John Z. Lee: Nominee for the United States Court of Appeals for the Seventh CircuitJudge John Z. Lee has served as a U.S. District Court Judge for the Northern District of Illinois since 2012. From 1999 to 2012, Judge Lee was an associate and then partner at Freeborn & Peters LLP in Chicago. From 1996 to 1999, Judge Lee was an associate at Grippo & Elden LLC, and from 1994 to 1996, he was an associate at Mayer Brown LLP. Mr. Lee served as a trial attorney in the Environmental and Natural Resources Division of the U.S. Department of Justice from 1992 to 1994.Judge Lee received his A.B., magna cum laude, from Harvard College in 1989, and his J.D. from Harvard Law School, cum laude, in 1992.Nancy L. Maldonado: Nominee for the United States District Court for the Northern District of IllinoisNancy L. Maldonado is a partner at Miner, Barnhill & Galland, P.C. in Chicago, Illinois. Ms. Maldonado joined the firm as an associate in 2003 and was elevated to partner in 2010. Ms. Maldonado previously served as a law clerk for Judge Rubén Castillo on the U.S. District Court for the Northern District of Illinois from 2001 to 2003.Ms. Maldonado received her J.D. from Columbia Law School in 2001, and her A.B., cum laude, from Harvard College in 1997.-30-"
https://www.durbin.senate.gov/newsroom/press-releases/durbin-delivers-opening-statement-during-latest-nominations-hearing-featuring-two-illinois-judicial-nominees,"WASHINGTON – U.S. Senate Majority Whip Dick Durbin (D-IL), Chair of the Senate Judiciary Committee, today delivered an opening statement at the Senate Judiciary Committee hearing on the nominations of John Z. Lee to be United States Circuit Judge for the Seventh Circuit, Salvador Mendoza Jr. to be United States Circuit Judge for the Ninth Circuit, Stephen Henley Locher to be United States District Judge for the Southern District of Iowa, Nancy L. Maldonado to be United States District Judge for the Northern District of Illinois, and Gregory Brian Williams to be United States District Judge for the District of Delaware.  During his opening statement, Durbin focused on the historic nature and professional experience of the two Illinois judicial nominees: Judge Lee to the Seventh Circuit and Ms. Maldonado to the Northern District of Illinois.Key quotes:“I have the honor this morning of introducing Judge John Lee, nominated to the Seventh Circuit.  Since 2012, he has been a U.S. District Court Judge on the Northern District [of Illinois].”“Judge Lee came to this country as an immigrant at the age of four, settling into a one-bedroom apartment with his family in the Albany Park neighborhood in Chicago… Judge Lee excelled in school.  He graduated magna cum laude from Harvard College and cum laude from Harvard Law School.”“In 2012, President Obama nominated Judge Lee to the Northern District of Illinois.  When he was confirmed—by voice vote, I underline—Judge Lee became the first Korean-American to serve as an Article III judge in Illinois.”“Since joining the bench, he has written hundreds of opinions, presided over 35 trials that went to verdict or judgment.  He sat by designation on the Seventh Circuit a number of times, writing several opinions for the majority.”“His nomination to the district court ten years ago was historic.  And he is poised again to make history as a nominee to the Seventh Circuit.  If confirmed, he will be the first Asian-American judge to serve on that court.”“It’s also my great pleasure to introduce Nancy Maldonado, nominated to the U.S. District Court for the Northern District of Illinois.  She was born in Skokie.  [Ms. Maldonado] earned her A.B. cum laude from Harvard College and her J.D. from Columbia Law School before returning to Illinois to clerk for my friend Judge Rubén Castillo on the Northern District.”“After clerking on the court for two years, she spent the last 19 years in private practice, specializing in plaintiff-side employment, civil rights, and fraud litigation.”“She has worked outside the courtroom to keep Illinoisans safe.  In 2019, she was appointed by Governor Pritzker and confirmed by the [Illinois] Senate to serve as a member of the Illinois State Police Merit Board, which runs the equitable merit process for the selection and promotion of officers for the Illinois State Police.”Video of Durbin’s opening statement is available here.Audio of Durbin’s opening statement is available here.Footage of Durbin’s opening statement is available here for TV Stations.Durbin and U.S. Senator Tammy Duckworth (D-IL) have established nonpartisan screening committees to assist them in evaluating candidates for vacant federal district court, U.S. Attorney, and U.S. Marshal positions in Illinois.  The task of the screening committees is to review and vet candidates for the vacancies and advise the Senators regarding the candidates’ qualifications and fitness for the position.Bios of the Illinois nominees from the White House are included below:Judge John Z. Lee: Nominee for the United States Court of Appeals for the Seventh CircuitJudge John Z. Lee has served as a U.S. District Court Judge for the Northern District of Illinois since 2012. From 1999 to 2012, Judge Lee was an associate and then partner at Freeborn & Peters LLP in Chicago. From 1996 to 1999, Judge Lee was an associate at Grippo & Elden LLC, and from 1994 to 1996, he was an associate at Mayer Brown LLP. Mr. Lee served as a trial attorney in the Environmental and Natural Resources Division of the U.S. Department of Justice from 1992 to 1994.Judge Lee received his A.B., magna cum laude, from Harvard College in 1989, and his J.D. from Harvard Law School, cum laude, in 1992.Nancy L. Maldonado: Nominee for the United States District Court for the Northern District of IllinoisNancy L. Maldonado is a partner at Miner, Barnhill & Galland, P.C. in Chicago, Illinois. Ms. Maldonado joined the firm as an associate in 2003 and was elevated to partner in 2010. Ms. Maldonado previously served as a law clerk for Judge Rubén Castillo on the U.S. District Court for the Northern District of Illinois from 2001 to 2003.Ms. Maldonado received her J.D. from Columbia Law School in 2001, and her A.B., cum laude, from Harvard College in 1997.-30-"
https://www.durbin.senate.gov/newsroom/press-releases/durbin-discusses-support-for-community-policing-funding-law-enforcement-officer-mental-health-resources-with-president-of-major-cities-chiefs-association,"WASHINGTON – U.S. Senate Majority Whip Dick Durbin (D-IL), Chair of the Senate Judiciary Committee, met virtually with Chief Jeri Williams, President of the Major Cities Chiefs Association (MCCA).  During their meeting, Durbin and Williams discussed the challenges of officer recruitment and retention, particularly with regards to mental health assistance.  Durbin and Williams also discussed the importance of confirming federal law enforcement positions to aid state and local officers.“The trauma that our law enforcement officers face while combatting violence in our communities is very real,” said Durbin.  “Violent crime must be addressed with an all-hands-on-deck approach. That is why, as Chair of the Senate Judiciary Committee, I intend to bring up bipartisan legislation in Committee during Police Week to support funding for community policing and law enforcement officer mental health resources.  I look forward to moving these important initiatives forward.”A photo of the meeting is available here.-30-"
https://www.durbin.senate.gov/newsroom/press-releases/durbin-meets-with-fermilab-director,"WASHINGTON – U.S. Senate Majority Whip Dick Durbin (D-IL) today met with Fermilab Director Lia Merminga to discuss basic science research and projects at Fermilab like the Long Baseline Neutrino Facility/Deep Underground Neutrino Experiment (LBNF/DUNE).  Durbin secured $189 million for LBNF/DUNE in the Fiscal Year 2022 (FY22) omnibus appropriations bill Congress passed in March.“National labs, like Illinois’ own Fermilab, have pushed the boundaries of scientific discovery with unmatched dedication to their research missions,” said Durbin. “During our meeting, I reiterated my commitment to securing federal funds for the groundbreaking research being accomplished at Fermilab.”LBNF/DUNE is an international flagship experiment to unlock the mysteries of neutrinos.  LBNF/DUNE will pursue three science goals: find out whether neutrinos could be the reason the universe is made of matter; look for subatomic phenomena that could help realize Einstein’s dream of the unification of forces; and watch for neutrinos emerging from an exploding star.A photo of the meeting is available here.-30-"
https://www.durbin.senate.gov/newsroom/press-releases/durbin-duckworth-meet-with-united-counties-council-of-illinois,"WASHINGTON – U.S. Senate Majority Whip Dick Durbin (D-IL) and U.S. Senator Tammy Duckworth (D-IL) today met with members of the United Counties Council of Illinois to discuss how the American Rescue Plan is impacting communities in Illinois.  During their conversation, the Senators received an update on the $14 billion allocated to Illinois through the State and Local Fiscal Recovery (SLRF) Program to aid counties and municipalities in covering pandemic costs, replacing lost revenue, and investing in local infrastructure.  Durbin and Duckworth also discussed the historic importance of the Infrastructure Investment and Jobs Act (IIJA), which will funnel $17 billion in direct and guaranteed funding into Illinois to continue funding investments made through the state’s REBUILD Illinois legislation.Durbin and Duckworth went on to emphasize their priority of improving broadband equity across the state.  IIJA included $65 billion for broadband deployment, allocating at least $100 million to Illinois’ efforts to expand access to high-speed internet.“It’s no secret that our municipalities and counties were hit hard during the height of the COVID-19 pandemic. We know the best way to rebuild our communities is through historic investment, which is why I was a strong advocate of the American Rescue Plan and the Infrastructure Investment and Jobs Act. With this federal funding in hand, Illinois can begin long-term projects that will fortify our roads and expand broadband access in every corner of the state,” said Durbin.“We know our local governments were hit hard by the economic impacts of COVID-19,” Duckworth said. “But with the American Rescue Plan—thanks to Democrats and President Biden—we were able to provide necessary resources for municipalities in every corner of our state. I was proud to support the American Rescue Plan, and I’m going to keep working for policies that help our small businesses, support our working families and allow our economy to thrive.”Photos of the meeting are available here.-30- "
https://www.durbin.senate.gov/newsroom/press-releases/durbin-meets-with-i-am-als-founders,"WASHINGTON – U.S. Senate Majority Whip Dick Durbin (D-IL) today met virtually with ‘I Am ALS’ founders and Illinois constituents Brian Wallach and Sandra Abrevaya to discuss increased federal funding for ALS research and the latest developments regarding the National Institutes of Health (NIH) and U.S. Food and Drug Administration’s (FDA) implementation of the Accelerating Access to Critical Therapies for ALS Act (ACT for ALS). ACT for ALS directs the NIH and FDA to make grants to clinical trial sites, enabling expanded access to ALS treatments. As a member of the Senate ALS Caucus, Durbin fought to ensure the Fiscal Year 2022 omnibus funding included $25 million to get the program up and running. Durbin also spoke in support of increasing funding that boosts defense medical research for ALS.“I am grateful for Brian and Sandra’s continued advocacy at ‘I Am ALS’ and for their tireless work to expand treatments and support the individuals and families battling ALS,” said Durbin. “In our conversation today, we discussed the importance of ALS research funding—as well as the need for collaborative work between NIH, FDA, and the patient community—in order to help advance our knowledge and bring us closer to finding a cure.”A photo of the meeting is available here.-30-"
https://www.durbin.senate.gov/newsroom/press-releases/durbin-urges-colleagues-to-support-the-womens-health-protection-act,"WASHINGTON – U.S. Senate Majority Whip Dick Durbin (D-IL), Chair of the Senate Judiciary Committee, today spoke on the Senate floor on the future of Roe v. Wade following the leak of the Supreme Court’s draft majority opinion in Dobbs v. Jackson Women’s Health Organization. “Last week, Americans woke up to the news that was perhaps not unexpected but still stunning.  It appears that in a matter of weeks, we may soon live in a country where women have fewer constitutional rights than their parents or grandparents.  In one bold move, the ultra-conservative, activist majority on the Supreme Court appears poised to erase the constitutional right to choose whether or not to carry a pregnancy to term,” Durbin said.  “I want to be clear, the leak of the majority draft opinion in Dobbs v. Jackson Women’s Health Organization is an unprecedented breach of the Court’s confidential deliberations.  It may harm the trust the Justices have in one another as well as the public’s trust in the Court.  Still, one must wonder, why is it that our Republican colleagues have been focused so exclusively on the leak of the draft opinion rather than the substance of the opinion itself?”Durbin continued, “Sadly, many Republicans are desperately trying to deflect from this ruling and what it means for every single American.  If the legal reasoning in the Court’s draft opinion becomes final, that decision in Dobbs will end a half-century guarantee that the right to abortion is protected in our Constitution… In the past, when the Court has taken the serious step of overturning settled law, it has done so to expand freedom, expand opportunity, not eliminate it.  What the activist, anti-choice majority on this Court would do is unprecedented, radical, and dangerous.”During his speech, Durbin also encouraged his colleagues on both sides of the aisle to support the Women’s Health Protection Act, which would codify the right to provide and obtain an abortion free from medically unnecessary restrictions.  The Senate will vote on the motion to proceed to this legislation tomorrow.“That’s why we must take action to protect women’s reproductive rights.  Tomorrow the Senate will vote on the Women’s Health Protection Act.  This bill will codify the right to provide [and] obtain an abortion free from medically unnecessary restrictions.  The American people deserve to know where their Senators stand,” Durbin said.  “I will not stop fighting for the right of every American, especially the women of America, to have these rights as established for over 50 years.” Durbin concluded, “For years, the Republicans have claimed they are a party for families, the party of family values, yet they spent decades ignoring the needs of working families.  Republicans are willing to force women to carry unwanted or unexpected or even dangerous pregnancies to term, but they are not willing to help them raise the children.  There are aspects of the voting pattern in the Senate that make it clear that when it comes to helping families with basics such as tax credits for children, making sure that families have paid medical leave for their newborns or other family members, all of these things are family-friendly and family values.  Unfortunately they’re not supported by many, if any, Republicans.  That would be a demonstration that they truly care for families.”Video of Durbin’s remarks on the Senate floor is available here.Audio of Durbin’s remarks on the Senate floor is available here.Footage of Durbin’s remarks on the Senate floor is available here for TV Stations.-30-"
https://www.durbin.senate.gov/newsroom/press-releases/durbin-questions-secretary-of-the-army-and-chief-of-staff-of-the-army-at-senate-appropriations-committee-hearing,"WASHINGTON – U.S. Senate Majority Whip Dick Durbin (D-IL), a member of the Senate Appropriations Committee, today questioned Secretary of the Army Christine Wormuth and Chief of Staff of the Army General James McConville at a Senate Appropriations Subcommittee on Defense hearing about the Army’s Fiscal Year 2023 (FY23) budget request.  Durbin began his questioning asking about the importance of keeping our military nonpartisan.“There’s always been an effort to keep a bright line between our military and partisan political activity…is this a problem and if so, what are you doing about it?” Durbin asked.Wormuth answered by stating she believes it is absolutely essential to keep politics out of the military. Durbin then asked about the organic industrial base, specifically the role of Rock Island Arsenal in Illinois.“I want to make a plug about the Rock Island Arsenal and the Depots and Arsenals across the United States that have risen to the challenge time and again. I hope you’ll make them part of your thinking about future demands for developing high quality materials and equipment,” Durbin said.Wormuth confirmed they are factoring the Army’s Arsenals into their organic industrial base plan and she plans to visit the Rock Island Arsenal in the future.Durbin, Co-Chair of the Senate Ukraine Caucus, asked about Ukraine in light of Russia’s unprovoked and unjustified war. He stated that although early reports predicted Kyiv would fall quickly, it is still in Ukrainian hands.“What lessons have you learned as a professional observing this in terms of the efforts by the Ukrainians and the Russian capacity to fight a war?” Durbin asked.  General McConville credited Ukraine’s success in part to Ukrainian President Volodymyr Zelensky’s leadership and the will of the Ukrainian people to stay and fight.Durbin concluded by asking about the United States’ capacity to provide Ukraine with the tools they need.“Are we being pushed to a limit we have to reconsider in aspects of our own defense and how much is allocated?” Durbin asked.Wormuth confirmed that when providing aid to Ukraine, the Army factors in the U.S.’s needs and continued assistance to Ukraine remains within our limits.  President Biden authorized another $150 million in military assistance for Ukraine for artillery rounds and radar systems on Friday and requested a $33 billion supplemental aid package for Ukraine. During a speech on the Senate floor last week, Durbin urged Congress to pass this supplemental aid package for Ukraine. The additional aid will give the people of Ukraine the weapons to repel Russia’s war as well as bolster our allies and partners in the region such as the Baltics, Poland, and Moldova.Video of Durbin’s remarks from the hearing is available here.Audio of Durbin’s remarks from the hearing is available here.Footage of Durbin’s remarks from the hearing is available here for TV Stations. -30-"
https://www.durbin.senate.gov/newsroom/press-releases/durbin-duckworth-announce-48-million-for-runway-improvements-at-quincy-regional-airport,"WASHINGTON – U.S. Senators Dick Durbin (D-IL) and Tammy Duckworth (D-IL) today announced $4.85 million in federal funding awarded to Quincy Regional Airport from the Federal Aviation Administration’s (FAA) Airport Improvement Program (AIP) to support the airport’s runway reconstruction project. “Today’s funding will help improve service, safety, and efficiency at Quincy Regional Airport, which is a critical economic engine and transportation link for Western Illinois,” Durbin said. “Senator Duckworth and I will continue working to ensure our state’s regional airports have the federal resources needed to succeed.”“The Quincy Regional Airport is an important economic driver for the region, and ensuring it receives federal support to improve safety for airport workers and travelers is critical,” Duckworth said. “I’m proud to join Senator Durbin in announcing this infusion of federal support, and I will continue to advocate for resources that spur economic activity and keep our state’s aviation systems safe and updated.”-30-"
