url,text
https://www.markey.senate.gov/news/press-releases/markey-joins-pressley-moulton-in-calling-on-baker-to-declare-monkeypox-outbreak-a-public-health-emergency,"Massachusetts has one of the nation’s highest counts of confirmed cases “By declaring a public health emergency, you will have greater flexibility and more tools to enact a whole-of-government response.”Washington (August 11, 2022) – Senator Edward J. Markey (D-Mass.) joined colleagues from the Massachusetts Congressional Delegation led by Representatives Ayanna Pressley (MA-07) and Seth Moulton (MA-06) in urging Governor Charlie Baker to declare the monkeypox virus (MPV) outbreak a public health emergency in Massachusetts.  Massachusetts currently has one of the nation’s highest counts of confirmed cases.“By declaring a public health emergency, you will have greater flexibility and more tools to enact a whole-of-government response,” the lawmakers wrote in a letter. “There are more than 26,000 vaccines allocated to the Commonwealth, and it is important that you act quickly to prevent the MPV outbreak from escalating, including augmenting health care staff, expediting testing and vaccinations, and informing people on how to reduce their risk of infection.”According to the Centers for Disease Control and Prevention, there are 26,864 confirmed cases of MPV across the globe and more than 7,100 confirmed cases in the United States. Public health experts, including Dr. Anthony Fauci of the National Institute of Allergy and Infectious Diseases, caution that these numbers are very likely an undercount and only represent the tip of the iceberg.The lawmakers urged the governor to work in collaboration with experts and local leaders to ensure a holistic and timely statewide response that will address the needs of all community members.“As a Commonwealth, we need to develop and execute a statewide plan, in partnership with experts and local leaders, that is comprehensive, equitable, and transparent,” the lawmakers continued. “The response to the coronavirus pandemic proved that delayed decision making will only exacerbate the outbreak and threaten the health of the public.”In addition to Senator Markey, the letter was also signed by Senator Elizabeth Warren (D-MA), Assistant Speaker of the House Katherine Clark (MA-05), and Representatives James P. McGovern (MA-02), Lori Trahan (MA-03), Jake Auchincloss (MA-04), Stephen F. Lynch (MA-08), Richard E. Neal (MA-01) and William R. Keating (MA-09).Read a copy of the letter HERE.###"
https://www.markey.senate.gov/news/press-releases/senator-markey-celebrates-ftcs-announcement-on-online-consumer-privacy-protections,"Washington (August 11, 2022) – Senator Edward J. Markey (D-Mass.) a member of the Commerce, Science and Transportation Committee, released the following statement after the Federal Trade Commission (FTC) announced an advanced notice of proposed rulemaking to bolster online consumer privacy protections:“As a longtime advocate for comprehensive privacy protections, I wholeheartedly support the FTC’s efforts to explore strong online privacy rules. I thank Chair Khan for her tireless work to protect consumers and look forward to working with her and the rest of the Commission on this proceeding. While a strong update to online privacy protections is needed, it is no substitute for Congressional action. We have reached a crisis point when it comes to children and teen’s well-being online. I applaud Commissioners Slaughter and Bedoya for highlighting children and teens as a vulnerable population online, since lax online data practices can pose a heightened threat to young people.“Protecting kids online has long been a top priority of mine, and I am committed to modernizing our laws to end the pernicious and invasive data collection practices that are targeting and harming our children and teens. It’s time for Congress to meet the moment and act with the urgency that these issues demand by passing my bipartisan legislation, the Children and Teens’ Online Privacy Protection Act.”The Children and Teens' Online Privacy Protection Act, co-sponsored by Senators Bill Cassidy (R-La.) and Commerce Committee members Richard Blumenthal (D-Conn.) and Cynthia Lummis (R-Wyo.), would prohibit internet companies from collecting personal information from anyone 13- to 16-years old without the user’s consent; ban targeted marketing to children; create an online “Eraser Button” by requiring companies to permit users to eliminate personal information from a child or teen; implement a “Digital Marketing Bill of Rights for Minors” that limits the collection of personal information from young users; and establish a first-of-its-kind Youth Privacy and Marketing Division at the Federal Trade Commission (FTC), which will be responsible for addressing the privacy of children and minors, as well as marketing directed at children and minors.In September 2021, Senator Markey joined Senator Blumenthal in sending a letter to the FTC, calling upon the Commission to advance rulemaking on consumer privacy, bolster civil rights, and establish guardrails on the collection and use of consumer’s personal data.In June 2022, Senator Markey reignited the call for privacy rulemaking in a letter he led to the FTC, urging the Commission to use the full scope of its authority to protect marginalized communities online. In the letter, Senator Markey and his colleagues highlighted how communities of color are particularly vulnerable to discriminatory and harmful online data practices, and urged the FTC to use its rulemaking authority to stop these practices. In the same letter, Senator Markey called on the FTC to use its full authority to combat invasive and discriminatory biometric surveillance tools.###"
https://www.markey.senate.gov/news/press-releases/markey-joins-merkley-colleagues-in-continued-push-for-robust-federal-response-to-monkeypox-public-health-emergency,"“As the country continues to navigate the [monkeypox public health emergency], the United States public health system remains on the frontlines in identifying MPV cases, informing Americans about access to vaccines and therapeutics, and connecting our constituents to necessary medical care and resources.” Washington (August 10, 2022) –  Senator Edward J. Markey (D-Mass.) joined a group of his colleagues led by Senator Jeff Merkley (D-Ore.) in sending a letter to Senate Majority Leader Charles Schumer (D-N.Y.) and Minority Leader Mitch McConnell (R-Ky.) urging the Senators to include critical funding to address the monkeypox (MPV)/orthopoxvirus Public Health Emergency (PHE) in any forthcoming legislative package in the 117th Congress. “As of August 9, 2022, there have been over 9,492 confirmed MPV/orthopoxvirus cases in the United States from when the first case in the current outbreak was identified on May 18, 2022,” wrote the Senators. “The current outbreak in the United States is the largest in the world by case count in the current global outbreak—which has been declared a Public Health Emergency of International Concern by the World Health Organization—and the largest in the nation’s history.” In their letter, the Senators spotlight that the United States public health system remains on the frontlines in identifying MPV cases, informing Americans about access to vaccines and therapeutics, and connecting constituents to necessary medical care and resources. Yet this system continues to be strained by the COVID-19 pandemic and underfunded. “MPV testing efforts are currently encountering processing and collection barriers that have led to underreporting of cases and poor data to aid the federal government in directing necessary resources in an appropriate manner,” they continued. “Additionally, as both a prophylaxis and treatment, acquiring and administering vaccines swiftly is crucial to stemming the spread of MPV and protecting all communities across the United States. Finally, clinics and providers are facing additional barriers in clinical services supplies, education for providers to properly identify MPV, vaccines, testing supplies, contact tracing, and community outreach to bolster our public health response to MPV, and ensure that accurate and adequate information is reaching our constituents.” This letter comes less than a month after Merkley led 22 colleagues on a separate letter sounding the alarm on MPV vaccine access inequities.  Senators Jack Reed (D-R.I.), Tammy Duckworth (D-Ill.), Michael Bennet (D-Colo.), Cory Booker (D-N.J.), Kirsten Gillibrand (D-N.Y.), Chris Van Hollen (D-Md.), Richard Blumenthal (D-Conn.), Elizabeth Warren (D-Mass.), Tammy Baldwin (D-Wis.), Sheldon Whitehouse (D-R.I.), Bernie Sanders (I-Vt.), and Amy Klobuchar (D-Minn.) also joined the letter led by Senator Merkley. In reaction to the Senators’ letter, David C. Harvey, Executive Director of the National Coalition of STD Directors, said: “The nation’s sexual health clinics have been managing frontline testing, treatment, and vaccination for monkeypox without adequate resources, staffing, or supplies, blunting the impact of federal efforts to address the outbreak. The success of the national response hinges on whether these clinics get the resources they need to help patients access expanded testing, treatment, and vaccines.”  Full text of the letter can be found here and follows below: Dear Majority Leader Schumer and Minority Leader McConnell: We write today to express concern over the rising number of monkeypox virus (hereon referred to as MPV) cases in the United States, and to urge you to include funding to address this Public Health Emergency (PHE) in any forthcoming legislative package in the 117th Congress. As of August 9, 2022, there have been over 9,492 confirmed MPV/orthopoxvirus cases in the United States from when the first case in the current outbreak was identified on May 18, 2022. The current outbreak in the United States is the largest in the world by case count in the current global outbreak—which has been declared a Public Health Emergency of International Concern by the World Health Organization—and the largest in the nation’s history. As such, the outbreak was declared a national PHE by the Department of Health and Human Services on August 4, 2022. Nevertheless, we recognize that many experts have stated that the current number of cases is likely an undercount due to a gap in provider knowledge, limited access to information and testing, as well as social stigma that may increase reluctance to seek medical care. As the country continues to navigate the MPV PHE, the United States public health system remains on the frontlines in identifying MPV cases, informing Americans about access to vaccines and therapeutics, and connecting our constituents to necessary medical care and resources. A recent survey conducted by the National Coalition of STD Directors of more than 100 clinics nationwide—including Federally Qualified Health Centers (FQHCs), reproductive and sexual health clinics, and primary care providers—demonstrates that our country’s health professionals have the willingness and expertise to play a central role in the MPV response, and are already being called upon to do so. However, these care providers are in dire need of additional resources to scale an appropriate response and prevent the spread of the virus.MPV testing efforts are currently encountering processing and collection barriers that have led to underreporting of cases and poor data to aid the federal government in directing necessary resources in an appropriate manner. Additionally, as both a prophylaxis and treatment, acquiring and administering vaccines swiftly is crucial to stemming the spread of MPV and protecting all communities across the United States. Finally, clinics and providers are facing additional barriers in clinical services supplies, education for providers to properly identify MPV, vaccines, testing supplies, contact tracing, and community outreach to bolster our public health response to MPV, and ensure that accurate and adequate information is reaching our constituents. We appreciate the work that Senators Leahy, Murray, and Coons have undertaken to develop and introduce an emergency supplemental funding bill to address the ongoing COVID-19 pandemic and other emerging disease that pose a significant threat to public health, and we ask you to include additional funding in any forthcoming legislative package to address the MPV PHE in our communities. Thank you for your attention and partnership in addressing this public health concern. ###"
https://www.markey.senate.gov/news/press-releases/senator-markey-statement-on-senates-failure-to-invoke-cloture-on-womens-health-protection-act,"Washington (May 11, 2022) - Senator Edward J. Markey (D-Mass.), Senate sponsor of the Judiciary Act of 2021, released the following statement after the Senate failed to invoke cloture on the motion to proceed to the Women’s Health Protection Act in order to begin debate. “Today, the Senate failed to protect the rights of millions of Americans and respect the will of two-thirds of our constituents across the country who believe Roe v. Wade should remain the law of the land, because a radical Republican minority once again succeeded in wedging their extremist views into our broken political machinery. As the Supreme Court stands poised to overturn Roe and cast aside decades of precedent, the Women’s Health Protection Act is all that’s standing between the America we’ve known for decades – in which safe and legal abortions are a right – and one that plunges millions of people back in time into despair, pain, poverty, and forced parenthood.  “We have come to this crossroads because our system is fundamentally broken. Our anti-majoritarian and anti-democratic national electoral system allowed two Presidents, each of whom lost the popular vote, to nominate five of our nine sitting U.S. Supreme Court justices. Corrupted congressional procedure allowed those justices to be confirmed by Senators representing a minority of our nation’s population. And now, the arcane filibuster has prevented the majority of Senators who stand in favor of upholding basic rights to privacy, self-determination, and abortion care from acting on the will of the American people.   “There is no other recourse. We must abolish the filibuster in order to pass the Women’s Health Protection Act, and we must expand the Supreme Court in order to reclaim the stolen seats, restore balance, and begin to repair the faith of the American people in the Court. Expanding the Court is constitutional. Congress has done it before, and Congress must do it again.” ###"
https://www.markey.senate.gov/news/press-releases/senator-markey-statement-on-senate-confirmation-of-alvaro-bedoya-as-ftc-commissioner,"Washington (May 11, 2022) – Senator Edward J. Markey (D-Mass.), a member of the Commerce, Science, and Transportation Committee, released the following statement after the U.S. Senate voted to confirm Alvaro Bedoya’s nomination to serve as Commissioner to the Federal Trade Commission (FTC).  “The Federal Trade Commission plays a critical role in protecting American consumers,” said Senator Markey. “I am proud to have voted to confirm Alvaro Bedoya to help lead this effort and continue the Commission’s essential work. Mr. Bedoya has a deep commitment to the public interest and he will bring a sterling background of service and scholarship to this position. Americans face increasing threats in the digital ecosystem, and the FTC must be laser-focused on protecting the public from manipulation and privacy invasions online. With a full slate of commissioners, the FTC must now act swiftly and boldly to use the full scope of its authority to protect consumers, particularly in communities of color and other marginalized communities, who disproportionately experience harm both online and offline. Mr. Bedoya is ready to take on those challenges, and I look forward to working with him and the entire Commission.”   ###"
https://www.markey.senate.gov/news/press-releases/icymi-senator-markey-secures-environmental-financial-protections-for-pilgrim-nuclear-power-plant-at-congressional-hearing-on-nuclear-plant-decommissioning,"WATCH: Senator Markey hosts field hearing in Plymouth, Mass. to discuss nuclear safety and security issues and state, local, and community stakeholder engagement   Boston (May 6, 2022) – Senator Edward J. Markey (D-Mass.), Chair of the Environment and Public Works (EPW) Subcommittee on Clean Air, Climate, and Nuclear Safety, today hosted a subcommittee field hearing in Plymouth, Massachusetts with Congressman William R. Keating (MA-09), titled Issues Facing Communities with Decommissioning Nuclear Plants. During the hearing, Senator Markey secured commitments from Holtec, the company charged with decommissioning the Pilgrim Nuclear Power Plant, that it would not discharge any radioactive, contaminated water into Cape Cod Bay from the plant without the consent of stakeholders. He also secured a commitment from Holtec that it would work with an independent body with marine experience to test the water, that it would provide a financial backstop to ensure full decommission and clean-up of the plant site, and it would meet with union representatives from the Laborers, Ironworkers, Carpenters, IBEW, and Operating Engineers regarding an ongoing labor dispute.  “We will hold Holtec accountable for these commitments to the communities that surround Pilgrim, and we will work to ensure the NRC upholds its responsibility to be a watchdog on the decommissioning process,” said Senator Markey. “Over the years, communities with decommissioning nuclear power plants have repeatedly called on the Commission to be a good partner and for nuclear companies to be good neighbors. Today’s hearing is a notice to both that we will not allow these responsibilities to go unmet any longer.”  “Today’s hearing cemented what we already knew: that the NRC has given too much leeway to licensees. The government is entrusted with the regulation of nuclear energy as well as the environmental impacts that energy has on our communities. It’s clear, however, that the community has been left out of this process; yet they are the ones that will feel the impacts for generations from this plant being here and the ones who are paying for decommissioning. The NRC confirmed today that trucking away the waste is a viable alternative to dumping water in Cape Cod Bay. Frankly, it is not an alternative, but the only proper course of action,” said Congressman Keating. Testifying at the hearing were: A copy of witness testimonies can be found HERE. Senator Markey and Congressman Keating have worked together to ensure that the NRC and Holtec prioritize safety and public participation throughout Pilgrim’s decommissioning process. This past January, along with Senator Elizabeth Warren (D-Mass.) and Congressman Seth Moulton (MA-06), the lawmakers wrote to Holtec Decommissioning International expressing opposition to the proposed discharge of radioactive water from Pilgrim Nuclear Power Station into Cape Cod Bay. ### "
https://www.markey.senate.gov/news/press-releases/senator-markey-statement-commemorating-one-million-covid-19-deaths-in-the-united-states,"Washington (May 6, 2022) – Senator Edward J. Markey (D-Mass.) released the following statement upon the United States reaching the tragic toll of one million lives lost to COVID-19. “There are no words to fully capture the loss of one million friends, loved ones, partners, family members, and those we did not know to COVID-19,” said Senator Markey. “How do we grieve the uncelebrated anniversaries, birthdays, holidays, and other cherished moments that make life the tapestry of shared experience and memories? Tragically, this pandemic is not yet over, not for the United States nor for the globe. We must acknowledge and continue to address the disproportionate impact this pandemic is having on Black, Brown, Indigenous, immigrant, and low-income communities. Our goal must be to confront the reckoning of injustice – racial, economic, educational, health – that this pandemic has made undeniable. And we must treat the lasting effects of long-COVID for those living with it, including with research, disability benefits, and quality health care. For the elderly and immunocompromised, the COVID-19 threat remains a daily specter, and we must center those communities in our response, planning, and messaging to ensure the death toll doesn’t match the rates of the past two years. I will fight to pass legislation that supports those most impacted by this pandemic.” Since the start of the pandemic, Senator Markey has been a leader in calling for legislative action to fight the coronavirus, including on research, data collection and equity, mask mandates, financial relief for small businesses, and federal government oversight. In August 2021, Senators Markey, Elizabeth Warren (D-Mass.) and Martin Heinrich (D-N.M.) introduced a resolution to memorialize those lost to the COVID–19 virus and recognize the suffering of COVID–19 survivors. This resolution would designate the first Monday in March as “COVID–19 Victims and Survivors Memorial Day.” ###"
