url,text
https://www.markey.senate.gov/news/press-releases/markey-joins-menendez-risch-and-colleagues-in-unveiling-resolution-honoring-former-secretary-of-state-madeleine-albright,"WASHINGTON – U.S. Senator Edward Markey (D-Mass.) joined Senators Bob Menendez (D-N.J.) and Jim Risch (R-Idaho), Chairman and Ranking Member of the Senate Foreign Relations Committee, today we're joined by 15 of their Committee colleagues in introducing a resolution to celebrate the life, achievements, and legacy of former Secretary of State Madeleine K. Albright. In addition to commending Secretary Albright’s patriotism and public service in the pursuit of more peaceful, prosperous, and cooperative world order, the bipartisan resolution extends the Senate’s sincere condolences and sympathies to Secretary Albright’s family and friends in the wake of her passing. “With this bipartisan resolution, we honor Secretary Albright’s extraordinary contributions to our global community and her unparalleled dedication to serving others both as the first woman Secretary of State and throughout her tenure in public service,” Chairman Menendez said. “As a child, she fled fascism as a refugee, later becoming a leading voice for democracy, human rights, and the rule of law. As in her life, Secretary Albright’s legacy will continue to shape American statecraft and to inspire foreign policy leaders and public servants for generations to come. She was a dear friend and mentor to me and to many, and she will be deeply missed.” “Madeleine Albright, a giant in the field of foreign policy, was a fierce defender of democracy and internationally-recognized human rights across the globe,” said Ranking Member Risch. “This resolution honors the indispensable work she did on behalf of the United States and extends sincere condolences to Secretary Albright’s family and loved ones.”  Joining Chairman Menendez and Ranking Member Risch in introducing the resolution were Senators Brian Schatz (D-Hawaii), Dan Sullivan (R-Alaska), Chris Coons (D-Del.), Mitt Romney (R-Utah), Cory Booker (D-N.J.), Lindsey Graham (R-S.C.), Ed Markey (D-Mass.), Ted Cruz (R-Texas), Tim Kaine (D-Va.), Lisa Murkowski (R-Alaska), Jeanne Shaheen (D-N.H.), Joni Ernst (R-Iowa), Chris Van Hollen (D-Md.), Ben Cardin (D-Md.), Jeff Merkley (D-Ore.), and Chris Murphy (D-Conn.).  “Madeleine Albright embodied the ideals of America. She was a constant light in the struggle between freedom and oppression, relentlessly advocating for people to have rights she knew didn’t exist under authoritarian regimes. She broke the highest glass ceiling in her field, then spent the rest of her life fighting for opportunities for women. We’ll remember her as a diplomat and a trail blazer,” said Senator Schatz. “Secretary Albright was a friend, a dedicated public servant, and a true champion for democracy around the globe,” said Sen. Sullivan. “I was honored to work with her in our respective roles as Chairs of the International Republican Institute and the National Democratic Institute. Secretary Albright will be greatly missed, but her life and legacy—which began when she and her family fled Soviet communism as a young girl, and led her to the highest branches of government—will help ensure the light of freedom and liberty continues shining brightly for many years to come.” “Madeleine Albright will be remembered as a giant of American diplomacy,” said Senator Coons. “I had the blessing of knowing Secretary Albright’s humor, brilliance, talent, and remarkable insights into world affairs over many years, and I am pleased the Senate has taken a moment today to honor her immense contributions to our country and to our world. As a stateswoman and a fierce advocate for democracy and human rights, Madeleine Albright truly made a lifetime of difference.” “A refugee who went on to become the first woman to serve as U.S. Secretary of State, Madeleine Albright’s life story is one of resoluteness and a reflection of the bright promises of democracy,” said Senator Romney. “Her service to our country and mark on U.S. foreign policy will be felt for generations to come.” “Madeleine Albright was a Virginian, a tireless champion for democracy, and a dear friend. She represented the very best of America—an immigrant from Czechoslovakia who rose to the highest position in American diplomacy, paving the way for women around the world,” said Senator Kaine. “I’m glad the Senate passed a resolution today in her honor. I will miss her wise counsel.” “Madeleine Albright came to the United States as a child refugee from war-torn Europe, fleeing Nazi and Soviet persecution. She grew up to become the first female Secretary of State – our nation’s top diplomat – breaking down barriers for generations of women to follow in her footsteps and stand on her shoulders. I’m proud to be one of those women and I’m honored to join members of the Senate to honor Secretary Albright for her service to our nation and for forging a path in government service that created space and leadership for women,” said Senator Shaheen. “As we mourn her loss, we don’t look back, but forward, on the opportunities she created for women around the world to realize their full potential. I urge Senate leadership to swiftly pass this resolution.” “Secretary Madeleine Albright was a trailblazer, a leader, a seasoned diplomat, and a champion for all humankind. After arriving in the United States as a refugee, she always fought to give a voice to the voiceless. And she was a force to be reckoned with,” said Senator Van Hollen. “Her legacy will never be forgotten. This resolution is a fitting way to highlight her courage and leadership which will continue to serve as an example for generations to come.” “The United States and the free world lost a giant with the passing of former Secretary of State Madeleine Albright,” said Senator Cardin. “She was a champion for democratic values and institutions, as well as diplomat extraordinaire, best-selling author, long-time leader of the National Democratic Institute, trailblazing Ambassador to the United Nations and glass-ceiling breaking Secretary of State. Secretary Albright also was the mother of three remarkably successful daughters and a mentor and friend to countless other women. Her contributions to strengthening American diplomacy and standing up for democracy cannot be overstated. She was an incredible leader and a presence the world will not soon forget.” “Madeleine Albright was an accomplished diplomat, human rights champion, and trailblazer,” Senator Merkley said. “As the first woman to hold the position of Secretary of State, she broke barriers and has left a long lasting legacy of effective global diplomacy which will continue for years to come and serve as a model for future generations of diplomats.”   Find a copy of the resolution HERE.                                                                          ###"
https://www.markey.senate.gov/news/press-releases/senator-markey-praises-senate-passage-of-legislation-to-ban-russian-oil,"Introduced in March, Senator Markey’s “SPIGOT Act” would prohibit all imports of Russian crude oil and petroleum products into the United States Washington (April 7, 2022) – Senator Edward J. Markey (D-Mass.), a member of the Senate Foreign Relations Committee, today voted to end imports of Russian oil to the United States. On March 1, Senator Markey introduced the Severing Putin’s Immense Gains from Oil Transfers (SPIGOT) Act, legislation to prohibit the importation of Russian oil and petroleum products into the United States and to impose targeted sanctions on corrupt Russian individuals found to have committed human rights violations. In March, May, June, and August of 2021, the Russian Federation became the second-largest exporter of crude oil and petroleum products to the United States. “Ending Russian oil imports to the United States is our moral, economic, and global security responsibility,” said Senator Markey. “Vladimir Putin has been using those revenues from oil sales to crush dissent at home, fund war against Ukraine and commit war crimes, and it’s time for us to permanently shut off that deadly pipeline. The only way we will end the global conflict and corruption caused and funded by fossil fuels is to end our oil addiction and aggressively transition to clean energy. Investing in wind, solar, electric vehicles, battery storage, electric appliances, and energy efficiency are our pathway to a more prosperous and peaceful future.”###"
https://www.markey.senate.gov/news/press-releases/following-epa-announcement-of-asbestos-ban-senator-markey-calls-for-more-comprehensive-action,"Washington (April 5, 2022) – Senator Edward J. Markey (D-Mass.), a member of the Environment and Public Works Committee, released the following statement after the Environmental Protection Agency (EPA) announced plans to ban one form of asbestos. Asbestos is a known human carcinogen and exposure can cause mesothelioma, lung, gastrointestinal, laryngeal, and ovarian cancers. Between the 1930s and 1970s, asbestos was widely used in consumer products and as an insulator, including use in schools where millions of children spend many hours each day. “I have long fought to ban this harmful material that kills tens of thousands of Americans every year,” said Senator Markey. “While I’m glad to see the EPA take a strong step forward to eliminate exposure to this major form of asbestos, there remain five types of asbestos that can still be imported in consumer products. We must take a more comprehensive approach to protect Americans from all forms of these toxic chemicals.”  Asbestos production was halted in 2002 in the United States, but it is still imported to produce chemicals used in a wide range of items. EPA’s proposed rule would prohibit the use, manufacture, and import of chrysolite asbestos, known as “white asbestos,” which is used in home building materials and automotive parts. Other forms of asbestos would still be allowed to be imported under the proposed rule.In 2015, Senator Markey released the report “Failing the Grade: Asbestos in America’s Schools” that revealed the extent of asbestos hazards in schools and the inefficiencies in the monitoring, investigation, and remediation of asbestos hazards. ###"
https://www.markey.senate.gov/news/press-releases/icymi-senator-markey-judge-jacksons-singular-perspective-and-voice-are-sorely-needed," WATCH: Markey delivers remarks on Senate floor today in support of Judge Jackson  Washington (April 5, 2022) – Senator Edward J. Markey (D-Mass.) delivered remarks on the U.S. Senate floor today in strong support of the nomination of Judge Ketanji Brown Jackson to fill the seat of retiring Justice Stephen Breyer on the United States Supreme Court.  When confirmed, Judge Jackson would become the first Black female justice to serve on the nation’s highest court, and the first-ever public defender. Senator Markeymet with Judge Jackson on March 24. In his remarks today, Senator Markey referred to the historic nomination of Judge Jackson as a “long overdue step toward making the Supreme Court better reflect the nation whose people the Court serves.” In his remarks, Senator Markey specifically highlighted Judge Jackson’s previous position as a public defender. “As a federal public defender, Judge Jackson represented the most vulnerable among us. She represented the clients other lawyers avoided. In doing so, she followed a long and honorable tradition in the American legal profession that began with John Adams stepping forward in 1770 to represent the British soldiers who committed the Boston Massacre because he feared they would not receive a fair trial without adequate representation.” Senator Markey additionally derided his Republican colleagues on their hostile, partisan questioning during the Judiciary Committee hearings. “As we all saw, some of the questioning of Judge Jackson from some of my Republican colleagues was nothing short of offensive, distorting her record, and tinged with racism and sexism. But Judge Jackson responded with poise. She calmly addressed and corrected her questioners’ false and misleading premises. And she did so while demonstrating deep knowledge of the law and the Constitution, respect for precedent, and displaying precisely the kind of temperament we expect of someone sitting on the nation’s highest court.”  ###"
https://www.markey.senate.gov/news/press-releases/senator-markey-representative-keating-welcome-official-creation-of-state-department-cyber-bureau,"Cyber Subcommittee Chairs call for more robust engagement with allies and partners through the State Department as threat of Russian cyberattacks grow Washington (April 5, 2022) – Senator Edward J. Markey (D-Mass.), Chairman of the East Asia and International Cybersecurity Policy Subcommittee of the Senate Foreign Relations Committee, along with Representative Bill Keating (MA-09), Chairman of the Europe, Energy, the Environment and Cyber Subcommittee of the House Foreign Affairs Committee, sent a letter to President Biden following the State Department’s official creation of a new bureau to lead U.S. cyber diplomatic and deterrence policy yesterday.  The lawmakers expressed concerns that Russia’s cyberattacks against Ukrainian targets may expand in severity and in scope in light of Moscow’s inability to achieve its strategic objectives in its war in Ukraine. The lawmakers call upon the President to appoint an Ambassador-at-large to lead the new Bureau of Cyberspace and Digital Policy, without delay, in order to coordinate global U.S. engagement with allies and partners and to strengthen international norms of acceptable behavior in the cyber domain. “Ukraine’s inspiring resistance in thwarting Russia from achieving its strategic objectives may lead President Putin to unleash cyberattacks on a larger scale — one that exacerbates the humanitarian crisis in Ukraine or tests the boundaries of what the NATO alliance considers an armed attack under Article V of its Charter,” write the lawmakers. “To that end, we strongly urge you to immediately nominate an Ambassador-at-large to head the State Department’s newly created Bureau of Cyberspace and Digital Policy, and provide the Bureau with appropriate staffing and resources. By establishing a single cyber diplomatic point of contact to help allies and partners bolster their own defenses, this Bureau will fill a crucial gap in our cyber support structures spread across U.S. government agencies.” A copy of the letter can be found HERE. Specifically, the lawmakers request that the President answer the following questions on U.S. cyber diplomacy policy: 1.         What lessons have we learned from the Russian government cyberattacks against Ukraine to date?2.         What criteria would the Administration use to determine whether a cyberattack on a NATO member should trigger Article V of the North Atlantic Charter on collective self-defense?3.         Approximately what is the timeline to fully staff up the new Bureau? How will the Bureau of Cyberspace and Digital Policy work with other U.S. government agencies and international partners to build capacity to help deny, deter, and impose costs on malign actors who conduct cyberattacks?4.         Which federal agencies currently engage with other countries to defend against cyberattacks?5.         Will the Administration outline the scope of possible policy responses to cyberattacks on the United States as the European Union has done?6.         Under what circumstances would the Administration support the negotiation of a legally binding international treaty to complement non-binding norms to promote the peaceful uses of cyberspace?7.         How will the State Department evaluate progress towards the further development of the eleven norms of behavior set out in the 2015 report of the Group of Government Experts?"
https://www.markey.senate.gov/news/press-releases/markey-joins-hassans-push-for-an-investigation-into-mckinseys-potential-conflicts-of-interest-in-relation-to-opioid-crisis,"Senators’ Request Follows Revelations that McKinsey Consulted for FDA on Opioid-Related Projects While Working for Opioid Manufacturers Like Purdue Pharma Washington (April 5, 2022) – U.S. Senator Edward J. Markey (D-Mass.) joined Senator Maggie Hassan (D-N.H.), Chair of the Emerging Threats and Spending Oversight Subcommittee and a group of thier colleagues in calling for an investigation into the failure of the consulting firm McKinsey & Company to disclose potential conflicts of interest when the company was simultaneously working with the Food and Drug Administration (FDA) on issues related to opioids and for numerous opioid companies, including Purdue Pharma. As the opioid crisis continues to devastate communities, the Senators are calling for a Health and Human Services Inspector General investigation into the FDA’s work with McKinsey and FDA’s contracting policies to ensure that contractors adequately disclose all potential conflicts of interest in the future. In addition to Senators Markey and Hassan, the letter was signed by Senators Patty Murray (D-Wash.), Chair of the Health, Education, Labor, and Pensions Committtee, Tammy Baldwin (D-Wisc.), Joe Manchin (D-W.Va.), Elizabeth Warren (D-Mass.), and Sheldon Whitehouse (D-R.I.). “While working for clients involved in manufacturing, distributing, and selling opioids, McKinsey simultaneously worked on projects for FDA, including projects for the FDA center responsible for approving new drugs, like opioids. Government contracting databases show that since 2008, McKinsey has been hired by FDA on numerous occasions, earning more than $140 million,” the Senators wrote to Christi A. Grimm, Inspector General for the Department of Health and Human Services. The letter follows Senator Hassan’s previous bipartisan efforts to push for answer from the FDA after learning from media reports that McKinsey did not reveal potential conflicts of interest to the FDA while they were contracted to work for the agency. Following the Senators’ outreach, the FDA responded that it had not known about McKinsey’s work with Purdue Pharma until media reports surfaced in 2021. In their letter, the Senators continued, “Despite these reports, FDA did not conduct any additional contract reviews or discuss with McKinsey conflicts of interest and the firm’s failure to disclose them in earlier contract applications. Furthermore, it is unclear whether FDA has altered or improved its processes and procedures to prevent similar nondisclosures of conflicts of interest in future contracts.” The Senators are calling on the Inspector General to review the actions of McKinsey and FDA as it pertains to these conflicts of interests and McKinsey’s failures to disclose them, and what actions the agency should take to help ensure that these failures don’t occur in the future. Senator Hassan is leading efforts to ensure that the organizations that helped to fuel the devastating substance use disorder epidemic are held accountable. Senator Hassan joined her colleagues recently in calling on the DOJ to investigate whether members of the Sackler family personally engaged in criminal conduct in connection with Purdue Pharma’s admitted criminal wrongdoing in fueling the devastating opioid epidemic. A copy of the letter can be found here. ###"
