url,text
https://www.murray.senate.gov/following-push-from-senator-murray-va-announces-extension-of-caregivers-program-for-legacy-participants/,"ICYMI: Senator Murray Holds Roundtable on VA Caregivers Program, Continues Fight to Improve Program – MORE HEREICYMI: At Senate Hearing, Senator Murray Presses VA Secretary on Patient Care, Caregivers Program, and Reiterates Call to Stop EHR Rollout in Washington state– MORE HERESenator Murray: “After pushing non-stop for the VA to fix this problem and do right by our veterans, I’m glad that today the VA has announced steps to protect eligibility to ensure no family loses the VA services and support that they need, and that they have earned.”(Washington, D.C.) – Today, U.S. Senator Patty Murray (D-WA), a senior member of the Senate Veterans’ Affairs Committee, released the following statement on the Department of Veterans Affairs’ (VA) announcement it will extend eligibility for its Caregivers program for legacy participants through September 2025. Senator Murray has long pushed back against efforts to curtail eligibility of the program, and this announcement comes after she urged VA Secretary Denis McDonough to revise VA’s unnecessarily restrictive criteria for the program to ensure it aligns with Congressional intent so that veterans and their families can access the critical services and care they have earned.“We owe our veterans and their families more than just a debt of gratitude—we owe them the services and care they have earned to support their mental and physical health,” said Senator Murray. “But I hear all the time from veterans in Washington state about the stress and the frustration they are experiencing, worried that they can’t access the Caregivers program, or that they might lose eligibility for the services they depend on. Not on my watch. After pushing non-stop for the VA to fix this problem and do right by our veterans, I’m glad that today the VA has announced steps to protect eligibility to ensure no family loses the VA services and support that they need, and that they have earned.”“While this is important, hard-fought progress, I know that our work isn’t over,” Senator Murray continued. “I’ve been pushing for a long time for the VA to align the Caregivers program with Congressional intent, and I’m going to keep doing all I can to cut red tape and ensure that veterans and caregivers can access this critically important program.”Senator Murray is a longtime champion for strengthening federal investments in caring for veterans, and as former Chair of the Senate Veterans’ Affairs Committee, Senator Murray oversaw the initial implementation of the Caregiver Support Program in 2011 and since then has worked diligently to expand it and has been following its implementation closely.###Sign up to receive Senator Murray’s newsletter and get updates on the workshe’s doing on behalf of Washington state.  "
https://www.murray.senate.gov/murray-leads-senate-democrats-in-fighting-republicans-national-abortion-ban/,"***WATCH: Senator Murray leads press conference calling out extreme Republican proposal***(Washington, DC) – Today, U.S. Senator Patty Murray (D-WA), Chair of the Senate Committee on Health, Education, Labor, and Pensions (HELP), led her colleagues Senator Amy Klobuchar (D-MN), Senator Mazie Hirono (D-HI), Senator Tammy Duckworth (D-IL), Senator Ron Wyden (D-OR), Chair of the Senate Finance Committee, and Senator Kirsten Gillibrand (D-NY) at a press conference making crystal clear they will fight Republicans’ national abortion ban every step of the way.In state after state, Republicans have enacted extreme abortion bans—and now, they’re pushing a national abortion ban that would strip women in every state of their right to make their own health care decisions and punish doctors for providing abortion care. When introducing the legislation on Tuesday, Senator Lindsey Graham (R-SC) vowed that: “If we take back the House and the Senate, I can assure you we’ll have a vote on our bill.”“Republicans can’t pretend they want to leave abortion to states while blocking Senator Cortez-Masto’s bill to let people travel to other states for an abortion. Republicans can’t say they don’t want to punish doctors while blocking my bill to ensure doctors in states where abortion is legal can’t be punished for doing their jobs. But if there was any doubt about Republicans’ true intentions—about their extreme abortion plans—there’s no question after this week,” said Senator Murray. “Republicans want to ban abortion in every single state. They want to punish doctors.”“If Republicans think they can go after my constituents’ rights, go after women’s bodies and futures, and overrule the personal medical decisions of people across the country, they’ve got another thing coming. Because I am not going to stop pushing back. Democrats are not going to stop pushing back,” added Senator Murray.“Republicans are twisting themselves into pretzels to explain their position on abortion, because they know the American people overwhelmingly side with a woman’s right to choose,” said Leader Schumer. “The Republican abortion ban introduced this week shows the stark contrast between Democrats who are focused on creating jobs, lowering costs, and bringing our country together, and MAGA Republicans who are a pushing radical, extremist agenda.”“Two and a half months ago, the Supreme Court issued a ruling, shredding nearly five decades of precedent…This bill that was introduced will take these restrictions even a step further. This is not what the American people want,” said Senator Klobuchar. “It is now more clear than ever that we must codify Roe v. Wade into law.”“When a woman can’t make decisions about her own body and about abortion, this affects her family, her community, and our economy. The vast majority of Americans support a woman’s right to bodily autonomy, but apparently Republicans don’t think so,” said Senator Hirono. “If Republicans take control over the Senate, they are going to push for a national ban. And that means that states like Hawaii, which was the first state in the nation to protect a woman’s right to choose and all other states that come forward, or already have in place, basically codifying Roe—under this national ban bill, would fall by the wayside.”“Republicans’ proposal to ban abortion nationwide lays bare, in black and white, that they never really wanted to ‘leave women’s rights to the states’ like they have long told the American people,” said Senator Duckworth. “While Democrats spent this summer helping working families keep more of their hard-earned money, Republicans spent theirs trying to strip away millions of Americans’ rights and effectively make 50% of America second-class citizens. Democrats and I will do everything in our power to prevent this nationwide ban on basic healthcare—a ban that explicitly goes against what the vast majority of Americans want—from happening.”“Senator Graham’s radical proposal is exactly what Republicans had in mind when they hand-picked Supreme Court nominees to overturn Roe v. Wade. They want a national ban on abortion. And it’s what they will do if they take back control of the House and Senate. They’ve said so themselves,” Senator Wyden said. “The American people should expect them to follow through, and vote in November to guarantee that this bill never sees the light of day.”“With this bill to put a federal ban on a woman’s right to choose, our Republican colleagues have shown their true colors and proven beyond all doubt that they will stop at nothing to turn back the clock and make women in America second-class citizens,” said Senator Gillibrand. “They said that such decisions about the right to bodily autonomy and to life and death medical decisions should be made by individual states. But of course this was never really about the states. It’s always been about control — who controls women and our rights to privacy, bodily autonomy, basic human rights, civil rights, and constitutional freedoms. Voters will continue to make their voices heard and I will never stop fighting to enshrine the right to reproductive freedom into federal law once and for all.”“Americans should have no doubt about where Republicans stand now on this issue. They want to punish women and they want to punish doctors. They will do it at the state level and they will do it at the national level,” said Senator Blumenthal. “No state, not even Connecticut, is safe from this threat. I trust women, not the government or politicians, to make these preeminently important decisions.”  ###Sign up to receive Senator Murray’s newsletter and get updates on the workshe’s doing on behalf of Washington state.  "
https://www.murray.senate.gov/senator-murray-applauds-usdas-535-million-investment-in-15-projects-that-will-boost-washington-state-agricultural-sector/,"ICYMI: Senator Murray Helps Pass Largest-Ever Climate Action Investment to Build Clean Energy Economy, Lower Energy Costs – MORE HEREICYMI: Senator Murray Secures Major Transportation, Climate, and Broadband Investments in Bipartisan Infrastructure Bill – MORE HERESenator Murray: ““I’m pleased that USDA is investing in important resources that will help boost sustainable growing practices, lower emissions, restore thousands of acres of forest, and more—all while supporting our farmers, and feeding families for generations to come.”(Washington, DC) – Today, U.S. Senator Patty Murray (D-WA), applauds a $535 million investment to help boost Washington state agricultural sector’s climate resilience and sustainability through 15 Partnerships for Climate-Smart Commodities projects funded by the U.S. Department of Agriculture (USDA). These projects will help build a stronger green economy by supporting a range of farm and environmental groups as they work to boost sustainable grazing practices for beef production, restore thousands of acres of forests, and more.“Washington state’s farmers and ranchers are an important part of our economy, producing the food to feed families across the country. As we work to build a stronger, greener economy and combat the climate crisis, I’m happy to see that the USDA is providing our agricultural sectors with the support they need to boost their climate resiliency and sustainability,” said Senator Murray.“I’m pleased that USDA is investing in important resources that will help boost sustainable growing practices, lower emissions, restore thousands of acres of forest, and more—all while supporting our farmers, and feeding families for generations to come.”Senator Murray has been a leader on confronting the climate crisis from every angle during her time in the Senate. Senator Murray was instrumental in passing the Inflation Reduction Law, the largest investment in combatting the climate crisis in American history. Senator Murray also joined President Biden in Seattle in April when he issued his Executive Order to safeguard American forests and fight climate change.Last year, Senator Murray helped pass the Bipartisan Infrastructure Law, which will help Washington state and the country transition to cleaner energy and electric vehicles, make the electric grid more reliable, help prevent and fight wildfires, and more—all while creating good-paying, union jobs.###Sign up to receive Senator Murray’s newsletter and get updates on the workshe’s doing on behalf of Washington state.  "
https://www.murray.senate.gov/senator-murray-statement-on-tentative-rail-labor-agreement/,"(Washington, D.C.) – Today, U.S. Senator Patty Murray (D-WA), Chair of the Senate Committee on Health, Education, Labor, and Pensions (HELP), issued the following statement on the tentative agreement reached by rail unions and carriers following years of negotiations.“This tentative agreement is an important milestone to prevent a stoppage and keep our railways and our economy running. I’m grateful for the hard work President Biden, Secretary Walsh, Secretary Buttigieg, Chairman Puchala, the rail unions, and carriers put in to stay at the table, negotiate in good faith, and help reach this agreement. The agreement would not only deliver rail workers better pay, benefits, and working conditions, but also support rail companies by strengthening our freight rail workforce. This is a win for rail workers and our entire economy.”###Sign up to receive Senator Murray’s newsletter and get updates on the workshe’s doing on behalf of Washington state.  "
https://www.murray.senate.gov/senator-murray-fights-back-against-republicans-national-abortion-ban/,"Senator Murray: “This bill shows the true Republican position: they want to ban abortion—for everyone. In every single state.”***WATCH SENATOR MURRAY’S FLOOR SPEECH HERE***(Washington, DC) – Today, U.S. Senator Patty Murray (D-WA), Chair of the Senate Health, Education, Labor, and Pensions (HELP) Committee, took to the Senate floor to fight back against the Republican national abortion ban introduced by Senator Lindsey Graham (R-SC) yesterday. In the speech, Senator Murray promised to fight this bill every step of the way and to stand up for everyone’s right to control their own bodies and make their own medical decisions.“This bill shows the true Republican position: they want to ban abortion—for everyone. In every single state. And they want to punish doctors. They want to put them in prison for doing their jobs,” said Senator Murray. “So to anyone who lives in a blue state, like mine—anyone who thinks they are safe from these attacks here is the painful reality: Republicans are coming for your rights.”“So here’s my message to Republicans: If you want to go after my constituents’ rights, if you want to go after women’s bodies and futures, if you want to pass a national abortion ban, like this extreme bill, you are going to have to go through me,” continued Senator Murray. “Because Democrats are going to keep standing up for women and men across the country who do not want their rights taken away.”Senator Murray has been fighting to defend the right to abortion since she first got into politics, and she continues to fight every day for the needs of patients across the country. Just yesterday, she led 29 of her colleagues in calling on the Department of Health and Human Services to take immediate action to safeguard women’s privacy and their ability to safely and confidentially get the health care they need. Senator Murray immediately put out a statement following the introduction of Republicans’ national abortion ban yesterday and joined her colleagues to speak out following Senator Graham’s press conference.Every week since Roe was overturned, Senator Murray has fought to pass key protections to safeguard Americans’ reproductive rights—pushing to advance commonsense legislation to protect the right to contraception, protect every American’s right to travel, protect doctors’ right to provide legal abortion care, and expand our national family planning program. But at every turn, Senate Republicans stood in the way, blocking every single bill.Senator Murray’s floor speech, as prepared for delivery, is below:“Thank you, M. President. “Yesterday, my Republican colleagues introduced a national abortion ban and made clear they are coming after the rights of my constituents and they are coming after the rights of people across the country.“This atrocious bill threatens the people of Kansas—who just voted overwhelmingly to protect abortion rights, the hundreds of thousands of people in Michigan who just signed a petition for a referendum vote to protect abortion and states like mine which already have strong abortion protections on the books. “Up to now, Republicans have tried to play down their abortion extremism.“They’ve tried to run away from the consequences of their extreme agenda— Even as patients have been denied prescriptions they need. Even as doctors have been forced to wait until patients’ lives are in danger before they can take action. Even as the health care crises they have caused spill across state lines to disastrous effect. But despite their empty rhetoric about ‘leaving it to the states’ the truth has been painfully clear—they think they know better than women when it comes to reproductive health care decisions.“They have shown again and again they don’t trust women to have full control over their own bodies, and they are willing to go after doctors. “They have blocked the most basic bills like Senator Cortez Masto’s bill making sure people can still travel to other states for legally available care and my bill making sure doctors in states where abortion is legal can’t be punished for doing their jobs. Over and over they have stood in the way of Democrats’ efforts to protect women’s abortion rights and it is crystal clear why. “This bill shows the true Republican position: “They want to ban abortion—for everyone. In every single state.“And they want to punish doctors. They want to put them in prison for doing their jobs. “So to anyone who lives in a blue state, like mine—anyone who thinks they are safe from these attacks here is the painful reality: Republicans are coming for your rights. “And you don’t have to take my word for it: the Senator from South Carolina said yesterday, and I quote, “If we take back the House and the Senate—I can assure you we will have a vote on our bill.”“There it is. Couldn’t be clearer. “This is the MAGA agenda. For all fifty states rights stripped away and doctors in prison. “Regardless of your circumstances regardless of what’s best for your health regardless of your family plans—of your hopes, fears, or dreams for your future. Republicans want to control your most decisions.“They don’t trust you to have full control over your own body.“It’s just horrifying. “And M. President—when he unveiled this bill yesterday, the Senator from South Carolina also said, and I quote: “I’ll make a prediction: we stay on this and we keep talking about it, maybe less than a decade from now, this will be law.”“This is the future they want—a national abortion ban.“Well let me tell you something—the Senator from South Carolina may not have been paying attention—but Democrats are already talking about this issue every week, every day, every opportunity. And women across the country have been with us: fighting for the right to abortion and fighting back against Republicans’ harmful attacks. “We saw it in Kansas, we are seeing it in Michigan, and I am seeing it everywhere I go in Washington state.“I have been talking to doctors, patients, and women and men across the country. “And they are outraged—outraged—that Republicans want to take away their rights, that Republicans want to put their doctors in prison. “And I am too. I’ve never been madder. “So here’s my message to Republicans:“If you want to go after my constituents’ rights, if you want to go after women’s bodies and futures, if you want to pass a national abortion ban, like this extreme bill, you are going to have to go through me. “Because Democrats are going to keep standing up for women and men across the country who do not want their rights taken away.” ###Sign up to receive Senator Murray’s newsletter and get updates on the workshe’s doing on behalf of Washington state.  "
https://www.murray.senate.gov/senator-murray-inflation-reduction-act-means-lower-costs-stronger-economy-for-working-families/,"***WATCH VIDEO OF SENATOR MURRAY SPEAKING ABOUT THE IRA’s CLIMATE PROVISIONS HERE******WATCH WACH VIDEO OF SENATOR MURRAY SPEAKING ABOUT THE IRA’s HEALTH CARE PROVISIONS HERE*****WATCH VIDEO OF SENATOR MURRAY SPEAKING ON THE SENATE FLOOR HERE***(Washington, D.C.) – Today, U.S. Senator Patty Murray (D-WA), Chair of the Senate Committee on Health, Education, Labor, and Pensions (HELP), issued the following statement as President Joe Biden held a celebration to commemorate the signing of the Inflation Reduction Act of 2022, comprehensive legislation to lower everyday costs for families while building a stronger, clean energy economy.“Last month, Democrats took historic action to lower health care costs for working families, create good-paying jobs to build a stronger clean energy economy, and make the largest-ever investment to tackle the climate crisis that gets worse by the year. And we paid for it all while reducing the deficit by ensuring the largest corporations simply pay their fair share in taxes like the rest of us.“I’m so proud to have helped get this legislation passed and signed into law by President Biden—because the Inflation Reduction Act means lower health care costs for families, and more money back in their pockets. It means lower prescription drug costs for patients because we capped seniors insulin costs and out of pocket drug costs, and finally gave Medicare the power to force big drug makers to the negotiating table. It means good-paying jobs that’ll help build a stronger clean energy economy—and it also means lower energy costs for consumers. This law is a game changer for working families, our economy, and the environment—and I’m going to keep pushing to build on this historic progress.”The Inflation Reduction Act lowers prescription drug and health care costs and delivers the largest-ever investment in climate action—lowering energy costs, promoting energy independence, and creating good-paying jobs. It is fully paid for by ensuring the very wealthiest and giant corporations simply pay their fair share and would actually reduce the deficit by more than $300 billion.More on the Inflation ReductionActand what it means for Washington stateHERE.###Sign up to receive Senator Murray’s newsletter and get updates on the workshe’s doing on behalf of Washington state.  "
