url,text
https://www.peters.senate.gov/newsroom/press-releases/video-and-photos-peters-meets-with-us-supreme-court-justice-nominee-judge-ketanji-brown-jackson,"WASHINGTON, DC – U.S. Senator Gary Peters (MI) today released the following statement after meeting with President Biden’s nominee to be the next Associate Justice of the United States Supreme Court, Judge Ketanji Brown Jackson: “I was pleased to meet with Judge Jackson today and am impressed by her distinguished and wide-ranging legal career, extensive qualifications, character, and work ethic,” said Senator Peters. “Supreme Court rulings have an enormous impact on Americans and our way of life – from accessing quality, affordable health care to workers’ rights, women’s reproductive rights, environmental protections and voting rights – and speaking with Judge Jackson today reaffirmed my belief that she has the experience, temperament and commitment to protecting the constitutional rights of all Americans that is necessary to serve on our nation’s highest court. I look forward to voting for Judge Jackson’s confirmation.” As the first African American woman nominated to the U.S. Supreme Court, Judge Jackson’s nomination is historic – and has received extensive and broad support, including prominent conservatives across the legal community, national law enforcement organizations such as the International Association of Chiefs of Police, civil rights organizations and the NAACP. Jackson was previously confirmed by this Senate three separate times and on a bipartisan basis – most recently last year to serve on the D.C. Circuit Court of Appeals. Before her confirmation to the D.C. Circuit, Judge Jackson served on the United States District Court for the District of Columbia. She was confirmed to the role unanimously and issued more than 500 opinions on cases involving a range of important issues. Jackson additionally has prior experience as a Vice Chair and Commissioner on the U.S. Sentencing Commission, as a federal public defender, as a lawyer in private practice, and as a law clerk at all three levels of the federal Judiciary, including for U.S. Supreme Court Associate Justice Stephen Breyer. To download B-roll of Senator Peters meeting with Judge Jackson – including brief remarks from Senator Peters – click here and here. To download high-resolution photos of Senator Peters meeting with Judge Ketanji Brown Jackson, click here.Image courtesy of Senator Peters' office.Image courtesy of Senator Peters' officee.Image courtesy of Senator Peters' office.###"
https://www.peters.senate.gov/newsroom/press-releases/video-peters-discusses-importance-of-the-postal-service-with-board-of-governor-nominees,"Peters Continues Leading Efforts to Ensure Reliable Mail Service for Years to ComeWASHINGTON, D.C. – U.S. Senator Gary Peters (D-MI), Chairman of the Homeland Security and Governmental Affairs Committee, today convened a full committee hearing to consider the nominations of Derek Kan and Daniel Tangherlini to serve on the United States Postal Service Board of Governors. During the hearing, Peters discussed how the Postal Service plays a critical role in the lives of countless Americans, including veterans, businesses owners, rural residents, seniors, and underserved communities. Peters also discussed the need for qualified leadership at the Postal Service that will support its dedicated workforce, focus on reliable mail delivery, and maintain the Postal Service’s public service mission to deliver to every community. Peters also highlighted passage of his historic, bipartisan legislation to set the Postal Service on a more sustainable financial footing and support the goal of providing long-term reliable service across the country. The bill, which passed both the House and the Senate with significant bipartisan support, will soon be signed into law by the President.“The United States Postal Service Board of Governors plays an essential role in the Postal Service’s future. As the governing body for the Postal Service, they oversee its operational strategy to ensure the Postal Service continues on a good path, both financially, and by providing reliable service to its customer,” said Peters during his opening statement. “To be successful, the Board must have qualified leaders who can govern, conduct oversight of Postal Service management, and work with lawmakers to ensure our postal workforce has the right support to deliver for the American people each and every day.”  To watch video of Senator Peters’ opening remarks, click here. For text of Peters’ opening remarks, as prepared, click here.To watch video of Senator Peters’ question, click here.At the hearing, Peters and the nominees discussed how the Board can work with Congress to ensure effective implementation of the Postal Service Reform Act, once it is signed into law, so that its benefits to the public and financial benefits to the Postal Service can be fully realized. Peters also raised the need for Postal Service Governors to work independently to ensure the Postal Service is providing timely mail delivery for communities across the nation. Finally, Peters questioned the nominees on efforts to modernize the Postal Service’s fleet of vehicles, including by investing in as many electric vehicles as possible to make sure the Postal Service is maximizing long term efficiency and savings.Peters has fought to protect the Postal Service and its 245-year tradition of mail delivery. In addition leading a historic postal reform bill, in 2020, Peters championed legislation to secure a $10 billion direct payment to the Postal Service to help recover from pandemic-related losses. He also conducted an investigation into operational changes at the Postal Service in 2020 that resulted in significant delays. Following Peters’ investigation, the Postal Service reversed many of these changes and service has significantly improved.###"
https://www.peters.senate.gov/newsroom/press-releases/peters-bipartisan-legislation-to-protect-commercial-satellites-from-cybersecurity-threats-advances-in-senate,"WASHINGTON, D.C. – Bipartisan legislation authored by U.S. Senator Gary Peters (MI) to require the Cybersecurity and Infrastructure Security Agency (CISA) to provide voluntary cybersecurity resources to commercial satellite owners and operators has advanced in the Senate. Commercial satellites provide data and information used for navigation, agriculture, technology development, scientific research, and more. Industrial Control Systems – the technology involved in operating critical infrastructure networks like pipelines, and water and electric utilities – are also heavily reliant on commercial satellites. Peters’ legislation will help ensure these systems – which are critical to our national and economic security – are secure from online attacks. The Senate Homeland Security and Governmental Affairs Committee, where Peters serves as Chair, approved the legislation following recent reports that the Russian government was behind a cyber-attack on an American-based satellite company, which provides broadband services to Europe, in order to disrupt Ukrainian military communications at start of the invasion.“Foreign adversaries, including the Russian government, and cybercriminals continue to target satellites that provide essential services. If they are able to successfully breach these networks, the consequences for the American people could be catastrophic,” said Senator Peters. “This bipartisan bill will help ensure small businesses and other organizations that own and operate commercial satellites have the necessary resources and information to secure their own networks.”Experts have shown increasing concern that commercial satellite hacks could have dire economic and security consequence. The Department of Defense has also raised concerns about this threat and recently sponsored a competition for white hat hackers to attempt breaching an active satellite. In 2014, American officials accused the Chinese government of hacking a National Oceanic and Atmospheric Administration weather satellite. As commercial satellites become more pervasive, hackers could shut satellites down, denying access to their service or jam signals to disrupt electric grids, water networks, transportation systems, and other critical infrastructure. Peters’ legislation will ensure the United States is prepared to address these threats as malicious hackers increasingly target commercial satellite systems.The Satellite Cybersecurity Act will require CISA to consolidate voluntary satellite cybersecurity recommendations to help companies understand how to best secure their systems. Some of these resources will be specific to small businesses who own and operate commercial satellite systems. Additionally, the bill requires CISA to develop a publicly available, online resource to ensure companies can easily access satellite-specific cybersecurity resources and recommendations to secure their networks. The legislation will also require the Government Accountability Office to perform a study on how the federal government supports commercial satellite industry cybersecurity. It will ensure a better understanding of how network vulnerabilities in commercial satellites could impact critical infrastructure.As Chairman of the Homeland Security and Governmental Affairs Committee, Peters has led efforts to increase our nation’s cybersecurity defenses. His landmark bill to require critical infrastructure owners and operators to report to CISA if they experience a substantial cyber-attack or if they make a ransomware payment was signed into law as a part of the recent government funding legislation. Peters’ bill to enhance cybersecurity assistance to K-12 educational institutions across the country was also signed into law. Additionally, Senator Peters secured several provisions in the bipartisan infrastructure law to bolster cybersecurity – including $100 million fund to help victims of a serious attack recover quickly. ###"
https://www.peters.senate.gov/newsroom/press-releases/peters-legislation-to-save-taxpayer-dollars-by-ensuring-public-buildings-utilize-energy-efficient-lighting-passes-senate,"WASHINGTON, D.C. – The Senate has passed bipartisan legislation authored by U.S. Senator Gary Peters (MI), Chairman of the Homeland Security and Governmental Affairs Committee, that would help save taxpayer dollars by directing the General Services Administration (GSA) to install the most life-cycle cost effective and energy-efficient lighting in public buildings. The legislation now moves to the United States House of Representatives for consideration.“By using more efficient lighting, the federal government can save taxpayer dollars in the long run by reducing its energy usage,” said Senator Peters. “This commonsense bipartisan bill will also ensure the government decreases its carbon footprint and helps combat climate change. Now that this bill has passed the Senate, I urge my colleagues in the House to pass it as soon as possible.”  The Bulb Replacement Improving Government with High-Efficiency Technology (BRIGHT) Act requires the GSA Administrator to ensure that public buildings are using the most life-cycle cost effective and energy-efficient technology to the extent practicable when performing normal maintenance, altering or constructing public buildings. The bill also requires GSA to issue guidance to federal agencies, and state, local and Tribal entities to further streamline efficiency and effectiveness across government. GSA previously released a series of reports that calculated that switching to LED lightbulbs would result in millions of dollars in cost-savings due to their superior lifespan and energy efficiency. Federal law does not currently require the government to maximize long-term cost and energy savings across lighting products.Peters has led numerous efforts to ensure that taxpayer dollars are spent effectively and efficiently. He recently convened a hearing to ensure pandemic emergency relief funds have been effectively used to help Americans affected by COVID-19. Peters’ bipartisan bill to save taxpayer dollars by ensuring federal property assets are disaster resilient has advanced in the Senate. As a part of the American Rescue Plan, Peters secured $1 billion for the Technology Modernization Fund to modernize federal government systems that deliver critical services, like unemployment insurance, to Americans. Peters’ provision to help save billions of federal taxpayer dollars by curbing erroneous payments to deceased individuals was signed into law last Congress.  A law written by Peters to reduce duplicative software purchases called the MEGAByte Act has saved taxpayers more than $450 million since 2016.###"
https://www.peters.senate.gov/newsroom/press-releases/peters-announces-us-customs-and-border-protection-community-relations-position-for-michigans-arab-and-muslim-american-communities,"WASHINGTON, D.C. – U.S. Senator Gary Peters (D-MI), Chairman of the Homeland Security and Governmental Affairs Committee, released the following statement on the creation of a Detroit-based U.S. Customs and Border Protection (CBP) community relations position within the Department of Homeland Security (DHS) that will be dedicated to building trust and working with Michigan’s Arab and Muslim American communities, as well as other impacted communities:“Following the meeting I convened earlier this month between community leaders and Homeland Security Secretary Alejandro N. Mayorkas, I’m pleased to announce that the Department has notified me that U.S. Customs and Border Protection will be establishing a new position to serve as a community relations liaison between the agency and Michigan’s Arab and Muslim American communities.“Community leaders have long raised serious concerns about experiences with the travel screening process, and this new role will be a vital link between these communities and CBP officials to help address these concerns and other important civil rights issues. This is a key step to ensure that the Department of Homeland Security and its component agencies are effectively serving all of our communities. As Chairman of the Homeland Security Committee, I will continue working with Secretary Mayorkas and CBP to ensure that the Department of Homeland Security is able to facilitate secure and efficient trade and travel into the United States while protecting our borders and respecting Americans’ civil rights and liberties.”Earlier this month, Peters hosted DHS Secretary Alejandro N. Mayorkas in Metro Detroit to meet with leaders from Michigan’s Arab and Muslim American communities to discuss civil rights issues, including the challenges often confronted by members of these communities when going through security screening while traveling.This afternoon, Peters joined CBP Deputy Commissioner Troy Miller and Dearborn, MI Mayor Abdullah Hammoud for a virtual meeting, which included a discussion of the new position, which will be charged with serving as the key liaison between Michigan’s Arab and Muslim American communities and CBP leadership in Michigan and Washington, D.C. to help address these and other community concerns.###"
https://www.peters.senate.gov/newsroom/press-releases/peters-legislation-to-correct-retirement-error-for-customs-and-border-protection-officers-advances-in-senate,"WASHINGTON, D.C. – Bipartisan legislation authored by U.S. Senator Gary Peters (MI) to ensure U.S. Customs and Border Protection officers (CBPOs) can receive the retirement benefits they were promised when starting their service has advanced in the Senate. The bill corrects a mistake where Customs and Border Protection (CBP) incorrectly informed newly hired CBPOs that they would be eligible for proportional annuity, which means they would not have to retire at a certain age or reach 20 years of service to qualify for the benefit enhancement. However, when CBP realized their error – more than ten years after these officers had started their service – they rescinded these benefits and will now require at least 1352 officers, including 67 in Michigan, to meet additional requirements to receive the benefits they were initially promised when starting the job more than a decade ago. This has significantly impacted CBPOs’ ability to properly plan for their future and ensure they can retire comfortably with the benefits they expected.  The bill was approved by the Senate Homeland Security and Governmental Affairs Committee, where Peters serves as Chair.“It is unacceptable that hardworking Customs and Border Protection officers have had their retirement plans disrupted due to a paperwork error that occurred almost 15 years ago. These officers – who put their lives on the line each and every day to ensure safe and efficient travel and trade across our borders – deserve better,” said Senator Peters. “This bipartisan bill will ensure these employees get the benefits they were promised by Customs and Border Protection, and I will continue to urge my colleagues to quickly pass this important legislation.""The CPBO Retirement Corrections Act would direct CBP to identify eligible individuals and notify them of the correction. Those impacted would then be eligible for a correction that would align their retirement benefits with the coverage they were promised. The legislation also includes a retroactive annuity adjustment for eligible individuals who retire before the date of enactment of this bill and grants the Department of Homeland Security the authority to waive maximum entry age requirements for eligible officers. ### "
https://www.peters.senate.gov/newsroom/press-releases/peters-bipartisan-legislation-to-help-at-risk-communities-invest-in-disaster-mitigation-projects-advances-in-senate,"WASHINGTON, D.C. – Bipartisan legislation authored by U.S. Senator Gary Peters (MI) to make permanent the Federal Emergency Management Agency’s (FEMA) National Risk Index (NRI), an online tool that utilizes data to identify communities that are most vulnerable to natural disasters, has advanced in the Senate. The bill would require FEMA to use data from the NRI, or a similar tool, to establish community disaster resilience zones (CDRZs) to designate the communities across the nation that are most in need of mitigation projects – and help them access federal funding and support to plan for mitigation and resilience projects. As damage from extreme weather events continues to cause billions of dollars in damages that taxpayers must cover, Peters’ legislation will help at-risk communities make important investments that will limit the damage caused by natural disasters. The bill was approved by the Senate Homeland Security and Governmental Affairs Committee, where Peters serves as Chair. “Mitigation projects are the key to helping communities that are most vulnerable to natural disasters protect residents from these extreme weather events. Unfortunately, these communities often lack the necessary resources to fund efforts like flood walls, better storm water management facilities, and more,” said Senator Peters. “This commonsense, bipartisan legislation – which has now advanced in the Senate – will help the public and private sectors identify what areas require the most assistance to build resilient infrastructure. These investments will not only help ensure at-risk populations are safe from extreme weather events, but also save taxpayer dollars in the long run.”Vulnerable communities continue to face severe consequences from natural disasters – including loss of life and significant financial damage. Studies have shown that resilience and mitigation spending saves taxpayers an average of $6 for every $1 invested. By making permanent and utilizing data from the NRI, or a similar tool – which factors in expected annual losses, social vulnerability and community resilience – Peters’ legislation would help better allocate resources so at-risk communities can develop FEMA-approved hazard mitigation projects. The legislation is supported a variety of stakeholder groups, including the U.S. Chamber of Commerce, the Reinsurance Association of America (RAA), the National Wildlife Federation (NWF), the National Association of Counties (NACo), the BuildStrong Coalition, and the National Low Income Housing Coalition.As Chairman of the Homeland Security and Governmental Affairs Committee, Peters has led several efforts to strengthen our federal disaster preparedness and response. Peters secured $500 million in funding as part of the bipartisan infrastructure bill for a program he created to help states establish revolving loan programs for local governments to carry out mitigation projects that reduce the risk of shoreline erosion, extreme flooding, and other natural disasters. Peters also convened a hearing with disaster preparedness and response experts to hear how worsening natural disasters, including flooding, severe storms, and wildfires, continue to threaten lives and livelihoods in Michigan and across the nation. Peters’ bipartisan legislation to protect Federal Emergency Management Agency (FEMA) Reservists from losing their full-time employment when they are called up to assist communities with disaster response has advanced in the Senate.###"
https://www.peters.senate.gov/newsroom/press-releases/peters-statement-on-president-bidens-budget-proposal,"Peters Highlights Michigan Priorities that Would Expand US Manufacturing and STEM Education, Invest in the Great Lakes Restoration Initiative & Cleanup of PFAS Contamination, and Bolster National Security; All While Reducing the Deficit and Lowering Costs for FamiliesWASHINGTON, DC – U.S. Senator Gary Peters (MI) today released the following statement on President Biden’s budget proposal for Fiscal Year 2023, which would significantly support priorities vital to Michigan, including: PFAS contamination remediation, strengthening critical infrastructure, protecting the Great Lakes, expanding domestic manufacturing, investing in American workers, and bolstering our national defense among other efforts. The proposal takes these steps all while lowering costs for families, and reducing the deficit by asking corporations and billionaires to pay their fair share.“The President’s proposal builds on the progress we have made by working to further strengthen our economy and lower costs for families,” said Senator Peters. “I am pleased that this proposal would make investments important to Michiganders by: supporting the Great Lakes Restoration Initiative, making critical upgrades to the Brandon Road Lock and Dam, cleaning up PFAS contamination and working to bolster domestic manufacturing and our supply chains. A budget is a reflection of your values, and this proposal puts workers and families first while lowering costs and reducing our deficit – and ensuring that billionaires and wealthy corporations pay their fair share.” The President’s proposal includes priorities that are important to Michigan:###"
