url,text
https://www.schumer.senate.gov/newsroom/press-releases/following-his-push-schumer-announce-vital-3407-inspired-pilot-training-regulations-have-been-protected,"Following Tragic 2009 Plane Crash, Schumer Fought Alongside Families Of Flight 3407 Victims To Create Critical Flight Safety Regulations, Including Requirement That Pilots Log 1,500 Flight Hours In Order To Receive Certificate And Pilot Record Database Since The Rule Was Enacted There Has Not Been A Fatal Crash On A U.S. Airline, But Special Interests Were Pushing To Reduce The Safety Measures, Prompting Schumer To Launch All Out Push To Stop Any Roll Back Schumer: Today Special Interests Lost And The Air Safety Provisions Fought For By the Flight 3407 Families Will Remain Strong To Keep Our Skies Safe Washington, D.C. – Senate Majority Leader Chuck Schumer (D-NY), long-time, relentless advocates for air safety standards, who for years worked together with the families of those lost in the tragic February 2009 crash of Colgan Air Flight 3407  near Buffalo, New York, today released the following statement after the U.S. Federal Aviation Administration (FAA) denied the request by Republic Airways to rollback safety regulations fought for by the Flight 3407 families:“Today special interests lost and the strong safety regulations fought for by the Flight 3407 families remain strong and will continue to save lives keeping our skies safe. Since these safety laws were enacted, not a single major U.S. airline has had a fatal crash, and I will never let us turn back the clock. Time after time, the 3407 family members work tirelessly to beat back industry’s effort to roll back safety standards, and I am proud to have stood with them shoulder to shoulder to beat back this latest attempt. We must always remain constantly vigilant to stop special interests from getting their way, but today the aviation reforms which carry with them the memory of those lost in Flight 3407 continues to burn bright.” ###
                             Please be advised that due to the implementation of enhanced mail screening procedures, all mail sent to my state offices will experience a two to three week delay in delivery.  In the meantime, if you have an urgent matter, the best way to reach me is by phone at (202) 224-6542 or through any of my eight district offices."
https://www.schumer.senate.gov/newsroom/press-releases/schumer-gillibrand-announce-5-million-for-onondaga-community-college-to-lead-health-worker-training-consortium-that-will-help-hospitals-fill-good-paying-in-demand-healthcare-jobs-in-upstate-ny,"Senators Deliver Fed Funding To Give Upstate Community College Students The Hands-On Training To Help Fill Sorely Needed Healthcare Jobs Upstate And Give  Job Seekers The Skills For Good-Paying Healthcare Careers OCC Will Lead Coalition Of Upstate Community Colleges Including SUNY Broome, Corning, Cayuga, Genesee, Herkimer, Jamestown, Jefferson, North Country, Schenectady, & Tompkins Cortland Community College, In Addition To Workforce Development Agencies, Hospitals, Unions, To Reduce Barriers And Help Underserved Students Enter The Healthcare Field Schumer, Gillibrand: From CNY To The North Country, Fed $$$ Will Boost Upstate Community Colleges To Fill In-Demand Healthcare Jobs Across New York State! U.S. Senate Majority Leader Charles E. Schumer and U.S. Senator Kirsten Gillibrand today announced the U.S. Department of Labor’s (DOL) Strengthening Community Colleges Training Grants Program has awarded $5 million to expand healthcare education programs, close opportunity gaps, and increase access to good-paying, in-demand healthcare careers across New York State. Onondaga Community College will lead a coalition of ten Upstate community colleges, in partnership with leading workforce development agencies, healthcare industry leaders, unions, and other community partners in a bold new project called the  Community College Health CARES (Career, Acceleration, Retention + Employment Support) Consortium. The senators said that this proposal, with the support of the federal funding that they secured, will expand these critically-needed programs to strengthen the healthcare workforce in communities across Upstate New York and help underserved individuals get the skills they need to enter these good-paying careers that are in demand across New York.“I am proud to deliver this $5 million federal investment to give Upstate community colleges, led by OCC, the shot in the arm they need to help providers fill in-demand, good-paying healthcare jobs in their communities,” said Senator Schumer. “Healthcare providers across the state are struggling to find enough workers to meet the demand for services, but this funding will help students and job seekers get the skills they need to enter better paying careers and give back to the community. This funding will go a long way to filling healthcare jobs in the areas that need them most and will strengthen Upstate New York’s medical workforce for years to come.”“Our health care providers have been under historic levels of stress. They have worked night and day to meet rising demand and keep their fellow New Yorkers safe and healthy, and they need reinforcements,” said Senator Gillibrand. “Funding like the $5 million going to Onondaga Community College is a critical step in addressing the health care staffing shortage and recruiting, training and building the next generation of health care workers.”Onondaga Community College President Dr. Warren Hilton said, “We are extremely grateful to Senator Schumer and Senator Gillibrand for their support of Onondaga Community College and their understanding of our mission as Central New York’s partner in education for success. In our School of Health we are creating programs which will train students for good-paying jobs in the shortest time possible. Their success in the classroom will both satisfy significant workforce needs, and give our students an entry point to a rewarding career and ultimately a better life. Moreover, the broad reach of this project will allow OCC and ten other collaborating community colleges to bring these benefits to individuals and communities across New York State.”Specifically, this funding will allow Onondaga Community College to lead SUNY Broome, Corning, Cayuga, Genesee, Herkimer, Jamestown, Jefferson, North Country, Schenectady, and Tompkins Cortland Community Colleges to expand their healthcare training programs. This will be done in partnership with top regional healthcare employers like SUNY Upstate Medical University, United Health Services, Arnot Health, Cayuga Medical, Lourdes, Samaritan Medical Center, and many others.The senators explained this new funding will allow partners to collaborate to enhance and accelerate career pathway programs leading to industry-recognized credentials and entry into Health Care and Social Assistance careers, including nursing, healthcare technicians, social assistance and management, and health information technology and administration. The program will also have an added focus on closing opportunity gaps for low-income individuals and underrepresented populations seeking to enter the field, increasing the diversity of New York’s healthcare workforce.The Strengthening Community Colleges Training Grants Program aims to help people in marginalized and underrepresented populations overcome barriers to career and technical education programs they need to connect with quality jobs. The DOL awarded $45 million in grants to 13 community colleges, including seven consortium grants and six single institution grants in 12 states, more information can be found here.A copy of Schumer’s original letter of support on behalf of Onondaga Community College appears below:Dear Secretary Walsh:I am pleased to write in support of the application submitted by Onondaga Community College (OCC) application for funding through the Department of Labor’s (DOL) Strengthening Community Colleges Training Grant program.The COVID-19 pandemic created a massive public health crisis and resulted in a disruption of New York State’s Health Care and Social Assistance (HCSA) industry. With funding, OCC plans to partner with other community colleges in the State University of New York (SUNY) system in a five-part plan to strengthen career pathways in the HCSA fields. Partners will; Form a HCSA Community of Practice, Formalize a cross-regional employer engagement team leveraging existing strategic employer partners, Pilot and recommend for adoption of Prior Learning Assessment (PLA) to accelerate HCSA pathways, Develop agreements to create stackable credentials and enhance and accelerate HCSA pathway programs, and introduce evidence-based, equity and industry informed HCSA pathway recruitment materials, resources and career selection supports with public workforce and employer partners.I applaud Onondaga Community College for its foresight and I sincerely hope the application meets with your approval.Thank you for your consideration.Sincerely,### 
                             Please be advised that due to the implementation of enhanced mail screening procedures, all mail sent to my state offices will experience a two to three week delay in delivery.  In the meantime, if you have an urgent matter, the best way to reach me is by phone at (202) 224-6542 or through any of my eight district offices."
https://www.schumer.senate.gov/newsroom/press-releases/schumer-gillibrand-announce-nearly-5-million-in-federal-funding-for-rochester-area-airports_-,"Frederick Douglass, Canandaigua, Penn Yan, and Finger Lakes Regional Airports Will Receive Critical Funds U.S. Senate Majority Leader Chuck Schumer and U.S. Senator Kirsten Gillibrand announced $4,812,354 in federal funding for four Rochester-area airports: Frederick Douglass, Canandaigua, Penn Yan, and Finger Lakes Regional. The funding was allocated through the Federal Aviation Administration’s Airport Improvement Program (AIP), which was bolstered by the Infrastructure Investment and Jobs Act, and will be used to acquire emergency equipment and enhance airfield safety. “This federal investment from the Bipartisan Infrastructure Investment & Jobs Act, which I championed in the Senate, will help airports across the Finger Lakes reach new heights,” said Senator Schumer. “Transportation connections to the wider world are essential for community development and economic opportunity, and I have long been a champion of bringing those connections to Rochester, Penn Yan, and beyond. The funding announced today means opportunities for more jobs, more growth, and more investment in the future. I will always work with the community to fight for Rochester and the Finger Lakes economic take off.”“Airports in and around Rochester serve millions of travelers each year,” said Senator Gillibrand. “They need to be safe, modern, and efficient in order to facilitate tourism and spur local economic growth, and that requires continued upgrades. That’s why I fought to pass the Infrastructure Investment and Jobs Act, which is providing billions in funds for projects like these. It’s time to rebuild our state’s crumbling infrastructure and this is a critical step in the right direction. I’m proud to be delivering these funds and I’ll keep fighting for resources to revitalize our airports, roads, and bridges.” A full list of funding recipients is below: RecipientAmountPurposeFinger Lakes Regional Airport$ 58,500Acquire or rehabilitate emergency generatorCanandaigua$ 177,210Acquire or rehabilitate emergency generatorPenn Yan$ 267,597Acquire aircraft deicing equipmentFrederick Douglass/Greater RochesterInternational$ 2,159,178Rehabilitate taxiwayFrederick Douglass/Greater RochesterInternational$2,149,869Improve and modify access road ###
                             Please be advised that due to the implementation of enhanced mail screening procedures, all mail sent to my state offices will experience a two to three week delay in delivery.  In the meantime, if you have an urgent matter, the best way to reach me is by phone at (202) 224-6542 or through any of my eight district offices."
https://www.schumer.senate.gov/newsroom/press-releases/schumer-gillibrand-announce-over-5-million-in-federal-funding-for-airports-in-central-new-york-and-the-southern-tier,"Greater Binghamton, Syracuse Hancock International, And Elmira/Corning Regional Airports Will Receive Critical Federal Funds U.S. Senate Majority Leader Chuck Schumer and U.S. Senator Kirsten Gillibrand announced $5,422,871 in federal funding for three Central New York and Southern Tier airports: Greater Binghamton, Syracuse Hancock International, and Elmira/Corning Regional. The funding was allocated through the Federal Aviation Administration’s Airport Improvement Program (AIP), which was bolstered by the Infrastructure Investment and Jobs Act, and will be used to revitalize runways and enhance airfield safety. “This federal investment from the Bipartisan Infrastructure Investment & Jobs Act, which I championed in the Senate, will help the Southern Tier and Central New York’s airports reach new heights,” said Senator Schumer. “Transportation connections to the wider world are essential for community development and economic opportunity, and I have long been a champion of bringing those connections to Syracuse, Binghamton, Elmira and beyond. The funding announced today means opportunities for more jobs, more growth, and more investment in the future. I will always work with the community to fight for the Southern Tier and Central New York’s economic take off.”“Central New York and Southern Tier airports serve millions of travelers each year,” said Senator Gillibrand. “They need to be safe, modern, and efficient in order to facilitate tourism and spur local economic growth, and that requires continued upgrades. That’s why I fought to pass the Infrastructure Investment and Jobs Act, which is providing billions in funds for projects like these. It’s time to rebuild our state’s crumbling infrastructure and this is a critical step in the right direction. I’m proud to be delivering these funds and I’ll keep fighting for resources to revitalize our airports, roads, and bridges.” A full list of funding recipients is below: RecipientAmountPurposeGreater Binghamton/Edwin A Link Field$ 422,100Reconstruct airfield guidance signsGreater Binghamton/Edwin A Link Field$ 1,804,921Reconstruct or replace airport lighting vaultSyracuse Hancock International$ 359,325Reconstruct airfield guidance signsSyracuse Hancock International$ 431,234Reconstruct airfield guidance signsElmira/Corning Regional$ 1,538,470Reconstruct taxiwayElmira/Corning Regional$ 866,821Improve/Modify/Rehabilitate ARFF building ###
                             Please be advised that due to the implementation of enhanced mail screening procedures, all mail sent to my state offices will experience a two to three week delay in delivery.  In the meantime, if you have an urgent matter, the best way to reach me is by phone at (202) 224-6542 or through any of my eight district offices."
https://www.schumer.senate.gov/newsroom/press-releases/schumer-gillibrand-announce-over-2-million-in-federal-funding-for-western-new-york-airports-,"Cattaraugus County-Olean and Chautauqua County-Jamestown Airports Will Receive Critical Federal Funds U.S. Senate Majority Leader Chuck Schumer and U.S. Senator Kirsten Gillibrand announced $2,287,974 in federal funding for two Western New York airports: Cattaraugus County-Olean and Chautauqua County/Jamestown. The funding was allocated through the Federal Aviation Administration’s Airport Improvement Program (AIP), which was bolstered by the Infrastructure Investment and Jobs Act, and will be used to conduct repairs and enhance airfield safety. “This federal investment from the Bipartisan Infrastructure Investment & Jobs Act, which I championed in the Senate, will help Western New York’s airports and local economies take off,” said Senator Schumer. “These airports connect businesses and residents and allow economic opportunities to thrive. I am proud I secured this vital funding for the Cattaraugus and Jamestown airports and I’ll continue fighting for the resources they need to fully recover from the impacts of COVID-19 and reach new heights.”“Western New York’s airports are critical aspects of the region’s economy,” said Senator Gillibrand. “They need to be safe, modern, and efficient in order to facilitate tourism and spur local economic growth, and that requires continued upgrades. That’s why I fought to pass the Infrastructure Investment and Jobs Act, which is providing billions in funds for projects like these. It’s time to rebuild our state’s crumbling infrastructure and this is a critical step in the right direction. I’m proud to be delivering these funds and I’ll keep fighting for resources to revitalize our airports, roads, and bridges.” A full list of funding recipients is below: RecipientAmountPurposeCattaraugus County-Olean$ 955,246Rehabilitate taxiwayChautauqua County/Jamestown$ 311,228Acquire snow removal equipmentChautauqua County/Jamestown$ 1,021,500Install perimeter fencing not required by 49 CFR 1542 ###
                             Please be advised that due to the implementation of enhanced mail screening procedures, all mail sent to my state offices will experience a two to three week delay in delivery.  In the meantime, if you have an urgent matter, the best way to reach me is by phone at (202) 224-6542 or through any of my eight district offices."
https://www.schumer.senate.gov/newsroom/press-releases/with-sinking-uss-the-sullivans-behind-him-schumer-launches-three-prong-push-to-secure-federal_and-save-the-historic-ship-,"Last Week, The Beloved WWII Naval Museum Ship Started Sinking After A Serious Hull Breach & Presumed Pump Failure; Schumer Began Working To Develop An All Hands On Deck Approach To Save Buffalo Landmark Senator Says His Plan Is Emergency Lifeboat – A Down Payment– The USS The Sullivan Needs To Begin Work & Set Sail Once Again Schumer: I Am Putting Out An SOS-- Save Our Sullivans-- To Preserve Buffalo Landmark For Generations To ComeAfter the USS The Sullivans tragically began sinking last week, devastating the Buffalo community, U.S. Senate Majority Leader Charles E. Schumer immediately came to Buffalo to launch an all hands on deck 3-pronged plan to secure the federal support needed to begin to save the iconic WWII Buffalo landmark.“I am putting out an SOS to the feds – Save Our Sullivans. This historic landmark is the pride and joy of the Buffalo waterfront, for our veterans and our strong Irish community, and we cannot allow its future to sink any further,” said Senator Schumer. “That is why I am here today to get all hands on deck and launch my push to secure the emergency lifeboats this historic vessel needs to set sail once again and preserve its history and stories for generations to come.”First, Schumer said that he is immediately beginning work on a congressionally directed spending request for funding through the Fiscal Year 2023 omnibus and will be pushing for the maximum eligible amount based off the relevant committee. The senator said that this direct cash infusion would help provide the fiscal relief needed as damage is assessed.Second, Schumer is immediately calling on the Environmental Protection Agency to begin working with local leaders to help address any remaining clean up issues and oil that may be continuing to pollute the waters during the hull breach. Environmental cleanup crews have been working consistently to help mitigate any environmental damage, but Schumer said that the feds need to help in these efforts and to make sure Lake Erie and the harbor remains pristine. Schumer just secured $1 billion for the Great Lakes Restoration Initiative and billions for the EPA’s cleanup programs. He said this massive infusion of funds can help supplement the needs of this emergency cleanup effort in coordination with the New York State Department of Environmental Conservation, and ensure the long-term protection of the waterways. Finally, the senator said that he will be pushing for major increases to the National Maritime Heritage Grant Program in this year’s National Defense Authorization Act (NDAA) so that the USS The Sullivans can not only apply, but receive more funding from the program than ever before. The National Maritime Heritage Grant Program helps celebrate and honor the nation’s maritime legacy by funding projects that boost maritime heritage and fund the preservation of maritime history. Schumer explained that program is currently funded by the sale of obsolete maritime vessels from the Maritime Administration’s (MARAD) National Defense Reserve Fleet (NDRF), and that he has routinely fought for increases to the program, but that the current cap of $5 million on the program’s authorization level must be boosted to help provide large grants. Schumer’s push would authorize an increase in funding available and the senator said he would make additional appeals for the USS The Sullivans to receive the maximum allowable funding given the emergency nature of the situation.Schumer said that collectively these pushes can provide the emergency lifeboat the historic vessel needs as it undergoes repairs, and that he will not stop fighting to secure additional funds to ensure that the story of The Sullivans can continue to inspire the Buffalo community for years to come.Commissioned in 1943, the USS The Sullivans operated in the Pacific Theater during World War II and is one of four remaining Fletcher-class destroyer left in the world. The ship is named in honor of the working-class family that lost all five of its sons during the Naval Battle of Guadalcanal. It was decommissioned in 1965 and donated in 1977 to Buffalo, where it now received designation as a National Historic Landmark and has served as a memorial and museum ship ever since. ###
                             Please be advised that due to the implementation of enhanced mail screening procedures, all mail sent to my state offices will experience a two to three week delay in delivery.  In the meantime, if you have an urgent matter, the best way to reach me is by phone at (202) 224-6542 or through any of my eight district offices."
https://www.schumer.senate.gov/newsroom/press-releases/schumer-gillibrand-jones-announce-over-22-million-in-federal-funding-for-new-york-presbyterian-hudson-valley-hospital-for-covid-response,"NY Hospitals Heroically Responded To COVID Outbreak, Ripping Holes In Their Budgets To Obtain PPE, Cleaning/Disinfecting Facilities, Testing, And More Reps Say FEMA Funding – At A 100% Federal Cost Share – Will Reimburse Hospital For Costs Related to Pandemic Response In Northern WestchesterSchumer, Gillibrand, Jones: Fed Funding Will Keep Hudson Valley Hospital Strong & Communities Safe  U.S. Senate Majority Leader Charles E. Schumer, U.S. Senator Kirsten Gillibrand, and Congressman Mondaire Jones today announced that New York-Presbyterian Hudson Valley Hospital in Cortlandt Manor, New York, will receive $2,223,807 from the U.S. Department of Homeland Security’s Federal Emergency Management Agency (FEMA) to cover costs associated with emergency protective measures taken for their COVID responses. The funds reimburse for expenses related to the purchase of personal protective equipment (PPE), cleaning/disinfecting supplies, and overtime pay for medical staff and nurses to cover hospital COVID units and meet increased patient demand. This funding is provided at a 100% federal cost share, which Schumer fought hard to include for NY since the pandemic began.“The Lower Hudson Valley was one of the first and hardest hit areas in New York and our nation at the start of the pandemic. New York-Presbyterian Hudson Valley Hospital and our frontline health workers heroically stepped up working around the clock and increasing spending, while experiencing significant revenue loss to help New York beat back this virus. I am proud to deliver this vital federal support to help the hospital recover and continue to keep our communities safe,” said Senator Schumer.  “With this funding New York-Presbyterian Hudson Valley Hospital and its incredible workforce will receive the support they need, and so very much deserve, to keep saving lives in northern Westchester County.”“New York-Presbyterian Hudson Valley Hospital incurred enormous costs fighting on the front lines of the pandemic in one of the country’s hardest hit areas,” said Senator Gillibrand. “This funding will reimburse those costs and ensure that the hospital has the resources it needs to continue to provide quality care to New Yorkers. I’m proud to have fought to secure this critical funding and I’ll keep fighting to bring federal resources home to New York.”“I am so proud to have joined my colleagues in securing this vital funding for New York-Presbyterian Hudson Valley Hospital. The pandemic required a massive and sustained response that challenged our health care providers at great expense and, in turn, required a response of equal magnitude from the federal government to meet that challenge.” said Congressman Jones. “We are so fortunate to have New York-Presbyterian Hudson Valley Hospital in our district.” ###
                             Please be advised that due to the implementation of enhanced mail screening procedures, all mail sent to my state offices will experience a two to three week delay in delivery.  In the meantime, if you have an urgent matter, the best way to reach me is by phone at (202) 224-6542 or through any of my eight district offices."
