url,text
https://www.murray.senate.gov/murray-introduces-legislation-to-protect-doctors-from-republicans-anti-abortion-attacks/,"*** WATCH: Senator Murray holds press conference announcing effort to pass bill on floor this week***(Washington, D.C.) – Today, Senator Patty Murray (D-WA), Chair of the Senate Health, Education, Labor, and Pensions (HELP) Committee, Senator Ben Ray Luján (D-NM), Senator Alex Padilla (D-CA), and Senator Jacky Rosen (D-NV) introduced the Let Doctors Provide Reproductive Health Care Act to protect doctors against Republicans’ non-stop attacks and ensure they can safely provide abortion care in states where it is still legal like Washington state. This week, the Senators will take to the Senate floor to seek unanimous consent to pass the legislation.“Doctors shouldn’t be punished for providing their patients with legal abortion care—full stop. The legal threats, the intimidation, and the non-stop attacks from Republicans against abortion providers are unacceptable, and Democrats are fighting back,” said Senator Murray. “This bill is simple: it protects doctors providing legal abortion care, and ensures they can practice medicine and save lives without threat. It’s urgent that we protect the doctors so many women depend on, so this week we’re calling for unanimous consent to get this done—and Republicans will either stand aside so we can pass this bill, or show once and for all that their messaging that they ‘don’t want to punish doctors’ is hollow.”Republicans’ nonstop attacks against women’s reproductive freedom have long targeted doctors, with state laws like Texas’ SB8 allowing for anyone to bring a lawsuit against an abortion provider. But in the wake of theSupreme Court overturning Roe v. Wade, these attacks have ramped up—with Republican state legislators drafting legislation that would make it a crime to perform an abortion on a state resident even in another state where abortion is legal. And already, abortion providers are facing non-stop attacks from Republican politicians, including Dr. Caitlin Bernard—an abortion provider who is facing legal threats after providing legal abortion care to a 10-year-old rape victim who was forced to cross state lines. Dr. Bernard’s case is emblematic of what abortion providers across the country are facing, as Republicans lob legal threats and intimidate doctors providing legal abortion care.The Let Doctors Provide Reproductive Health Care Act will help protect against these attacks, ensuring that providers in states where abortion remains legal are protected from any efforts to restrict their practice or create uncertainty about their legal liability.“As a full-spectrum OBGYN and abortion provider, I wholeheartedly appreciate the Senate’s effort to create legislation that protects our ability to provide important reproductive healthcare for our patients. I have experienced personal and professional harassment for simply doing my job, including inflammatory and intimidating statements from the highest levels of my home state government and threats of violence from people I have never met. This behavior cannot continue,” said Dr. Caitlin Bernard, who has endorsed the legislation. “Living in a state with one of the highest maternal mortality risks and with a severe shortage of OBGYN specialists, I can say firsthand how much people in my state need the care I and other OBGYNs provide. If we do not stop this state-sanctioned harassment, we will lose OBGYNs and health risks will increase substantially. I stand with our Senators to promote the Let Doctors Provide Reproductive Health Care Act to preserve our ability provide important health services in my home state, including abortion care.”“Imagine looking someone in the eye and saying: ‘I have all the skills and the tools to help you, but our state’s politicians have told me I can’t,’” said Dr. Nisha Verma with Physicians for Reproductive Health. “As a doctor, I am being forced to grapple with impossible situations more and more – situations where the laws of my state directly violate the medical expertise I gained through years of training and the oath I took to provide the best care to my patients. I am heartbroken that the people in my communities in the South are not able to access the same quality of care as those living in other parts of the country, not because their doctors don’t have the skills or knowledge to provide that care, but because they are prohibited from doing so by abortion bans that are based solely on politics. Politics. Not medicine.”“Being an abortion provider means being for our communities, supporting them and providing care in the way they want or need. It also means living with the threat of surveillance, harassment, intimidation and violence from those that seek to eliminate abortion access and harm providers of this care. This is our reality,” said Dr. Jamila Perritt, an OBGYN and President & CEO of Physicians for Reproductive Health. “Considering the long history of harm against abortion providers, I am glad to see Congress introducing the Let Doctors Provide Reproductive Health Care Act. Every person – abortion providers, supporters, staff, every person in our community deserves support and protection. We deserve to what we are trained to do: provide comprehensive reproductive health care that patients need without bias, shame, or stigma. We deserve to provide this essential health care without violence or harassment.”The Let Doctors Provide Reproductive Health Care Act will ensure that providers in states where abortion remains legal are protected from any efforts to restrict their practice or create uncertainty about their legal liability. Specifically, the bill will:In addition to Senators Murray, Luján, Padilla, and Rosen, the legislation is also co-sponsored by Senators Schumer (D-NY), Bennet (D-CO), Markey (D-MA), Stabenow (D-MI), Heinrich (D-NM), Blumenthal (D-CT), Wyden (D-OR), Warren (D-MA), Merkley (D-OR), Smith (D-MN), Van Hollen (D-MD), Cardin (D-MD), Menendez (D-NJ), Klobuchar (D-MN), Murphy (D-CT), Reed (D-RI), Cortez Masto (D-NV), Whitehouse (D-RI), Hirono (D-HI), Sanders (I-VT), and Duckworth (D-IL).The bill has been endorsed by: Dr. Caitlin Bernard, Physicians for Reproductive Health, the National Women’s Law Center, the National Family Planning and Reproductive Health Association, Planned Parenthood Federation of America, Catholics for Choice, the National Partnership for Women & Families, the Center for Reproductive Rights, NARAL Pro-Choice America, and the National Council of Jewish Women.Read full text of the legislation here. Read a one-pager here.Senator Murray’s remarks, as prepared for delivery, are below:“Hi everyone, thanks so much for being here today.“And a big thanks especially to Senators Rosen, Luján, and Padilla for their partnership on this bill.“And to my colleague Representative Schrier from my home state of Washington, for leading this legislation in the House.“Our bill—the Let Doctors Provide Reproductive Health Care Act—is really straightforward. It protects doctors providing legal abortion care and ensures they can do their jobs, practice medicine, and save lives without threat of legal action.“No doctor should ever be punished for caring for patients and providing legal abortion care, but that’s exactly what extreme Republicans are doing across the country.“This is the terrifying reality we are living in.“Right now, Republican state lawmakers are drafting legislation that would make it a crime to provide abortion care to a resident even in another state where it’s legal.“That means doctors in Washington state who are just doing their jobs… who are just providing the care that their patients need—care that is legal by the way—could face lawsuits that threaten their practices and their livelihoods.“And make no mistake—Republicans aren’t waiting to pass laws to threaten and intimidate doctors providing abortion care.“Right now, in Indiana, a doctor is being investigated after providing an abortion for a 10-year-old who was raped.“Think about that. A doctor is being investigated after doing their job, after simply providing health care—care that can be lifesaving, care that was entirely legal in her state, care that—up until Republicans’ far-right Supreme Court overturned Roe—was legal across the country.“The fact Dr. Bernard is being investigated, after just doing her job and helping her patient, is chilling.“And it’s just the latest in the parade of atrocities caused by Republicans’ extremism.“And I want to be very clear: while Dr. Bernard’s story may be in headlines across the country: she is not the only doctor facing threats, and she will not be the last.“That’s why I’m so glad to have providers—like Dr. Bernard, and like Dr. Verma, who is with us today—who are willing to speak out and make clear to the world the threat they are facing, and the terrifying stakes if they are prevented from providing the legal reproductive health care that so many women depend on.“That’s why I’m so proud to stand alongside them and make crystal clear that doctors should not be punished.“Republicans like to claim they don’t believe in punishing doctors either: but the threats, the intimidation, the laws they are drafting—they all say otherwise.“So we are going to keep putting them on the record as to where they actually stand.“Which is why this week, Senator Luján, Senator Padilla, Senator Rosen, and I will work to pass the Let Doctors Provide Reproductive Health Care Act. “This is once again a simple bill to address a threat we know is far too real.“This bill will protect doctors providing legal abortion care, and ensure they can practice medicine and save lives without fear of legal threats and intimidation.“It will make clear that the attacks we have seen on doctors are unacceptable. That politicians should not be harassing, scaring, investigating, threatening, or punishing doctors for providing care that is perfectly legal, that patients want, and that—in many cases—is even necessary to save their lives.“So to all the Republicans who have claimed they “don’t want to punish doctors,”“If you want to show that your word is more than another empty talking point, more than another broken promise.“This is a no-brainer—let us pass this bill this week.“But if they don’t—if they block us like they blocked legislation to protect the right to travel across state lines for an abortion, like they blocked legislation to expand family planning services, like they blocked legislation to protect the right to contraceptives—their obstruction will continue to speak louder than any of their hollow claims about caring for patients, families, and women.“And Democrats will continue fighting to protect the rights—and to protect the people—Republicans have put in such grave danger. “Thank you, and now I’ll turn it over to Dr. Verma.”###Sign up to receive Senator Murray’s newsletter and get updates on the workshe’s doing on behalf of Washington state.  "
https://www.murray.senate.gov/senator-murray-secures-nearly-230-million-in-federal-funding-for-washington-state-projects-in-draft-appropriations-bills/,"A full list of local projects that would receive funding from the draft appropriations bills can be found HERESenator Murray: “I listen to people from every part of Washington state, and then I bring their voices with me to make sure that the issues they care about are reflected in the laws we pass here in Congress.”(Washington, D.C.) – Today, U.S. Senator Patty Murray (D-WA), a senior member of the Senate Appropriations Committee, announced that she has secured nearly $230 million in Congressionally-directed spending for Washington state projects in the fiscal year 2023 draft Senate Appropriations bills. The nearly $230 million secured by Senator Murray represents a 98% percent increase over last year and will fund critical projects across the state, create jobs, expand support services, and more. Implementation of Senator Murray’s Congressionally-directed spending requests will be contingent upon passage of the fiscal year 2023 appropriations bill drafts which have been released by the Senate Appropriations Committee.“It’s my job in the Senate to make sure that Washington state’s priorities are the federal government’s priorities. I talk with constituents from every community from every part of our state, and I know the needs of Washington state’s families better than any well-meaning bureaucrat in DC,” said Senator Murray. “Congressionally-directed spending is just another way I can make sure Washington state communities are heard in the other Washington—whether it’s securing direct funding for salmon recovery, affordable housing, or local infrastructure needs. I listen to people from every part of Washington state, and then I bring their voices with me to make sure that the issues they care about are reflected in the laws we pass here in Congress.”Among the projects for which Senator Murray secured funding:The investments secured by Senator Murray will touch every corner of the state and address the issues Washington state families care about most. That includes funding to expand local affordable housing options, major investments in salmon recovery, local infrastructure needs, mental health investments, workforce development programs, support programs for Washington state veterans, and much more.As the second-ranking Democrat on the Senate Appropriations Committee, Senator Murray has been instrumental in securing major federal investments for Washington state priorities. Overall, Senator Murray secured hundreds of millions of dollars in direct funding for local community projects across Washington state. A full list of local projects in Washington state that Murray secured funding for can be found HERE. This past March, in the fiscal year 2022 Senate Appropriations bills, Senator Murray secured more than $116 million in Congressionally-directed spending for local projects across Washington state.###Sign up to receive Senator Murray’s newsletter and get updates on the workshe’s doing on behalf of Washington state.  "
https://www.murray.senate.gov/major-upgrades-expected-for-washington-ports-rivers-salmon-wetlands-as-water-resources-development-act-passes-senate/,"Murray, Cantwell, Push Forward Critical Port, Water and Salmon Projects Today, the Senate passed the Water Resources Development Act (WRDA) of 2022 by a vote of 93-1. U.S. Senators Patty Murray (D-WA) and Maria Cantwell (D-WA) fought to secure language in the bill that would provide funding for critical port, water resource and salmon restoration projects in Washington state. The Senate will now work with the House of Representatives to move a bicameral bill forward to be considered by the House and Senate.“Salmon recovery has got to be a major federal priority—it’s my job to make sure it is and this year’s Water Resources Development Act has us headed in the right direction,” said Senator Murray. “The provisions Senator Cantwell and I fought to secure will go a long way in restoring critical salmon habitat, make important investments our water transportation infrastructure, and helping to ensure every family has access to clean, safe drinking water. This legislation is good news for our salmon, good news for our ports, and good news for our entire state.”“Senate passage of the Water Resources Development Act is a major step forward for Washington state waterways, ports, and salmon,” said Senator Cantwell. “This funding will support key infrastructure projects, like deepening the Blair waterway in Tacoma to increase competitiveness at the port and dredging the Port of Clarkston to boost tourism, it will open more than 100 miles of salmon habitat by constructing fish passage at Howard Hanson Dam, and support water storage innovations, like ground water and aquifer storage. I look forward to ensuring that these and other Washington state projects get underway soon.”Below is a full list of all Washington state projects included in the Senate-passed WRDA Bill:Howard A. Hanson Dam Downstream Fish Passage Facility:WRDA will authorize construction of the Howard A. Hanson Dam Downstream Fish Passage, which will open at least 100 miles of prime salmon and steelhead habitat above the Howard A. Hanson Dam in Pierce County, nearly doubling the amount of habitat currently available. Completing the downstream fish passage facility will also allow the Additional Water Storage Project for the Green River to move forward, ensuring clean water to surrounding communities.Tacoma Harbor Deepening:WRDA will allow the Army Corps to deepen the Blair Waterway at the Port of Tacoma. The current authorized depth of the federal channel in Tacoma’s Blair Waterway does not meet the draft requirements of today’s fleet of larger container ships, which means these ships can’t call on the Port of Tacoma. Deepening the waterway will allow for these ships to call on the Port of Tacoma, creating more economic opportunity for the Port, Seaport Alliance and surrounding community.Dredging at the Port of Clarkston:Directs the Army Corps of Engineers to dredge the Port of Clarkston, ensuring vessels can continue passage. Maintenance of the Snake River between Lewiston, Idaho and Clarkston, Washington is critical to support safe and efficient navigation. Over 8.6 million tons of cargo are moved by barge on the inland portion of the Columbia Snake River System that feeds the deep draft lower Columbia River which transported over 56 million tons of cargo in 2018. In any given year, nearly 10% of the U.S. wheat exports transit the Snake River and the river cruise industry on the Columbia Snake River System provided over 25,000 cruise passengers in 2019, with over $15M in direct economic benefits to the region.Duckabush Estuary Restoration:Directs the Army Corps of Engineers to consider taking further action and providing resources to reconnect the Duckabush River to neighboring floodplains and wetlands by modifying local roads, elevating Highway 101, and rerouting utilities. This is a critical step in the removal and replacement of the Highway 101 causeway and bridges and in the larger Puget Sound Nearshore Restoration Project which is restoring nearshore habitat throughout Puget Sound.Columbia River Treaty Flood ProtectionWRDA directs the Army Corps to study one of the key pillars in the efforts to modernize the Columbia River Treaty regime: flood control in the Columbia River Basin. The Columbia River Basin experiences high annual runoff, variation in flows and a limited amount of water storage in the United States portion of the Columbia River Basin. The WRDA bill authorizes a study to evaluate how to improve water storage and flood control in the Columbia River Basin.Army Corps Aquifer Recharge and Water Supply Conservation: Directs the Army Corps to evaluate alternative water storage processes, such as aquifer recharge and groundwater storage, when addressing flood storage and water conservation projects. This will lead to innovative solutions to water conservation and storage challenges that Washington state and states throughout the West face.Expanding Mitigation Banking:Allows for more entities to use mitigation banking credits and help process mitigation banking credits. A mitigation bank is a wetland, stream, or other aquatic resource area that has been restored, established, enhanced, or preserved for the purpose of providing compensation for unavoidable impacts to aquatic resources when there are port, flood control or water supply projects. This is a big deal for our ports that undertake many types of projects that require mitigation banking to support supply chain efficiency and resilience, safety, job growth, and economic development which benefits the community and promotes stability of the region. Columbia River Village Development Plan:Requires the Army Corps of Engineers to revise and complete the village development plan for Dalles Dam, Columbia River, Washington and Oregon to address the impacts to Indian villages and housing sites that resulted from construction of multiple dams by the Corps in the Columbia River Basin. When the Dalles Lock and Dam in Oregon was constructed in the 1950s, Tribal villages in Celilo, Oregon and Spearfish, Washington were inundated and lost. The Flood Control Act of 1950 authorized the construction of a replacement village to compensate the four Columbia River Treaty Tribes: the Confederated Tribes and Bands of the Yakama Nation; the Confederated Tribes of the Warm Springs Reservation; the Confederated Tribes of the Umatilla Indian Reservation; and the Nez Perce Tribe. Columbia River Ecosystem Restoration Study:Directs the Army Corps to study salmon recovery and restoration throughout the Columbia River Basin and its tributaries.A one-page summary on WRDA 2022 is available HERE, a section-by-section summary is available HERE.###Sign up to receive Senator Murray’s newsletter and get updates on the workshe’s doing on behalf of Washington state.  "
https://www.murray.senate.gov/senator-murray-statement-on-inflation-reduction-act/,"Today, U.S. Senator Patty Murray (D-WA), Chair of the Senate Health, Education, Labor, and Pensions (HELP) Committee, issued the following statement on The Inflation Reduction Act Of 2022.“As prices increase, one of my top priorities is to lower everyday costs for the basics—I’m thinking of the mom in Seattle or Spokane who is figuring out how she’ll pay for her kid’s medication and afford rent this month. People in Washington state and all across the country should never have to choose between their prescription or other basic necessities—because lifesaving drugs don’t do any good if people can’t afford them. This legislation would drastically lower prescription drug costs and finally let Medicare negotiate drug prices—this is a big deal and a huge step forward.“Washington state leads the nation in clean energy investments and climate action—but we can’t tackle the climate crisis alone. This legislation would deliver a landmark federal investment in climate action and clean energy—to help us establish sustainable energy independence, lower energy costs in the long term, and create good-paying jobs everywhere in America and Washington state.“Last year, Democrats took action to lower Americans’ health care premiums by hundreds of dollars a year—this has helped hundreds of thousands of people in Washington state save money on their health care. This package would extend the tax credits that made that possible for three years because no family should have to worry about how they’d cover higher health care costs now, too.“And critically, this legislation is all fully paid for by making sure the very wealthiest and giant corporations simply pay their fair share in taxes.“We absolutely have to deliver on these critical priorities—to save Americans thousands on their prescriptions, lower health care costs, combat climate change before it’s too late, and create a fairer tax system that finally puts working people first—and I’m committed to doing exactly that and passing this legislation as quickly as we’re able to.“But at a moment like this, when child care is already really unaffordable and too hard to find for so many families, with our child care sector on the brink of collapse—and now with Republicans forcing women to give birth no matter their circumstance—it is even more urgent we lower child care costs. The simple reality is that if we don’t act now, the child care crisis will only get worse—so as we fight inflation, we must help parents find and afford the child care they need so they can get back to work, and help child care providers stay in business. Senator Kaine and I have a plan that will lower child care costs for working families, and I’m going to keep fighting to tackle the child care crisis however I can—because we simply can’t leave kids, families, or moms behind.”You can find the one pager for the Inflation Reduction Act of 2022 here, a breakdown of the prescription drug piece here, and the energy security and climate change investments here. ###Sign up to receive Senator Murray’s newsletter and get updates on the workshe’s doing on behalf of Washington state.  "
